Tweet,Fecha,Estado,Locacion,Tipo,Longitud,Latitud,Poblacion
@WarriorAbo En Morelos hay dos Oxxo que se ponen esquites afuera,Mon Oct 05 02:45:30 +0000 2020,Morelos,Jojutla,R,-99.22533,18.602857,123
"Fuimos al malecón y me comí unos tostiesquites , total, gorda ya estoy.",Mon Oct 05 05:03:10 +0000 2020,Sinaloa,Culiacán,R,-107.3420565,24.6624885,0
@UnnaTuitera Tranquila tú sukrol... mejor vete al box o a esa madre qué haces para que desquites tu coraje o lo que… https://t.co/HyAL5bcKnN,Mon Oct 05 19:23:56 +0000 2020,Ciudad de México,Miguel Hidalgo,U,-99.2115105,19.4299345,414470
"Chulada de lunes, por fin encontré por mi casa después de años... ☑️
🌽🤤🌽😍
#Esquites #Elotes #Corn #AntojoMexicano… https://t.co/o347zuME6K",Tue Oct 06 01:21:28 +0000 2020,Ciudad de México,Cuauhtémoc,U,-99.153366,19.432836,545884
#lunesdeesquites ya lo extrañaba don 😅 en Villa Coapa https://t.co/fva5eAOlAR,Tue Oct 06 01:29:42 +0000 2020,Ciudad de México,Tlalpan,R,-99.208364,19.199485,86
"@Radio_Formula El perro que culpa tiene? 
Contrate su propio internet y desquitese con spm.",Tue Oct 06 13:01:13 +0000 2020,México,Ecatepec de Morelos,R,-99.0444445,19.56828,615
En Finlandia no tienen doriesquites por lo tanto no pueden ser el país más feliz del mundo.,Tue Oct 06 18:11:29 +0000 2020,Ciudad de México,Cuajimalpa de Morelos,R,-99.30558049999999,19.318697,728
@saaiza Ya vi y aquí donde ando les dicen por su nombre ESQUITES jajaja,Tue Oct 06 18:42:41 +0000 2020,Michoacán de Ocampo,Maravatío,R,-100.41189999999999,19.894302500000002,18
Pues que hace falta quien venda esquites en Finlandia hace un emprendedor de esquites por allá. 🌽,Tue Oct 06 22:23:24 +0000 2020,Sinaloa,Culiacán,R,-107.3420565,24.6624885,0
@liliteraria A la próxima vamos por esquites a reforma 222 😛,Wed Oct 07 00:02:53 +0000 2020,Ciudad de México,Cuauhtémoc,U,-99.153366,19.432836,545884
Serían más pero mich no come esquites y eso baja el contador en el promedio,Wed Oct 07 00:47:27 +0000 2020,Veracruz de Ignacio de la Llave,Orizaba,R,-97.112844,18.856709,61
"@NidRM ¿30 esquites al año por mexicano? No lo creo. 

Yo tengo otros datos. 😂",Wed Oct 07 01:07:35 +0000 2020,Ciudad de México,Cuauhtémoc,U,-99.153366,19.432836,545884
"@NidRM ¡Obvio! Esquites son muy pocos, fueran elotes bueno... ahí sí le creo que son muchos 30 al año. https://t.co/DGG42B3Djq",Wed Oct 07 01:16:17 +0000 2020,Ciudad de México,Cuauhtémoc,U,-99.153366,19.432836,545884
"Me encanta que vendan esquites en la esquina de donde vivo; bueno eso, donas, tacos, hamburguesas, sushi, birria, d… https://t.co/LP6cgEeJhI",Wed Oct 07 01:31:20 +0000 2020,Ciudad de México,Cuauhtémoc,U,-99.153366,19.432836,545884
Hasta mi depa se está escuchando el señor de los esquites 🥺,Wed Oct 07 03:08:24 +0000 2020,Ciudad de México,Iztapalapa,U,-99.050461,19.342788499999997,1835486
@sana_tu_vida A comer unos esquites con chile y después a las luchas 🤪,Thu Oct 08 19:26:42 +0000 2020,México,Tlalnepantla de Baz,U,-99.1642825,19.543933000000003,658907
"@soypaolalizette Vaaaa, pero me tienes que disparar unos esquites de allá. 🤤",Thu Oct 08 21:24:20 +0000 2020,México,Atizapán de Zaragoza,R,-99.269192,19.564587500000002,13
¿Estaría mejor no ? Que desquiten el sueldo .,Fri Oct 09 00:53:28 +0000 2020,México,Texcoco,R,-98.787435,19.468545499999998,2725
Esquites delicioso,Fri Oct 09 03:00:56 +0000 2020,México,Coacalco de Berriozábal,U,-99.130628,19.6302155,293245
Gracias tostiesquites por existir.😍,Fri Oct 09 03:26:40 +0000 2020,Puebla,Amozoc,R,-98.1542665,19.0322295,616
Estaría bien verga que pasarán taqueros así como pasan los esquites o el del pan :(,Sat Oct 10 19:12:16 +0000 2020,Quintana Roo,Puerto Morelos,R,-87.0316645,21.048719,0
@GabRomerid @SraEsquites U mi gavy.,Sat Oct 10 23:58:55 +0000 2020,Ciudad de México,Benito Juárez,U,-99.1614805,19.380613,434153
Probé unos esquites con camarón en Valle de Bravo 🤩,Sun Oct 11 00:05:41 +0000 2020,México,Valle de Bravo,R,-100.1125095,19.1713575,227
Desquites 🥰,Sun Oct 11 20:40:44 +0000 2020,Puebla,Amozoc,R,-98.1542665,19.0322295,616
Me duele el estómago y estoy pensado en un chicharrón con esquites ☹️,Mon Oct 12 03:30:22 +0000 2020,México,Metepec,U,-99.5799145,19.2515305,11001
"La señora que vende elotes y esquites deliciosos en el mercado de portales, debería de estar en Uber eats o en Rappi. Me haría muy feliz.",Tue Oct 13 00:50:46 +0000 2020,Ciudad de México,Benito Juárez,U,-99.1614805,19.380613,434153
@Rulo94 Ahhh cierto! No pasa de este año y vamos por esquites jajaja,Tue Oct 13 02:26:46 +0000 2020,Ciudad de México,Azcapotzalco,U,-99.18212600000001,19.4857835,432205
"Hola, @evelynesquites ya sé que no usas esto, pero, me gustas muchísimo, me traes loco.",Tue Oct 13 06:02:13 +0000 2020,Chiapas,San Cristóbal de las Casas,R,-92.534411,16.663044499999998,0
"El de los elotes y esquites ya pasa conmigo antes de iniciar su recorridopor toda la colonia.

Eso es hacerla sentir especial a una. 😌",Tue Oct 13 19:59:50 +0000 2020,México,Nezahualcóyotl,R,-99.01701650000001,19.432722,85
El de la camioneta de los elotes y esquites me mira con cara de que soy su gorda favorita.,Tue Oct 13 20:01:22 +0000 2020,México,Nezahualcóyotl,R,-99.01701650000001,19.432722,85
Lo q extraño d chetu son los esquites 😔🥺,Tue Oct 13 20:06:46 +0000 2020,Yucatán,Tekax,R,-89.330077,19.972368,0
Hay esquites oiga!!,Tue Oct 13 22:42:01 +0000 2020,Puebla,Amozoc,R,-98.1542665,19.0322295,616
"Y que en mi epitafio pongan...
I ❤️ Esquites https://t.co/i34PSzBuR2",Tue Oct 13 23:07:26 +0000 2020,Veracruz de Ignacio de la Llave,Boca del Río,U,-96.0989905,19.1431005,132011
@brozoxmiswebs Que lo pague el Partido Morena con su dinero y que desquiten lo cobran sin de vengarlo,Wed Oct 14 00:50:03 +0000 2020,México,Coacalco de Berriozábal,U,-99.130628,19.6302155,293245
Después de un día tan culero unos esquites caen súper ricos. 😋,Wed Oct 14 02:46:56 +0000 2020,Puebla,Amozoc,R,-98.1542665,19.0322295,616
"E  S  Q  U  I  T  E  S    G I G A N T E S  🤤 ✨

• Baty chi
9991482297
#Esquites #Merida https://t.co/Juce8TaLEb",Wed Oct 14 04:24:18 +0000 2020,Yucatán,Mérida,R,-89.62361100000001,20.941035,0
Es increíble como unos esquites pueden mejorar tu día 😁,Wed Oct 14 20:48:22 +0000 2020,México,Nezahualcóyotl,R,-99.087817,19.4320755,0
"Estos Mayas sin cubrebocas y chingándose sus esquites sin miedo a nada... 🤦🏽‍♀️

🤬🤬🤬 ¡¡ VV !! 🤬🤬🤬",Wed Oct 14 22:30:48 +0000 2020,Quintana Roo,Puerto Morelos,R,-87.0316645,21.048719,0
"Lo que sí sabíamos es que lo que le  echan a los chilaquiles, elotes, esquites y sopes callejeros no era queso, no… https://t.co/YWnsAxVBlT",Wed Oct 14 22:49:39 +0000 2020,Ciudad de México,La Magdalena Contreras,U,-99.24800950000001,19.318042,246428
"@borivillegas Va, yo llevo los esquites y el queso de #Chipilo que si es queso!",Thu Oct 15 00:37:59 +0000 2020,Puebla,Cuautlancingo,R,-98.33407249999999,19.0742235,1282
Casi me gano unos tostiesquites en un concurso de cursilerías/ridiculeces,Thu Oct 15 07:20:36 +0000 2020,Sinaloa,Culiacán,R,-107.3420565,24.6624885,0
Pues nos echamos unos esquites tradicionales 🤤🤤🤤🤤 https://t.co/YWtnkeVUkH,Fri Oct 16 01:06:52 +0000 2020,Hidalgo,Mineral de la Reforma,U,-98.778757,20.097382,762
Hoy es jueves de esquites pero estoy a dieta 💔,Fri Oct 16 02:33:14 +0000 2020,Jalisco,Tlajomulco de Zúñiga,R,-103.407581,20.489708999999998,15
@macadena1 @DeniseDresserG @FGRMexico Qué bueno que desquiten el erario que se embolsan. Qué bueno que reconozcan a… https://t.co/bBhodG51q2,Fri Oct 16 15:38:18 +0000 2020,Morelos,Cuernavaca,R,-99.260819,18.933812,78
"Coacoatzintla, elotes, esquites y parrillada para grabar #orgulloveracruzano",Fri Oct 16 19:22:40 +0000 2020,Veracruz de Ignacio de la Llave,Tonayán,R,-96.9469135,19.6788615,121
voy a aprovechar este momento coyuntural de los lácteos para decirles que el queso de los esquites de la cedemequis también sabe a plástico,Fri Oct 16 23:32:47 +0000 2020,Ciudad de México,Coyoacán,U,-99.15234000000001,19.328383000000002,614447
"Comer chalupas, tacos, churros y tostiesquites me encanto!😍 
Tomarme muchas fotos. 
Estar en los fuertes de noche y… https://t.co/iFtNg7sPBg",Sat Oct 17 00:58:09 +0000 2020,Puebla,Amozoc,R,-98.1542665,19.0322295,616
"Sábado de delicioso hoy quiero q se desquiten con mi #chikistrikis aprovechen no es diario 
😈😈😈😈😈😈😈😈😈😈 https://t.co/tsbhDSpCXe",Sat Oct 17 16:09:38 +0000 2020,Yucatán,Mérida,R,-89.62361100000001,20.941035,0
Prueben los esquites https://t.co/fMuHu8fFWa,Sat Oct 17 22:38:14 +0000 2020,Quintana Roo,Benito Juárez,U,-86.874798,21.147225,19789
"Esquites de: Camarón, Tuétano, Poblano, Habanero, Asado... 
#LaEsquinitaDelPlacer https://t.co/17idsgB2fV",Sat Oct 17 23:24:40 +0000 2020,Querétaro,Querétaro,R,-100.4405945,20.7152745,9
"Subo una foto con dos esquites (uno para mi y otro para mi madre) y ya piensan que es para un ligue, bueno fuera que existiera una 😖",Sun Oct 18 02:26:54 +0000 2020,Quintana Roo,Puerto Morelos,R,-87.0316645,21.048719,0
El señor de los esquites no se puso hoy 😭😭😭😭😭,Sun Oct 18 02:43:01 +0000 2020,Ciudad de México,Coyoacán,U,-99.15234000000001,19.328383000000002,614447
Unos ricos esquites con chamorro 🤤🤤🤤🤤 https://t.co/S4P3AMWyVY,Sun Oct 18 04:03:33 +0000 2020,Hidalgo,Mineral de la Reforma,U,-98.778757,20.097382,762
"@SrMoys Yommi, lamproxima me trae unos esquites 😂",Sun Oct 18 04:34:38 +0000 2020,Ciudad de México,Benito Juárez,U,-99.1614805,19.380613,434153
"@danieloso Dejemos de hacerle al loco con eso, de toda la vida sabemos que el ""queso"" de los elotes o esquites no es queso y no la lloramos",Sun Oct 18 14:50:37 +0000 2020,Chihuahua,Juárez,R,-106.568008,31.452274000000003,-
"Aquí con la novedad de que a los esquites también se les dice ""trolelotes"" jijo!!!! 🙉🌽",Mon Oct 19 04:20:00 +0000 2020,Ciudad de México,Cuauhtémoc,U,-99.153366,19.432836,545884
No sé si muero más por algo repleto de chocolate o esquites con takis.,Mon Oct 19 22:45:01 +0000 2020,Hidalgo,Mineral de la Reforma,U,-98.77580800000001,20.1056375,5108
"@MiguelAngelJ7 Debes intentarlo, pero ojo, deben ser esquites ricos y takis fuego. ☝🏼",Mon Oct 19 22:48:03 +0000 2020,Hidalgo,Mineral de la Reforma,U,-98.77580800000001,20.1056375,5108
Se me antojó un sushi y unos esquites ahorita :(,Tue Oct 20 01:14:15 +0000 2020,Sinaloa,Culiacán,R,-107.3420565,24.6624885,0
@aoropeza77 Esquites 🤤🤤🤤🤤🤤,Tue Oct 20 23:57:54 +0000 2020,Ciudad de México,Benito Juárez,U,-99.1614805,19.380613,434153
Preparando unos ricos esquites 🤭 https://t.co/K69AGRADgO,Wed Oct 21 05:35:49 +0000 2020,Hidalgo,Atotonilco de Tula,R,-99.2255645,19.959839,130
No me gustan los esquites 🤡,Wed Oct 21 11:48:02 +0000 2020,Puebla,Amozoc,R,-98.1542665,19.0322295,616
"@JennyN0314 Interesantísimo!...
Por cierto ya viste la serie Resurrección?
Digo para que desquites tus 200 pesos!
(… https://t.co/99IMbeNy3a",Wed Oct 21 20:37:56 +0000 2020,Morelos,Cuernavaca,R,-99.260819,18.933812,78
Tengo mucho antojo de unos esquites 🌽,Thu Oct 22 00:05:07 +0000 2020,Puebla,Amozoc,R,-98.1542665,19.0322295,616
@javierhoy394 @RealMalamen @JulinFloresVzq1 @BaksLive No sean crueles.....no se desquiten así......,Thu Oct 22 00:32:09 +0000 2020,Guerrero,Taxco de Alarcón,R,-99.597545,18.5210245,261
Un like y me compro unos tostiesquites 🌚,Thu Oct 22 01:29:47 +0000 2020,Jalisco,Zapopan,R,-103.48477450000001,20.790657000000003,40
"Pilates, esquites y memela, altamente compatibles. 😝",Fri Oct 23 04:42:44 +0000 2020,Puebla,Amozoc,R,-98.1542665,19.0322295,616
"@guga_mty Soy @Rayados 
Ahora falta que juego con juego lo desquiten y demuestren

Siempre con ellos!!!",Fri Oct 23 10:35:46 +0000 2020,Nuevo León,Apodaca,R,-100.27047400000001,25.736714999999997,0
Fui por mis esquites el día de hoy y me sentí covidiota en la calle 🥺🥺,Sat Oct 24 01:57:01 +0000 2020,Ciudad de México,Miguel Hidalgo,U,-99.2115105,19.4299345,414470
Yo quería unos esquites pequeños pero ósea si me acabe los grandes jajajaa but es viernes https://t.co/rhCOE2LPJC,Sat Oct 24 03:49:27 +0000 2020,México,Naucalpan de Juárez,R,-99.310428,19.473793999999998,149
Junta más gente la seño de los esquites de Polanco que  #LaMarchaDelChillón,Sat Oct 24 23:15:07 +0000 2020,Ciudad de México,Cuauhtémoc,U,-99.153366,19.432836,545884
"Hice esquites y salsita de chile de árbol, me amo mucho. Voy a escuchar lo mejor de La Mano Peluda, QEPD mi JuanRa Sáenz.",Mon Oct 26 00:21:33 +0000 2020,Puebla,Amozoc,R,-98.1542665,19.0322295,616
Esquites con...,Mon Oct 26 00:26:30 +0000 2020,Ciudad de México,Cuauhtémoc,U,-99.153366,19.432836,545884
1. Esquites con...,Mon Oct 26 00:27:01 +0000 2020,Ciudad de México,Cuauhtémoc,U,-99.153366,19.432836,545884
2. Esquites con...,Mon Oct 26 00:27:30 +0000 2020,Ciudad de México,Cuauhtémoc,U,-99.153366,19.432836,545884
"Hola #Xalapa ..
Yo adoro los elotes y lo esquites de los lagos..
La Noticia es... 
Aun de noche está hasta el full… https://t.co/oec1pjyZKu",Mon Oct 26 02:33:21 +0000 2020,Veracruz de Ignacio de la Llave,Xalapa,R,-96.886083,19.542054,0
@AnngelBot Esquites o qué? Jaja,Mon Oct 26 05:36:05 +0000 2020,Puebla,Tehuacán,R,-97.42237349999999,18.4661945,0
Me caga que se desquiten conmigo cuando yo ni en cuenta,Mon Oct 26 19:54:19 +0000 2020,Tamaulipas,Ciudad Madero,U,-97.8225365,22.283026,205933
Como extrañaba estos esquites 🤤,Tue Oct 27 02:28:57 +0000 2020,Veracruz de Ignacio de la Llave,Xalapa,R,-96.886083,19.542054,0
Quiero unos esquites y por mi colonia popular no venden 😖😭,Tue Oct 27 05:16:11 +0000 2020,Ciudad de México,Cuauhtémoc,U,-99.153366,19.432836,545884
Hoy habia esquites a la hora de la comida pero no tenian mayonesa ni chilito para ponerles... asi no se puede 😑,Wed Oct 28 00:02:25 +0000 2020,Ciudad de México,Benito Juárez,U,-99.1614805,19.380613,434153
@ElRancheroLoco Esquites en el malecón frente a las escolleras. Justo al ladito del río,Wed Oct 28 00:04:05 +0000 2020,Coahuila de Zaragoza,Saltillo,R,-101.166961,25.0326315,97
Qué ganas de unos tostiesquites con harto chilito del que pica.,Wed Oct 28 00:33:24 +0000 2020,Puebla,Amozoc,R,-98.1542665,19.0322295,616
Estoy esperando un paquete 🎁 de Amazon y vivo con el miedo de ir por unos esquites y que no haya nadie para recibirlo ☹️,Wed Oct 28 01:18:47 +0000 2020,México,Tlalnepantla de Baz,U,-99.1158905,19.518656,13030
"En un juego largo 
Hay desquite 
Tu tranquila",Wed Oct 28 03:22:52 +0000 2020,Ciudad de México,Miguel Hidalgo,U,-99.2115105,19.4299345,414470
Quiero unos esquites 😵,Wed Oct 28 05:24:36 +0000 2020,Ciudad de México,La Magdalena Contreras,U,-99.24800950000001,19.318042,246428
"@GARCIPAVON Bien!!! Haganlos rabiar, que desquiten la paga de nuestro dinero",Thu Oct 29 00:03:03 +0000 2020,Veracruz de Ignacio de la Llave,Xalapa,R,-96.886083,19.542054,0
"Todos tienen sus propios problemas, solo trata de ser buena persona y no te desquites con nadie",Thu Oct 29 17:32:55 +0000 2020,Puebla,Amozoc,R,-98.1542665,19.0322295,616
Cuando escucha pasar al de los esquites 🤪 https://t.co/sykrmVDxfb,Fri Oct 30 23:45:56 +0000 2020,Veracruz de Ignacio de la Llave,Boca del Río,U,-96.0989905,19.1431005,132011
Así la comida de hoy !! Ya es viernes y a seguir trabajando !! Que les parece si preparamos esquites ? Total ya est… https://t.co/1qh9LNKwNp,Sat Oct 31 01:06:18 +0000 2020,Ciudad de México,La Magdalena Contreras,U,-99.24800950000001,19.318042,246428
"Los mejores #esquites los de #Veracruz, sigamos en la degustación de antojitos.",Sat Oct 31 02:05:19 +0000 2020,Veracruz de Ignacio de la Llave,Tierra Blanca,R,-96.3057195,18.5272195,65
Algún día voy a poner un sushi o unos esquites 😍,Sun Nov 01 21:16:28 +0000 2020,Sinaloa,Culiacán,R,-107.3420565,24.6624885,0
Voy a seguir imaginando mi puesto de esquites https://t.co/6SL3s3SNh0,Sun Nov 01 21:53:03 +0000 2020,Sinaloa,Culiacán,R,-107.3420565,24.6624885,0
"Ya triunfe, tengo el número del señor de los esquites y tiene servicio a domicilio 😍😍 https://t.co/GqCSBWLlXH",Mon Nov 02 00:17:01 +0000 2020,Ciudad de México,La Magdalena Contreras,U,-99.24800950000001,19.318042,246428
"Jajajajajjaaj el chisme en el gripo de los vecinos esta bueno, aquí seguimos con los esquites https://t.co/H8QBB99x9d",Mon Nov 02 07:05:56 +0000 2020,Veracruz de Ignacio de la Llave,Medellín de Bravo,R,-96.15278500000001,19.0155025,5
quien una date para ir por uno de estos esquites a lomas ? https://t.co/iGgrHtjJJT,Tue Nov 03 22:43:53 +0000 2020,Puebla,Puebla,R,-98.175374,19.007274,1805
"Me urgen unos esquites de Puebla, no esas cosas de ""elote en vaso"".",Wed Nov 04 03:28:50 +0000 2020,Querétaro,Querétaro,R,-100.4405945,20.7152745,9
@lorel_ga Unos esquites por que el elote no lo puedo morder por los brackets https://t.co/286A4p1Uu8,Wed Nov 04 05:51:16 +0000 2020,México,Ixtapaluca,R,-98.7972475,19.359356,550
A ver a qué hora empieza a vender esquites afuera del HGA🙄,Thu Nov 05 22:11:54 +0000 2020,Guerrero,Acapulco de Juárez,R,-99.73564950000001,16.9589495,5
"Que se desquiten con López, no con México.  López NO ES México !",Fri Nov 06 15:21:18 +0000 2020,Ciudad de México,Miguel Hidalgo,U,-99.2115105,19.4299345,414470
"Unos esquites con chamorro para comer aquí.
#esquitescontuetano #zonaplateada https://t.co/ihEJp74S9a",Sat Nov 07 03:10:54 +0000 2020,Hidalgo,Mineral de la Reforma,U,-98.778757,20.097382,762
"Ya conoces Maíz Romita? 🌽🤤🤤
Te van a encantar!!!

Encuéntranos en DidiFood 
Maíz Romita
#esquites #snack #comida… https://t.co/ceWkCSRdHT",Sun Nov 08 00:25:24 +0000 2020,Ciudad de México,Coyoacán,U,-99.1525965,19.3206955,614447
"Igual les dije, Cruz Azul le tiene mucho miedo al America, no vaya a ser que se desquiten en liguilla",Sun Nov 08 04:35:48 +0000 2020,Jalisco,Tlajomulco de Zúñiga,R,-103.407581,20.489708999999998,15
"@Geizenverg_2 Tus nalgas, aquí es esquites y nos vlv",Sun Nov 08 05:44:21 +0000 2020,Sinaloa,Culiacán,R,-107.3420565,24.6624885,0
"Que pinche coraje, siempre lo mismo aquí en los esquites https://t.co/EmaCHZEuNr",Mon Nov 09 00:02:12 +0000 2020,Sinaloa,Culiacán,U,-107.39364,24.789839,808416
@ServicioCAPP Cometé unos esquites por mi 😁,Mon Nov 09 01:53:05 +0000 2020,Chiapas,San Fernando,R,-93.20642749999999,16.912427,8
Desde que comprendí que con 50 pesos me puedo hacer esquites como para 4 días deje de comprar vasitos de a 25 pesos!!!,Mon Nov 09 04:02:20 +0000 2020,Ciudad de México,Tlalpan,R,-99.208364,19.199485,86
Jony esquites con cacahuate 😋😋😋 https://t.co/OBnUtWCO58,Tue Nov 10 01:06:19 +0000 2020,Ciudad de México,Miguel Hidalgo,U,-99.168321,19.406592,414470
Me voltea a ver mi mamá en la comida y me dice: ¿Al ratito esquites con takis? 👀 jajajaja la amo,Tue Nov 10 01:34:13 +0000 2020,Hidalgo,Mineral de la Reforma,U,-98.77580800000001,20.1056375,5108
@AdrinkFG Chalupitas y esquites 😍,Tue Nov 10 01:55:09 +0000 2020,Ciudad de México,Cuauhtémoc,U,-99.153366,19.432836,545884
Cuando decides hacer la engordación 🔥 los mejores esquites de tuetano del mundo en Parque Centro Cultural SCOP https://t.co/jmHbfw9Ig1,Tue Nov 10 04:35:09 +0000 2020,Ciudad de México,Tlalpan,R,-99.208364,19.199485,86
"@Mario_LlanesS Vamos jaja están por la quetzalcoatl, como por el bodega ahorrera de por ahí, o vamos por esquites jajaja",Tue Nov 10 22:31:24 +0000 2020,Yucatán,Mérida,R,-89.62361100000001,20.941035,0
"¡Ricos y deliciosos..... a domicilio! 
¡Hasta tu cocina!

👇🏼 
(No les pasa que de tanto vender elotes/esquites ya n… https://t.co/GmrQSYcuKp",Wed Nov 11 00:43:00 +0000 2020,Puebla,Atlixco,R,-98.436434,18.909954,48
"Pídelos por @RappiMexico 
Esquites Maíz Romita, te van a encantar!!! 🌽🌽🌽🤤🤤🤤
#esquites #snack #postre… https://t.co/yQeUl4ReXl",Wed Nov 11 02:24:20 +0000 2020,Ciudad de México,Miguel Hidalgo,U,-99.162841,19.405873,414470
Si me ven denme para unos tostiesquites https://t.co/pmHv2p21GL,Wed Nov 11 21:40:46 +0000 2020,Sinaloa,Culiacán,R,-107.3420565,24.6624885,0
"Unos esquites con chamorro y los acompañamos con u  rico café ☕. 

Aquí atienden bien a los clientes.… https://t.co/E2wbTKe0Cs",Thu Nov 12 04:28:32 +0000 2020,Hidalgo,Mineral de la Reforma,U,-98.778757,20.097382,762
@katiacastillol @DiputadosMorena Dejen ya de hacerse pendejos y desquiten el sueldazo que les pagamos volteen a ver… https://t.co/DVvKhyaCiE,Thu Nov 12 04:36:17 +0000 2020,México,Toluca,U,-99.60504750000001,19.326146,22574
Qué pedo con los esquites de 40 varos en Bernal? Quién desgranó el elote o qué chingados?,Fri Nov 13 00:48:32 +0000 2020,Querétaro,Colón,R,-100.09964,20.75001,187
Ay ya al diablo pedí esquites con todo https://t.co/7cXzpEqefh,Fri Nov 13 01:23:11 +0000 2020,Ciudad de México,Benito Juárez,U,-99.1614805,19.380613,434153
@Aguilar_nt Primero la tarea pa que te desquites con Lol jajaja,Fri Nov 13 14:48:17 +0000 2020,Tamaulipas,Victoria,R,-99.187904,23.685934,0
"Se extraña caminar por la Alameda por la noche, peleando con el de los esquites porque no le quiere poner más mayon… https://t.co/5izDv6An7O",Fri Nov 13 17:58:31 +0000 2020,Ciudad de México,Cuauhtémoc,U,-99.153366,19.432836,545884
"#FelizSabado bueno eso fue mi comida de ayer 😁 un gran placer poder comer estos ricos esquites
#BuenosDiasATodos https://t.co/jD72GvEzbn",Sat Nov 14 15:22:51 +0000 2020,Tlaxcala,Tocatlán,R,-98.021925,19.4136875,6
@XtremeThePlayer Esquites y una chela. ¿Va?,Sat Nov 14 23:22:02 +0000 2020,Puebla,Amozoc,R,-98.1542665,19.0322295,616
Estas tranquilo por ya tragaste tus croquetas.sigue escribiendo para que desquites la racion que vas a llevar a tu… https://t.co/DXPDk4GtgP,Tue Nov 17 13:36:12 +0000 2020,Tamaulipas,Matamoros,R,-97.547392,25.558993,0
Quiero unos esquites 🥺,Wed Nov 18 00:32:14 +0000 2020,México,Tlalnepantla de Baz,U,-99.1642825,19.543933000000003,658907
Dejaremos este feo 2020 atrás comiendo felices unos esquites y unas marquesitas en el Parque de las Américas 🌽,Wed Nov 18 23:15:45 +0000 2020,Yucatán,Mérida,R,-89.62361100000001,20.941035,0
Pronto estaremos comiendo esquites y marquesitas en el Parque de las Américas dejando todo esto del covid atrás.,Wed Nov 18 23:17:25 +0000 2020,Yucatán,Mérida,R,-89.62361100000001,20.941035,0
"@BetoCorneelio Hay varios puestos de tacos por ahí, de guisado, de asada, esquites y de más 🧐 sal a dar la vuelta!",Wed Nov 18 23:48:38 +0000 2020,Tabasco,Nacajuca,R,-92.9164995,18.0219595,432
Quien se le antoja unos esquites calientitos preparados para este frío?! Maíz Romita 🌽 . Encuéntranos en Rappi… https://t.co/QCbonN19ue,Thu Nov 19 00:38:27 +0000 2020,Ciudad de México,Cuauhtémoc,U,-99.153366,19.432836,545884
"🌽🌽🌽🌽🌽🌽🤤🤤🤤🤤🤤🤤
Ya conoces Maíz Romita?. Te van a encantar!!!!
#esquites #maiz #snack #hambre #jueves #frio #laroma… https://t.co/fEtvMUTF4G",Fri Nov 20 02:11:43 +0000 2020,Ciudad de México,Cuauhtémoc,U,-99.153366,19.432836,545884
"VIERNES DE MAÍZ ROMITA !!!! 🌽🌽🌽🌽🤤🤤🤤
Encuéntranos en Rappi y DidiFood 
#ESQUITES #SNACK #MAÍZ #POSTRE #FOOD #COMIDA… https://t.co/m5Er0uO7Nb",Sat Nov 21 00:24:18 +0000 2020,Ciudad de México,Cuauhtémoc,U,-99.153366,19.432836,545884
"Muy ricos, caminata nocturna con recompensa 😋🌽 en Elotes Y Esquites Don Maurilio https://t.co/zk12fpX9m2",Sat Nov 21 03:09:55 +0000 2020,Hidalgo,Ixmiquilpan,R,-99.1877665,20.545447000000003,138
Esquites con camarón.. Maravillas de la vida.. https://t.co/z6nm5nAr3y,Sat Nov 21 23:10:32 +0000 2020,México,Valle de Bravo,R,-100.1125095,19.1713575,227
"@pedrocheco @javieraparicio Hasta sábado trabajan los defensores de AMLO, que desquiten sus becas",Sat Nov 21 23:27:16 +0000 2020,Campeche,Campeche,R,-90.27714,19.601414,0
"Que tal unos #esquites para la botana viendo la #NFL 
Encuéntranos en Rappi #MaizRomita
#esquites #snack #maruchan… https://t.co/M6ym3iuhXl",Mon Nov 23 00:28:35 +0000 2020,Ciudad de México,Cuauhtémoc,U,-99.153366,19.432836,545884
Esquites con camarón 😆 en Lagos de Puente Moreno https://t.co/v6RubnJ65D,Mon Nov 23 02:28:58 +0000 2020,Veracruz de Ignacio de la Llave,Medellín de Bravo,R,-96.15278500000001,19.0155025,5
Quiero esquites de Sanja🙁,Tue Nov 24 01:59:36 +0000 2020,Hidalgo,Mineral de la Reforma,U,-98.77580800000001,20.1056375,5108
"@FanitaMrn Yo me llevo el puesto con todo lo que me hizo mi ex 😂

Yo contando mis tragedias de a gratis y ahí regalándote esquites 😂",Tue Nov 24 18:32:57 +0000 2020,Guanajuato,León,R,-101.601401,21.09806,3
Pidan sus ricos y deliciosos chilaquiles ( léase  cantadito como el audio de triciclo  de los esquites con harto li… https://t.co/cyq7DqawyV,Tue Nov 24 22:55:24 +0000 2020,Ciudad de México,Cuauhtémoc,U,-99.153366,19.432836,545884
"Estamos recibiendo sus pedidos! 
Encuéntranos en Rappi y DidiFood 🛵
Maíz Romita 🌽🤤
#esquites #snack #postre #comida… https://t.co/Ek2ndMX4nV",Wed Nov 25 01:06:59 +0000 2020,Ciudad de México,Cuauhtémoc,U,-99.153366,19.432836,545884
que antojo de unos esquites 🥺,Wed Nov 25 03:44:03 +0000 2020,Querétaro,Querétaro,R,-100.4405945,20.7152745,9
"Ay, quiero unos esquites 🤤",Wed Nov 25 04:06:48 +0000 2020,Ciudad de México,Cuauhtémoc,U,-99.153366,19.432836,545884
"Famosísimos esquites de tuétano #yumi (@ Esquites Don Josué in Ciudad de México, Distrito Federal) https://t.co/IJZC4wn8xv",Wed Nov 25 23:50:28 +0000 2020,Ciudad de México,Benito Juárez,U,-99.1614805,19.380613,434153
"@Pellomaldonado Ya es tiemoo que desquiten los Quiñones, tienen el tiempo en contra en Tigres... Ya estan debiendo.",Thu Nov 26 23:16:30 +0000 2020,Nuevo León,Monterrey,U,-100.29359149999999,25.6417185,1142952
