Tweet,Fecha,Estado,Locacion,Tipo,Longitud,Latitud,Poblacion
@_Eilian Hay que ir a los elotes y esquites con tuétano de xola y eje central.,Wed Jun 30 00:57:41 +0000 2021,Ciudad de México,Iztapalapa,U,-99.050461,19.342788499999997,1835486
"Nomás falta que le pongan iluminación y un kiosko donde se vendan café, refrescos, tortas, esquites y chamoyadas…es… https://t.co/bN7LjVqDZo",Wed Jun 30 16:35:32 +0000 2021,Sinaloa,Culiacán,R,-107.3420565,24.6624885,0
Es de las mías prefiero mil veces unos esquites 😋😋😋🤤🤤🤤🤤,Thu Jul 01 01:10:20 +0000 2021,Puebla,Cuautlancingo,R,-98.33407249999999,19.0742235,1282
@Hetfieldxnmacca Esquites con doritos con litros de salsa y queso 🤩🤩🤩🤩🤮,Thu Jul 01 21:30:17 +0000 2021,Ciudad de México,Tlalpan,R,-99.208364,19.199485,86
Como que ya se tardaron mucho con el mapa de esquites de Culiacán,Sat Jul 03 09:29:15 +0000 2021,Sinaloa,Culiacán,R,-107.3420565,24.6624885,0
De tostiesquites 😋🌝. @tessaaaperez,Sat Jul 03 23:49:40 +0000 2021,Puebla,San Martín Texmelucan,R,-98.42957299999999,19.2652435,25
Mi hermana me trajo unos doriesquites a mi aislamiento. 🥺🥰,Sun Jul 04 03:17:45 +0000 2021,México,Naucalpan de Juárez,R,-99.310428,19.473793999999998,149
"😍 (@ Los esquites de Tamulté - @esquitestamulte in Villahermosa, Tabasco) https://t.co/zsNe9rjFDV",Mon Jul 05 01:14:46 +0000 2021,Tabasco,Nacajuca,R,-92.9164995,18.0219595,432
Doriesquites para la felicidad. ✨🥰 https://t.co/kJQKWLeD7k,Wed Jul 07 00:16:10 +0000 2021,Morelos,Cuernavaca,R,-99.260819,18.933812,78
@Eltio_Concho Como supiste que le digo esquites a los elotes en vaso?,Wed Jul 07 00:43:02 +0000 2021,Nuevo León,Apodaca,R,-100.27047400000001,25.736714999999997,0
"Si andan encabronados con la vida , no se desquiten con la personas que los saludan, no mamen",Wed Jul 07 23:04:58 +0000 2021,Chihuahua,Hidalgo del Parral,R,-105.6835535,27.1164905,4
Esquites con sopa maruchan cheeeeeeeeeck ✅,Thu Jul 08 00:50:47 +0000 2021,Ciudad de México,Cuauhtémoc,U,-99.153366,19.432836,545884
Me doy asco por decir esto pero cómo se me pinches antojan unas de esas sopas maruchan con esquites y todo lo demás… https://t.co/TS7P4vS2q8,Thu Jul 08 01:16:00 +0000 2021,México,Tlalnepantla de Baz,U,-99.1158905,19.518656,13030
"@EquisSoyActriz En SLP le llaman troles a los esquites con tostitos, ay bien ricos todos",Thu Jul 08 01:22:50 +0000 2021,Ciudad de México,Cuauhtémoc,U,-99.153366,19.432836,545884
"@MorraSadEnBici Siiii neta ufff, compré los esquites y me hice una maruchan. Hazloooo",Thu Jul 08 01:23:25 +0000 2021,Ciudad de México,Cuauhtémoc,U,-99.153366,19.432836,545884
"I'm at Esquites Plaza Las Américas in Cancún, Quintana Roo https://t.co/2cYG8xUT3S",Thu Jul 08 02:07:43 +0000 2021,Quintana Roo,Puerto Morelos,R,-87.0316645,21.048719,0
Me comí unos esquites con salsa habanero y olv 🤤,Sat Jul 10 02:44:48 +0000 2021,Hidalgo,Ixmiquilpan,R,-99.1877665,20.545447000000003,138
No saben el poder que te dan los amigos y unos esquites para reiniciarte la vida.,Sat Jul 10 03:03:05 +0000 2021,México,Toluca,U,-99.655676,19.284321499999997,33089
"Quesadilla de maíz azul, huitlacoche, esquites tatemados, brotes de rabano, salsa de cenizas. 

@chef_thiagodasilva… https://t.co/Eit0fj8Gn5",Sat Jul 10 19:54:06 +0000 2021,Jalisco,Tequila,R,-103.78808649999999,21.1168495,4
"Quesadilla de tripitas fritas de hongos, esquites tatemados, puré de frijol, brotes de cebolla y tortilla de maíz c… https://t.co/QCFECJFcjw",Sun Jul 11 15:09:31 +0000 2021,Jalisco,Tequila,R,-103.78808649999999,21.1168495,4
Que ganas de unos esquites con chapulines asados :(,Tue Jul 13 02:27:37 +0000 2021,Hidalgo,Mineral de la Reforma,R,-98.7155595,20.053718500000002,1457
¿Cómo le hacen los señores de los esquites para que un limón sea la dosis correcta de acidez?,Tue Jul 13 02:31:24 +0000 2021,Ciudad de México,Benito Juárez,U,-99.1614805,19.380613,434153
"fui por esquites en vaso, me compre un té, papitas y estuvo deli",Wed Jul 14 02:32:24 +0000 2021,Ciudad de México,Benito Juárez,U,-99.1614805,19.380613,434153
"@dannaradilla_ Esquites atrás de la catedral, OBVIO con la primer señora lit pegada a la barda de la esquina y los… https://t.co/lfxFiLJbUN",Wed Jul 14 04:23:08 +0000 2021,Guerrero,Acapulco de Juárez,R,-99.73564950000001,16.9589495,5
"@julioastillero @LillyTellez Te traen trabajando duro Julio, el kks quiere que desquites el chayote, tu chayote rep… https://t.co/pZVQiZJWXa",Fri Jul 16 20:44:16 +0000 2021,Baja California,San Quintín,R,-115.5798785,30.156488499999995,4
"Yo: y si me invitas un esquite? 
También yo: pues vamos!",Sat Jul 17 01:11:30 +0000 2021,Quintana Roo,Puerto Morelos,R,-87.0316645,21.048719,0
Ayñ seme antojaron unos esquites :(,Sun Jul 18 00:24:47 +0000 2021,Ciudad de México,La Magdalena Contreras,U,-99.24800950000001,19.318042,246428
Doriesquites sin pensarlo https://t.co/PTivFrFJVJ,Mon Jul 19 19:04:42 +0000 2021,Querétaro,Querétaro,R,-100.4405945,20.7152745,9
"I'm at Esquites Univerdidad in México, D.F. https://t.co/YGnUrnrMQ6",Tue Jul 20 01:00:45 +0000 2021,Ciudad de México,Benito Juárez,U,-99.1614805,19.380613,434153
Hice esquites https://t.co/Eq9Z7gTz1s,Tue Jul 20 01:52:26 +0000 2021,Ciudad de México,Iztapalapa,U,-99.050461,19.342788499999997,1835486
"@franco_esca Esquites o Ezquites proviene del náhuatl Ízquitl, de Icehqui 'tostar (en comal)' Los esquites son un a… https://t.co/w6IcaqZTFs",Tue Jul 20 02:57:22 +0000 2021,Hidalgo,Mineral de la Reforma,R,-98.7155595,20.053718500000002,1457
Es feo que se desquiten contigo creo que voy haciendome la idea de mi retiro,Tue Jul 20 06:00:17 +0000 2021,México,Ixtapaluca,R,-98.7972475,19.359356,550
"I'm at Esquites Blockbuster in Naucalpan de Juárez, Estado de México https://t.co/72smexQ8A3 https://t.co/GcxCVuee9s",Wed Jul 21 01:23:58 +0000 2021,México,Naucalpan de Juárez,R,-99.310428,19.473793999999998,149
"Deberían vender esquites 24/7

No que tengo que esperar hasta las 4pm que llegue la señora a poner su puesto  ☹️",Wed Jul 21 16:52:53 +0000 2021,Chiapas,San Fernando,R,-93.20642749999999,16.912427,8
"@datavizero Elotes y Esquites Don Poldo 🌽👌🏼🤤 
https://t.co/KSHALpsA79",Wed Jul 21 18:57:35 +0000 2021,Ciudad de México,Azcapotzalco,U,-99.18212600000001,19.4857835,432205
@edaliqilinda Uyyyy pase hace rato por los esquites pero … tenía sushi en casa.,Thu Jul 22 03:20:20 +0000 2021,Ciudad de México,Tlalpan,R,-99.208364,19.199485,86
@markankun Que no sea esquites jajaja,Thu Jul 22 22:37:06 +0000 2021,Quintana Roo,Puerto Morelos,R,-87.0316645,21.048719,0
Los mejores doriesquites de mi vida.,Fri Jul 23 01:34:13 +0000 2021,Morelos,Cuernavaca,R,-99.260819,18.933812,78
Los esquites por donde vivo son los más ricos🤤🤤,Fri Jul 23 03:22:26 +0000 2021,Veracruz de Ignacio de la Llave,Boca del Río,U,-96.0989905,19.1431005,132011
Vamos a una degustación de esquites de sabores 🌽,Fri Jul 23 18:07:48 +0000 2021,Querétaro,Ezequiel Montes,R,-99.945289,20.749296,0
@ranantro @VialidadXalapa @EsquitesN @VisitXalapa Véndelas en el comedor del ORFIS,Fri Jul 23 22:04:23 +0000 2021,Veracruz de Ignacio de la Llave,Boca del Río,U,-96.0989905,19.1431005,132011
"I'm at Los esquites de Tamulté - @esquitestamulte in Villahermosa, Tabasco https://t.co/9G0qjczsts https://t.co/Td5gbqKjkV",Sat Jul 24 01:39:46 +0000 2021,Tabasco,Nacajuca,R,-92.9164995,18.0219595,432
#Sábado de consentirse con unos mezcales y unos esquites de comida. https://t.co/cuYeTg2BgH,Sat Jul 24 23:04:02 +0000 2021,Ciudad de México,Cuauhtémoc,U,-99.153366,19.432836,545884
#Sábado de consentirse con unos mezcales y unos esquites de comida. https://t.co/eYTh2VKBSo,Sat Jul 24 23:16:44 +0000 2021,Ciudad de México,Cuauhtémoc,U,-99.153366,19.432836,545884
"¿Unos esquites? 
¡Unos esquites! https://t.co/RNFtkiLDn5",Sun Jul 25 01:09:59 +0000 2021,México,Acambay de Ruíz Castañeda,R,-100.001581,20.037886,76
"@pinchehippie Un albergue de gatos y perros, esquites y tacos de por vida Y un buen negocio (esquites o tacos ja)",Sun Jul 25 13:23:28 +0000 2021,Ciudad de México,Cuauhtémoc,U,-99.153366,19.432836,545884
Momma quería ir por unos esquites saliendo de trabajar y ya se soltó la lluvia 🥲😭😭😭,Sun Jul 25 21:38:07 +0000 2021,Hidalgo,Mineral de la Reforma,U,-98.77580800000001,20.1056375,5108
Felicidad? Tener Tostitos y esquites gratis. 😍🤭🌽,Tue Jul 27 02:09:30 +0000 2021,Tabasco,Nacajuca,R,-92.9164995,18.0219595,432
"La noche, una vuelta en carrito de golf, esquites y tú. https://t.co/VWAx5kNVd8",Tue Jul 27 15:03:07 +0000 2021,Quintana Roo,Isla Mujeres,R,-87.0541055,21.402667,3
"La noche, una vuelta en carrito de golf, esquites y tú. https://t.co/1qg8r7WDNq",Tue Jul 27 15:09:06 +0000 2021,Quintana Roo,Isla Mujeres,R,-87.0541055,21.402667,3
Es que hasta los esquites no tienen el mismo sabor que en Veracruz,Tue Jul 27 20:46:38 +0000 2021,Querétaro,Querétaro,R,-100.4405945,20.7152745,9
Esquites para la ansiedad 🙃 https://t.co/8ggAyYwb7c,Wed Jul 28 02:13:21 +0000 2021,México,Naucalpan de Juárez,R,-99.310428,19.473793999999998,149
Unos doriesquites 🤤,Wed Jul 28 15:19:46 +0000 2021,Puebla,Huauchinango,U,-98.053888,20.1744365,58957
Esquites para el corazón 🥰😍,Thu Jul 29 02:19:44 +0000 2021,México,Metepec,U,-99.5799145,19.2515305,11001
"I'm at Elotes Y Esquites ""La Joya"" https://t.co/LqQ42fkJJr https://t.co/GXosMJmGwP",Thu Jul 29 03:25:24 +0000 2021,Ciudad de México,Xochimilco,R,-99.08179,19.236244499999998,123
@mestizo.mxl #mexicali #foodporn #baja #granvia #esquites #coldebruselas #tuetano en Mestizo https://t.co/2nfTXQLRpn,Thu Jul 29 10:50:29 +0000 2021,Baja California,Mexicali,R,-115.22918000000001,31.789669500000002,19
Hoy toco preparar unos ricos esquites para la casa... El que se atreva a decirle elote en caso le rompo las piernas. https://t.co/1jApHTlzDx,Fri Jul 30 17:59:23 +0000 2021,Ciudad de México,Benito Juárez,U,-99.1614805,19.380613,434153
"Les tengo una consulta que no gasta dinero público a lo pendejo y en la que si van a querer participar.

Los esquites van con:",Sat Jul 31 23:55:33 +0000 2021,Yucatán,Mérida,R,-89.62361100000001,20.941035,0
"Yo solo quiero llorar y comer esquites asados grandes con todo, con chile del preparado y del que pica.",Sun Aug 01 01:12:00 +0000 2021,México,Tlalnepantla de Baz,U,-99.1158905,19.518656,13030
Esquites con mollejas y se te reinicia la vida 🤤,Sun Aug 01 02:21:17 +0000 2021,Ciudad de México,Xochimilco,R,-99.08179,19.236244499999998,123
"Podria vivir a base de esquites y pastas, sería eternamente feliz! 🙌",Tue Aug 03 01:53:51 +0000 2021,Yucatán,Mérida,R,-89.62361100000001,20.941035,0
Quiero un esquites 🤤,Tue Aug 03 23:46:43 +0000 2021,Nuevo León,Apodaca,R,-100.1687175,25.778679,1879
Si no revientan los maíces de los esquites no son unos buenos esquites.,Wed Aug 04 03:11:35 +0000 2021,Puebla,Amozoc,R,-98.1542665,19.0322295,616
Mis esquites o pan de dulce ❤️,Wed Aug 04 14:36:36 +0000 2021,Puebla,Amozoc,R,-98.1542665,19.0322295,616
Necesito unos esquites con mucho queso y limón 🤤,Thu Aug 05 04:56:37 +0000 2021,Ciudad de México,Coyoacán,U,-99.15234000000001,19.328383000000002,614447
"Yo: Ya le voy a bajar a la comida.

También yo: Vamos a una noche de tatuajes, esquites y cócteles.",Thu Aug 05 18:42:40 +0000 2021,Ciudad de México,Miguel Hidalgo,U,-99.2115105,19.4299345,414470
"Hice unos esquites bien perros deliciosos para pasar la tarde. Pero heme aqui, leyendo y pensando por qué los que l… https://t.co/VrH2TJ1vSg",Thu Aug 05 21:01:47 +0000 2021,Jalisco,Guadalajara,U,-103.335882,20.676651999999997,1385621
"irveLE iéveLE…
Cuantos señO cuantos?
#Esquites #Troles #Elotes #TostiLockos #kklas y más.
#ElRifaO #NvOEmpleO https://t.co/vpOMGpAHRK",Fri Aug 06 01:16:27 +0000 2021,Veracruz de Ignacio de la Llave,Xalapa,R,-96.887911,19.531762,358
Así hoy con mis taquitos de tripa y después mis esquites de camarón ñam!,Sat Aug 07 02:53:36 +0000 2021,Quintana Roo,Felipe Carrillo Puerto,R,-88.0134815,19.749553,11
"Odio los esquites con queso amarillo, quién chingados invento esto?",Sun Aug 08 14:38:54 +0000 2021,Puebla,Huauchinango,U,-98.053888,20.1744365,58957
@AlExtremo @gabycrassus @gabrielaavila11 @RahmarChef Dónde está el vídeo de la receta de los esquites con suadero?,Sun Aug 08 23:05:03 +0000 2021,México,Coacalco de Berriozábal,U,-99.130628,19.6302155,293245
Por unos esquites de sanja,Mon Aug 09 00:59:22 +0000 2021,Baja California,Playas de Rosarito,R,-116.929102,32.3328765,5
@abiibiiga Y pasamos por los esquites pendientes al parque?,Mon Aug 09 02:34:11 +0000 2021,Puebla,Amozoc,R,-98.1542665,19.0322295,616
"@BisouCaramel Muy ricos , pero muy caros 
Y a quien recomienda esquites en lugar dé chiles en nogada , la traicionó el código postal",Mon Aug 09 06:21:10 +0000 2021,Ciudad de México,Iztapalapa,U,-99.050461,19.342788499999997,1835486
Ese maldito círculo vicioso de que los traten mal y se desquiten con el primero que se encuentren en lugar de con q… https://t.co/BtLEVd5I9a,Mon Aug 09 18:18:17 +0000 2021,Chihuahua,Chihuahua,R,-106.1628985,28.941865999999997,0
"@karrrrrime @iQueCachorro Lo llevo a la quiebra, me la pasaría comiendo esquites y elotes jajajajaja!!!",Mon Aug 09 19:36:45 +0000 2021,México,Toluca,U,-99.655676,19.284321499999997,33089
"Sope de Berenjena con Champiñones 
esquites a las brazas, puré de tomate y queso fresco. 

@chef_thiagodasilva… https://t.co/4Lo8tNV9VA",Mon Aug 09 23:33:25 +0000 2021,Jalisco,Tequila,R,-103.78808649999999,21.1168495,4
Será que mañana coronemos el día con unos esquites de la Villita 🌽😋,Tue Aug 10 03:35:02 +0000 2021,Hidalgo,Metztitlán,R,-98.81185,20.563844500000002,88
I'm at Ricos Elotes y Esquites https://t.co/3NrCyEFwrM,Wed Aug 11 04:22:38 +0000 2021,Ciudad de México,Coyoacán,U,-99.15234000000001,19.328383000000002,614447
No encontré ningún lugar de esquites en la zona del centro / alameda de San Luis Potosí. Muy mal servicio ⭐️,Thu Aug 12 00:04:59 +0000 2021,San Luis Potosí,San Luis Potosí,R,-100.955511,22.3111195,18
Los esquites con,Thu Aug 12 00:17:27 +0000 2021,Ciudad de México,Coyoacán,U,-99.15234000000001,19.328383000000002,614447
Team perros y esquites #sorrynotsorry 🥺,Thu Aug 12 01:08:13 +0000 2021,Puebla,Amozoc,R,-98.1542665,19.0322295,616
"I'm at Tostiesquites El Paragüitas in San Andrés Cholula, Puebla https://t.co/yoA5FioOT7",Thu Aug 12 02:25:10 +0000 2021,Puebla,Amozoc,R,-98.1542665,19.0322295,616
Ofrezco mi reino por unos esquites con queso manchego y salsa macha de Lindavista,Thu Aug 12 06:40:17 +0000 2021,México,Tlalnepantla de Baz,U,-99.1642825,19.543933000000003,658907
Los mejores y tradicionales esquites en la Peña de Bernal... en Peña De Bernal https://t.co/JtvUFooIwS,Thu Aug 12 07:46:00 +0000 2021,Querétaro,Ezequiel Montes,R,-99.86000100000001,20.6532265,5
My mind is like: Esquites Esquites Esquites😋,Fri Aug 13 00:08:07 +0000 2021,Yucatán,Mérida,R,-89.62361100000001,20.941035,0
@arck @Robotito_Kun Hay unos esquites ahí por la catedral que son buenos Markitos,Fri Aug 13 01:13:48 +0000 2021,México,Ecatepec de Morelos,R,-99.0444445,19.56828,615
"#elotes #esquites #antojo #delicious 

#quienseapunta #AsiLasCosas #foodie #foodporn #foodphotograhy #foodpic… https://t.co/whwiCoG23Z",Fri Aug 13 01:18:25 +0000 2021,Ciudad de México,Cuauhtémoc,U,-99.153366,19.432836,545884
"Háganse un favor y preparen takiesquites
De nada 😊 https://t.co/GySAZjNo8O",Fri Aug 13 03:46:35 +0000 2021,Ciudad de México,Cuauhtémoc,U,-99.153366,19.432836,545884
q feliz soy comiendo esquites &lt;3,Fri Aug 13 19:28:08 +0000 2021,Morelos,Jojutla,R,-99.2788965,18.587272,68
@AnaPau_porfavo Le diste Pau. Hay unos chiles en nogada y unos esquites 🤤🤤🤤,Sat Aug 14 18:50:18 +0000 2021,Puebla,Zacatlán,R,-98.019571,19.9617935,332
@DIVALUSTAR Esquites con sus patas de pollito .,Sun Aug 15 00:46:22 +0000 2021,México,Toluca,U,-99.655676,19.284321499999997,33089
@Nicky61737770 Los esquites de camarón ! Deliciosos ! Y el pulpo a la recova mmmm,Sun Aug 15 16:38:16 +0000 2021,Yucatán,Sotuta,R,-88.885832,20.5812375,794
"@swingersexy2 Casualmente ayer andábamos x allá,  y sii los esquites son muuuyyy ricos 🤤 pro el pulpo de ate me gus… https://t.co/ngBpHPaceL",Sun Aug 15 16:46:15 +0000 2021,Yucatán,Kanasín,R,-89.53149400000001,20.915111000000003,0
"@Ia___beIlezza En Querétaro igual esquites pero como que les falta algo, los he probado en varios puntos de la ciud… https://t.co/YSarVSBF4j",Mon Aug 16 00:01:46 +0000 2021,Querétaro,El Marqués,R,-100.2783405,20.7456405,14
"- ¿Quieres ir por un esquite?

- Enviar.",Mon Aug 16 01:47:40 +0000 2021,Yucatán,Mérida,R,-89.62361100000001,20.941035,0
Verdaderamente el sur necesita los esquites con Maruchan amigues no saben lo poco que han vivido hasta que los prueben,Mon Aug 16 03:23:49 +0000 2021,Chihuahua,Chihuahua,R,-106.1628985,28.941865999999997,0
"@keyly_rg La neta si me gustó mucho, están bien ricos los elotes y esquites en el parque",Mon Aug 16 19:06:31 +0000 2021,Campeche,Campeche,R,-90.27714,19.601414,0
"Bueno, pues ya son casi las 8pm y se nos antojó un vaso de esquites porque esta panza de oso invernal no va a crecer sola.",Wed Aug 18 00:36:29 +0000 2021,Ciudad de México,Benito Juárez,U,-99.1614805,19.380613,434153
#esquites en Esquites Don Josué https://t.co/bZSZEeSopP,Wed Aug 18 02:47:13 +0000 2021,Puebla,Amozoc,R,-98.1542665,19.0322295,616
No es de amigos andar soportando tus desquites emocionales/físicos/psicológicos.,Wed Aug 18 03:00:24 +0000 2021,México,Cuautitlán Izcalli,R,-99.233657,19.6562895,6730
"Me faltó los esquites de la Thalía, el arroz con leche, el café chipaneco, queso de Pijijiapan, el chimichurri de Domino's Pizza...",Wed Aug 18 18:05:49 +0000 2021,México,Metepec,U,-99.5799145,19.2515305,11001
Los elotes y los esquites no son postres. https://t.co/vJ8L8JNWME,Thu Aug 19 01:10:12 +0000 2021,Ciudad de México,Azcapotzalco,U,-99.18212600000001,19.4857835,432205
"esquites para cenar en Mexico City, Mexico https://t.co/w6cyzRjWwJ",Thu Aug 19 03:54:44 +0000 2021,Ciudad de México,Cuauhtémoc,U,-99.153366,19.432836,545884
@karlarockabilly Unos esquites en caso de que no encuentres el atolito 😘 https://t.co/Iq30AfA6W9,Thu Aug 19 04:46:06 +0000 2021,Ciudad de México,Coyoacán,U,-99.15234000000001,19.328383000000002,614447
"Los elotes, esquites y tacos de tripa son vomitivos...",Thu Aug 19 06:22:10 +0000 2021,México,Naucalpan de Juárez,R,-99.310428,19.473793999999998,149
"@the_Moonquake No manches así me pasó un día con un lugar de esquites jaja, yo bien emocionada dije le voy a decir… https://t.co/z2BXURj4QO",Thu Aug 19 16:47:20 +0000 2021,Querétaro,Querétaro,R,-100.4405945,20.7152745,9
@cmbacap Amo a los esquites y los elotes 🥺 perdón por fallar,Thu Aug 19 18:41:15 +0000 2021,Veracruz de Ignacio de la Llave,Boca del Río,U,-96.0989905,19.1431005,132011
Ya me hice las uñas ahora procederé a hacer la compra de unos esquites porque puedo y me lo merezco.,Fri Aug 20 00:24:31 +0000 2021,Hidalgo,Mineral de la Reforma,U,-98.77580800000001,20.1056375,5108
"@ReporteQRO_ Amooooooo los nopales en penca, los esquites poblanos, las tortitas con grasita de chorizo, ¡y ni habl… https://t.co/42tQKzkSiW",Fri Aug 20 19:25:45 +0000 2021,Querétaro,Querétaro,R,-100.4405945,20.7152745,9
"Esquites de camarón, A-H-U-E-V-O https://t.co/reQnQKUTpb",Fri Aug 20 23:25:44 +0000 2021,Ciudad de México,Cuauhtémoc,U,-99.153366,19.432836,545884
🥲 no me saben a nada mis ricos esquites 🌽,Sat Aug 21 02:50:40 +0000 2021,Puebla,Amozoc,R,-98.1542665,19.0322295,616
Para que el de los esquites te lo sirva primero en uno de sus vasos desechables y luego lo pase a tu tupper y tire… https://t.co/FLokQUvtDj,Sat Aug 21 13:33:36 +0000 2021,México,Naucalpan de Juárez,R,-99.310428,19.473793999999998,149
Ya que regrese la señora de los esquites 😭,Sun Aug 22 18:13:16 +0000 2021,Veracruz de Ignacio de la Llave,Boca del Río,U,-96.0989905,19.1431005,132011
Pagué 900 por sobrepeso en mi maleta y ¿saben qué? VALIÓ CADA MALDITO CENTAVO POR TRAER ARROCITO Y ESQUITES DE MI MAMÁ.,Sun Aug 22 20:51:43 +0000 2021,Baja California Sur,La Paz,R,-110.8545845,24.107996999999997,0
Esquites 💕 @Ordaz_Sandra ✨,Mon Aug 23 03:10:20 +0000 2021,Veracruz de Ignacio de la Llave,Medellín de Bravo,R,-96.15278500000001,19.0155025,5
Eres de quien te envía unos esquites por DiDi 💕,Tue Aug 24 01:43:03 +0000 2021,Ciudad de México,Benito Juárez,U,-99.1614805,19.380613,434153
"@HatoJoestar En Ciudad Nezahualcóyotl hacen unos esquites con chocolate y mantequilla,te rolo esa info por tu gusto total hacia el elote 🌽🌽🌽",Tue Aug 24 23:48:49 +0000 2021,México,Nezahualcóyotl,R,-99.087817,19.4320755,0
"A wild cup of esquites appears 🤩 I will fuck up a cup of this anytime, anywhere https://t.co/eHBiAfmJ7C",Wed Aug 25 02:16:46 +0000 2021,Ciudad de México,Benito Juárez,U,-99.1614805,19.380613,434153
"@warrior_guitar @Mabelishaaa Pues yo si ne voy a largar a Cdmx, unas chelas, unos Esquites y mis tacos favoritos, n… https://t.co/CBSJ7WkPqI",Wed Aug 25 02:52:45 +0000 2021,Jalisco,Zapopan,R,-103.48477450000001,20.790657000000003,40
¿Alguien sabe qué pasó con la señora de los esquites de afuera de Plaza Mocambo? 😭,Wed Aug 25 14:24:37 +0000 2021,Veracruz de Ignacio de la Llave,Boca del Río,U,-96.0989905,19.1431005,132011
Ya que volví al sur quiero armar una fiesta de esquites y hacerles probarlos con Maruchan asekten es por su bien 🔪🔪🔪,Wed Aug 25 19:17:45 +0000 2021,Puebla,Amozoc,R,-98.1542665,19.0322295,616
@chef_rene El señor de los esquites comiéndose los elotes en lugar de venderlos https://t.co/cDHUS8y4uj,Thu Aug 26 00:18:11 +0000 2021,Jalisco,Guadalajara,U,-103.335882,20.676651999999997,1385621
"Nadie:
Absolutamente nadie:
Mi mamá y yo hace 5 minutos: 
Yo: mamá hay que ir por un esquite 
Mm: ya, Gabi 
Yo: que… https://t.co/t10NW41P9a",Thu Aug 26 21:06:33 +0000 2021,Morelos,Cuernavaca,R,-99.260819,18.933812,78
¿Quieres un elote con Cheetos? ¿O prefieres algo más extraño como esquites de chapulines o camarones 🦐? https://t.co/Nd6ueepuOo,Thu Aug 26 21:53:51 +0000 2021,Puebla,Amozoc,R,-98.1542665,19.0322295,616
"Entonces debes visitar Ah jijo, esquites y algo maíz, el lugar en donde los esquites y elotes se sirven con estos y… https://t.co/YkaUJn8LUT",Thu Aug 26 21:53:54 +0000 2021,Puebla,Amozoc,R,-98.1542665,19.0322295,616
"Pedí unos esquites y un panqué de elote en Uber eats y me llegaron 3 conchas y 2 rebanadas de panqué de plátano, no… https://t.co/vUs4ZtwaSJ",Fri Aug 27 00:48:02 +0000 2021,Ciudad de México,Miguel Hidalgo,U,-99.2115105,19.4299345,414470
"@piojo22e Ojalá que así sea, que desquiten lo que se les paga. Son los que menos trabajan, cuantos puentes y periodos vacacionales tienen?",Fri Aug 27 17:48:16 +0000 2021,Hidalgo,Tula de Allende,R,-99.384564,20.0567145,888
Mi flojera no me deja ir por unos esquites de los que tanto me gustan JAJAJAJA,Sat Aug 28 00:50:20 +0000 2021,Ciudad de México,La Magdalena Contreras,R,-99.26452649999999,19.2755645,10
"Ame este día por la comida de mi mamá 🥰
De sopa: esquites
Plato fuerte: tacos árabes y su salsa de chipotle
Termina… https://t.co/SEKas1GH84",Sat Aug 28 03:30:49 +0000 2021,Puebla,Amozoc,R,-98.1542665,19.0322295,616
"Esquites de tamulte 
Churros de Mayito
Panuchos del cipatli
Tacos el amigo nacho
Taco joven (hay mejores y lo saben… https://t.co/4ZVE8pClYR",Sat Aug 28 18:59:37 +0000 2021,Guanajuato,León,R,-101.601401,21.09806,3
"I'm at Tostiesquites El Paragüitas in San Andrés Cholula, Puebla https://t.co/A6qIGwElIl",Sun Aug 29 02:20:37 +0000 2021,Puebla,Amozoc,R,-98.1542665,19.0322295,616
"No diré nada, en México hacemos esquites 😂",Sun Aug 29 02:49:38 +0000 2021,Quintana Roo,Puerto Morelos,R,-87.0316645,21.048719,0
De casualidad no vendes esquites los sábados o menudo los domingos,Sun Aug 29 20:26:17 +0000 2021,Sinaloa,Mazatlán,R,-106.2717475,23.46814,0
"¡Amo esta delicia! 🌽🌶

#elote #elotes🌽 #esquites #esquite #chiledelquepica #delicioso #delicious #mexico #mexico🇲🇽… https://t.co/P8VFEZ9DMt",Sun Aug 29 23:48:22 +0000 2021,México,Nezahualcóyotl,R,-99.087817,19.4320755,0
No por que ustedes se desquiten estando con otras.. se significa que uno también. No todos tenemos la habilidad de… https://t.co/sgX6qI4CPc,Mon Aug 30 00:08:24 +0000 2021,Tamaulipas,Reynosa,R,-98.36253100000002,25.836567499999997,1
"Mientras tú me ignoras, la morrita de los esquites me ofrece la molleja.",Mon Aug 30 03:08:51 +0000 2021,Ciudad de México,Tlalpan,R,-99.208364,19.199485,86
"@MaryCar22994836 A webo, los esquites también. 🌹",Tue Aug 31 19:07:49 +0000 2021,México,Cuautitlán Izcalli,R,-99.233657,19.6562895,6730
"@electro_boyMx @escritosluquita @IsInestables Prometo que será recíproco 🥺.
Pd... Me debes unos esquites 🤣",Tue Aug 31 23:52:43 +0000 2021,Ciudad de México,Coyoacán,U,-99.15234000000001,19.328383000000002,614447
"@KPAG1188 @escritosluquita @IsInestables Como debe de! 
Ya se que te debo los esquites
PD malditas apuestas 🤣",Tue Aug 31 23:57:38 +0000 2021,Ciudad de México,Cuauhtémoc,U,-99.153366,19.432836,545884
@ChinitaShine85 Cuentan los esquites que t lleve?,Wed Sep 01 14:05:11 +0000 2021,Quintana Roo,Puerto Morelos,R,-87.0316645,21.048719,0
Yo solo espero que las y los diputados verdaderamente desquiten ese sueldazo en iniciativas que impacten de manera… https://t.co/zR2TXGEMvc,Wed Sep 01 16:49:51 +0000 2021,Sonora,Hermosillo,R,-111.498181,28.9698625,5
"Yo quiero compartir mi chicharrón con esquites contigo, toda mi vida",Wed Sep 01 18:37:03 +0000 2021,México,Metepec,U,-99.5799145,19.2515305,11001
