Tweet,Fecha,Estado,Locacion,Tipo,Longitud,Latitud,Poblacion
"Una #solenopsis SP en mi gym, que dicen ¿La entubamos? 

#hormiga #hormigas https://t.co/sFBxl0MbDq",Sat Apr 30 01:22:35 +0000 2022,México,"Tlalnepantla de Baz, Ejido de Tenayuca (Cola de Caballo)",R,-99.1642825,19.543933000000003,71
@tenientehormiga @Flavio6107ROCA @RuidoEnLaRed Dante Dantesco politiquero engañabobos.parasito.,Sat Apr 30 04:22:49 +0000 2022,Morelos,"Tlayacapan, Nacatongo",R,-98.9739505,18.943551999999997,1136
"Mañana espero están tan Mamado cómo Hormigaaaaa!! 
El Lunes regreso al GYM",Sat Apr 30 17:38:26 +0000 2022,Ciudad de México,"Benito Juárez, Benito Juárez",U,-99.1614805,19.380613,434153
"Primavera oaxaqueña 

Mis kiwis son color de hormiga que!!! 🤣🤣 @Pharmaguru1 @DoroteoMorro",Sat Apr 30 19:28:07 +0000 2022,Oaxaca,"Cuilápam de Guerrero, Carrizal",R,-96.80849900000001,17.004507,367
"@ArtBrahm No te mames con hunterxhunter, cuando llegues al arco de las hormigas y la pelea central, te vas a morir",Sat Apr 30 21:30:31 +0000 2022,Aguascalientes,"Aguascalientes, El Centavito 2",R,-102.327207,21.849459000000003,6
"Lo único que me mantuvo a salvo en la niñez fue dibujar. Eso, y observar a las hormigas. Luego descubrí los libros… https://t.co/yupPoU9g3j",Sun May 01 00:42:15 +0000 2022,Veracruz de Ignacio de la Llave,"Tuxpan, Tepeyac",R,-97.409066,20.936595500000003,2
"Cenando el Terry, el cachorro y la Gaia hoy a las 19:32, había muchas hormigas 🐜 se pasan. (@ Macotoco in Totolapan… https://t.co/BLOvUD3Ps8",Sun May 01 02:20:47 +0000 2022,Morelos,"Totolapan, Ahuatlán (Asunción Ahuatlán)",R,-98.92434899999999,18.997547500000003,773
Las hormigas acaban de llevarse un pedazo de brownie mágico que se cayó  al suelo. Buen viaje hermanas.,Sun May 01 05:06:22 +0000 2022,Querétaro,"Huimilpan, La Cuesta",R,-100.296487,20.418515499999998,181
"La vida es bella!!! Cumpleaños The Vampire y Los Chispoles
#frejols #friends en Hormiga Negra Bar https://t.co/fukYJE6b8q",Sun May 01 15:08:27 +0000 2022,Puebla,"Puebla, Fundadores del Ejido Colonia Chapultepec",R,-98.1542665,19.0322295,550
@hormiga_1999 @estebanmtz99 @mariogarzac99 Terrible,Sun May 01 19:38:43 +0000 2022,Nuevo León,"San Pedro Garza García, El Sendero",R,-100.366033,25.650287499999997,5
"@Solis75A Las tiendas como esas tienen contemplado el robo hormiga, por los millones que ganan y como tratan a los… https://t.co/8JqCDMoQuF",Wed May 04 02:49:42 +0000 2022,Ciudad de México,"Azcapotzalco, Azcapotzalco",U,-99.18212600000001,19.4857835,432205
"El sapo solo contestó: Pues claro, cuando yo estaba aquí me comía a esas hormigas y por eso siempre eras la más bel… https://t.co/9e0duoD4sS",Wed May 04 03:06:21 +0000 2022,Tamaulipas,"Tampico, La Isleta Río Tamesí (Cruz Chica)",R,-97.91677200000001,22.270295,19
Hoy le tocó revancha aún jugador que me trae odio jarocho 🤣🤣 la primera vez que jugamos estaba color de hormiga tod… https://t.co/oYGZiE8lQX,Wed May 04 03:10:37 +0000 2022,Yucatán,"Mérida, Mérida",U,-89.62361100000001,20.941035,921771
Gol del City...se le pone color de hormiga a el Madrid..podrá ???,Wed May 04 20:32:41 +0000 2022,Nuevo León,"Santa Catarina, Buenos Aires",R,-100.48274899999998,25.5835005,25
No sé cómo pero una pinche hormiga me picó a unos cuantos centímetros de mi ingle... 🥹,Wed May 04 22:50:55 +0000 2022,Quintana Roo,"Benito Juárez, Premasa del Caribe",R,-87.0316645,21.048719,0
"Cada vez que descubro que las hormigas se están comiendo el cereal, siento placer guardarlo en el congelador por dí… https://t.co/XCsH1yK2nb",Thu May 05 15:01:08 +0000 2022,Yucatán,"Mérida, Mérida",U,-89.62361100000001,20.941035,921771
"@goberpanelo @FerMoralesMtz @XclusivasPuebla La de pelota ya está más hinchada, además la hormiga no se mete ceniza… https://t.co/H94mvZl0iC",Thu May 05 16:10:40 +0000 2022,Puebla,"Puebla, Fundadores del Ejido Colonia Chapultepec",R,-98.1542665,19.0322295,550
"@proceso Chinches, cucarachas, hormigas y pulgones...
🪳🪰
🤣",Fri May 06 02:58:40 +0000 2022,Ciudad de México,"Gustavo A. Madero, Gustavo A. Madero",U,-99.1158905,19.518656,1173351
Hormigas en la lengua 👅 🐜❤️,Fri May 06 05:44:48 +0000 2022,Ciudad de México,"Tlalpan, Cañada del Acueducto",R,-99.208364,19.199485,161
arrobo hormiga,Fri May 06 16:27:02 +0000 2022,Guerrero,"Taxco de Alarcón, Rancho de Colores",R,-99.597545,18.5210245,28
"¿Recuerdan a esta chica?
Hoy nos indicó/quejó qué hay hormigas en la cocina.
😅🤷🏻‍♂️🐜",Fri May 06 21:32:05 +0000 2022,Chihuahua,"Juárez, Luis Carlos Ruiz",R,-106.568008,31.452274000000003,0
@DonVocero Un camino de hormigas rojas. 🤭,Sat May 07 00:07:02 +0000 2022,Puebla,"Puebla, Fundadores del Ejido Colonia Chapultepec",R,-98.1542665,19.0322295,550
*se mueren todos alb como las hormigas que pierden en rumbo y al guía.,Sat May 07 04:23:52 +0000 2022,Coahuila de Zaragoza,"Saltillo, San Felipe",R,-101.166961,25.0326315,97
"El argot popular en mi pueblo se dice que, ""a la gente le gusta buscarle chichis a las hormigas""… https://t.co/BCKUVx2Jb0",Sat May 07 06:00:03 +0000 2022,Ciudad de México,"Miguel Hidalgo, Miguel Hidalgo",U,-99.2115105,19.4299345,414470
"Además de las ratas en Palacio Nacional se busca controlar ararañas, alacranes, cucarachas, hormigas negras y rojas… https://t.co/dMZu3Yw0Ox",Sun May 08 15:46:23 +0000 2022,Baja California,"Playas de Rosarito, Mesa Redonda",R,-116.929102,32.3328765,9
se me subió una hormiga,Mon May 09 14:14:30 +0000 2022,Nuevo León,"Monterrey, Monterrey",U,-100.29359149999999,25.6417185,1142952
"7;06 pm Monterrey parece un plato con miel y llenar de hormigas 🚗🚗🚗🚗🚗🚗🚗🚗🚗🚗🚗🚗🚗🚗🚗🚗🚗🛻🛻🛻🛻🚗🛻🛻🛻🛻
Tráfico horrible 😕 
#MTY #Trafico #NL #Monterrey",Tue May 10 00:08:43 +0000 2022,Nuevo León,"San Pedro Garza García, El Sendero",R,-100.366033,25.650287499999997,5
@alexis_herreram Habia una hormiga que veia los amaneceres y atardeceres y las estrellas no trabajaba y las otras l… https://t.co/ugWDuFCV18,Tue May 10 01:54:31 +0000 2022,Baja California,"Playas de Rosarito, Mesa Redonda",R,-116.929102,32.3328765,9
@yimboroyimboro Ya hace más de 25 años lo sabíamos desde que lo de 1988 lo pacto con este la hormiga atómica https://t.co/nZ4PxsXTOB,Tue May 10 04:23:18 +0000 2022,Baja California,"San Quintín, El Tablón",R,-115.5798785,30.156488499999995,4
"Los recursos y el valor asignado a ellos (para mí) operan de una forma similar a la religión.
Nosotrxs, las hormiga… https://t.co/EomUhgV6Zd",Wed May 11 05:09:33 +0000 2022,Sonora,"Hermosillo, Vicente Guerrero",R,-111.498181,28.9698625,5
"Siento que las hormigas africanas de Yucatán me muerden hasta los huevos.
😵‍💫😵‍💫😵‍💫",Wed May 11 13:57:05 +0000 2022,Yucatán,"Mérida, Mérida",U,-89.62361100000001,20.941035,921771
¿A qué hora se acaban las hormigas de mi cuarto? Ya tengo toda la piel dañada,Wed May 11 14:41:40 +0000 2022,Yucatán,"Mérida, Mérida",U,-89.62361100000001,20.941035,921771
Hormigas en la lengua de @LenaYau sorprendiéndonos con su brillante camino. @bailedelsol,Wed May 11 15:46:14 +0000 2022,Ciudad de México,"Tlalpan, Cañada del Acueducto",R,-99.208364,19.199485,161
Hormigas chiquitas picononas 🤍,Wed May 11 21:35:10 +0000 2022,Ciudad de México,"Benito Juárez, Benito Juárez",U,-99.1614805,19.380613,434153
"Un insecto gigante. Esta muy District 9, hormigas jotas de MIB cartoon, mariposa peluda café-negra enorme en el tec… https://t.co/juetvJIOKx",Thu May 12 04:56:12 +0000 2022,Ciudad de México,"Cuauhtémoc, Cuauhtémoc",U,-99.153366,19.432836,545884
@tonyalmaraz4 @lopezdoriga Sobre aviso no hay engaño. Se esta poniendo color de hormiga la situación de nuestro México. 🤦🤦🤦🤦,Thu May 12 11:17:32 +0000 2022,Nuevo León,"San Nicolás de los Garza, San Nicolás de los Garza",U,-100.27047400000001,25.736714999999997,412199
@HormigaXeneize Jajajsjsk que rayos es eso https://t.co/lL37DdAMIt,Thu May 12 19:00:48 +0000 2022,Ciudad de México,"Miguel Hidalgo, Miguel Hidalgo",U,-99.2115105,19.4299345,414470
@carloalcala7409 @GusMenFox @AtlasFC @Chivas Error humano ?? Y la hormiga causante de aquel penal en el Jalisco ? 😂😂😂😂,Thu May 12 21:06:24 +0000 2022,Jalisco,"Guadalajara, Guadalajara",U,-103.335882,20.676651999999997,1385621
@pcmorones76 🤬🤬🤬justo así pero era una perla y sabrá Dios a qué hormiga aplasté🤬🤬🤬la encontrasteeee?,Fri May 13 03:29:25 +0000 2022,Ciudad de México,"Benito Juárez, Benito Juárez",U,-99.1614805,19.380613,434153
"¿Eres de los que quiere ahorrar, pero no puede? Aquí te compartimos qué son los gastos hormiga, cuáles son los más… https://t.co/pZ8kOldkwN",Fri May 13 14:31:33 +0000 2022,Baja California,"Playas de Rosarito, Mesa Redonda",R,-116.929102,32.3328765,9
"Preparé café, lo olvidé en casa, y tuve que comprar uno.  El gasto hormiga mata. https://t.co/D3O47KczxV",Fri May 13 15:03:54 +0000 2022,Jalisco,"San Pedro Tlaquepaque, Colonia Cerro del Cuatro",R,-103.34832399999999,20.592133,0
Me pidieron un párrafo de redacción para un freelance acerca de las hormigas pero en el brief escribieron: “Ormiga”… https://t.co/Ul4DXhTo6I,Fri May 13 15:46:23 +0000 2022,Ciudad de México,"Azcapotzalco, Azcapotzalco",U,-99.18212600000001,19.4857835,432205
@anitaee73 Yo sé que las hormigas nada más deshovan únicamente en Semana Santa! Es la única época del año para comer escamoles!,Fri May 13 22:42:23 +0000 2022,Ciudad de México,"La Magdalena Contreras, La Magdalena Contreras",U,-99.24800950000001,19.318042,246428
@adolfohormiga @epigmenioibarra Pues de seguro tu no pendejo .vives de nosotros ratero.,Sat May 14 19:20:07 +0000 2022,Ciudad de México,"Cuajimalpa de Morelos, Convento del Desierto de los Leones",R,-99.30558049999999,19.318697,0
"☝🏾☝🏾☝🏾☝🏾 La razón por la que iba a saa velocidad, que bueno que fue el quien se mato, pinches montamotos y hormigas… https://t.co/Q5dxPRMMYi",Sun May 15 05:17:25 +0000 2022,Quintana Roo,"Benito Juárez, Premasa del Caribe",R,-87.0316645,21.048719,0
@CobosManny Jijiji que no se me fueran a subir las hormigas 😂,Sun May 15 06:34:55 +0000 2022,Baja California,"San Quintín, El Tablón",R,-115.5798785,30.156488499999995,4
@carpesanoo 😱😱 justo cuando leía eso en la tele comenzaron a decir hormiga!!,Sun May 15 18:34:14 +0000 2022,México,"Ecatepec de Morelos, Ecatepec de Morelos",U,-99.0444445,19.56828,1643623
"@riva_leo Se va a poner color de hormiga, a alguien lo incómodo y ahora bajarlo a como de lugar. Se subió a las bar… https://t.co/VGS0PxXRrf",Mon May 16 03:18:33 +0000 2022,Puebla,"Puebla, Fundadores del Ejido Colonia Chapultepec",R,-98.1542665,19.0322295,550
"Tengo invasión de hormigas negras en mi cocina. Desde luego, no quiero matarlas.
Algún otro remedio que este bonito… https://t.co/emwNaCDFRn",Mon May 16 17:26:03 +0000 2022,Veracruz de Ignacio de la Llave,"Xalapa, La Troja",R,-96.886083,19.542054,88
@jrsestaca Me recuerda a la pelicula de hormigas jajajajajajak y mas cuando estan bailando,Mon May 16 17:33:50 +0000 2022,Baja California,"Mexicali, Ejido José Saldaña Número 2",R,-115.22918000000001,31.789669500000002,19
"Mi Árbol de Panamá, Anacahuita o  Tepetaca ""Sterculia apetala"" sufrió el ataque nocturno de las hormigas arrieras h… https://t.co/awsmfR8Sel",Tue May 17 02:11:46 +0000 2022,Veracruz de Ignacio de la Llave,"Jesús Carranza, El Diamante",R,-95.173927,17.499377,3
Hoy hace cuatro años me encontré esta hormiga dorada https://t.co/cfoEkpCdl9,Tue May 17 13:25:56 +0000 2022,Veracruz de Ignacio de la Llave,"Xalapa, La Troja",R,-96.886083,19.542054,88
@juanfero_o Prro Fantasma y la fábrica de hormigas.,Tue May 17 17:34:12 +0000 2022,Veracruz de Ignacio de la Llave,"Xalapa, La Troja",R,-96.886083,19.542054,88
"Eewww, hormigas rojas qleras.",Tue May 17 22:04:48 +0000 2022,Guanajuato,"León, Rancho de Don Alberto García",R,-101.601401,21.09806,1
Ya para que @TwitterMexico le entre al trabajo sucio es por qué la cosa viene color de hormiga para sus patrones. https://t.co/Y2PFo5K0is,Wed May 18 02:34:21 +0000 2022,Nuevo León,"San Pedro Garza García, El Sendero",R,-100.366033,25.650287499999997,5
"@_ryo_hermoso Sin duda es un pendejo, dice que piensa, pero si tiene un cerebro de hormiga qué no mme y que re CHAS… https://t.co/Lasjign96K",Wed May 18 03:00:12 +0000 2022,Ciudad de México,"Xochimilco, Tlacualleli (El Calvario)",R,-99.08179,19.236244499999998,91
@mariobalak1 @Dr_Salbutamol @jcrcrcj @hetoesto @EsDeMamador @Una_hormiga1 Pero una cosa es que la empresa los busqu… https://t.co/Dfd3sBGG5g,Wed May 18 03:13:18 +0000 2022,Ciudad de México,"Tláhuac, Las Calabacitas",R,-99.050461,19.342788499999997,19
"A mi los gastos hormiga me mantienen viva, la vida esta muy horrible como para privarme de un choclo con queso y ma… https://t.co/yi7fv9gaKM",Wed May 18 04:01:36 +0000 2022,Ciudad de México,"Cuauhtémoc, Cuauhtémoc",U,-99.153366,19.432836,545884
"En Villahermosa hay 13 cuerpos lagunares urbanos, el crecimiento urbano y el efecto conocido como ""relleno hormiga""… https://t.co/eRp4x9ZmHs",Wed May 18 11:34:02 +0000 2022,Tabasco,"Centro, Medellín y Pigua 1ra. Sección",R,-92.9164995,18.0219595,352
"@_paulinasty Pero no son tan hormiga por que los tienes consientes. Disfrútalos, que para eso vivimos",Wed May 18 12:28:27 +0000 2022,Nuevo León,"Monterrey, Monterrey",U,-100.29359149999999,25.6417185,1142952
"Me dijeron... Sí abrazas a un árbol te llenas de energía, yo abrace uno y lo que me llene fue de hormigas y hasta de una chinche jajajajaja",Wed May 18 21:07:59 +0000 2022,Ciudad de México,"Tlalpan, Cañada del Acueducto",R,-99.208364,19.199485,161
@La_Dana_Vidente No le picaron las hormigas? https://t.co/DdUzbKBY1b,Wed May 18 21:59:52 +0000 2022,San Luis Potosí,"San Luis Potosí, Jorge Ramos",R,-100.955511,22.3111195,0
"@StratCons Anécdotas hay muchísimas, jajaja vacunamos como 150 perros y gatos, saque una hormiga viva del oído de u… https://t.co/CyaorC2Q59",Thu May 19 01:28:10 +0000 2022,Quintana Roo,"Othón P. Blanco, Villamil",R,-88.3857435,18.5934905,0
"Grabación de cuerdas para el documental #ElTiempodelaHormiga de @stephschneke 🐜

🎶
@nataliapt -cello #Neumann183 +… https://t.co/pgjSOVDN39",Thu May 19 02:01:01 +0000 2022,Ciudad de México,"Coyoacán, Coyoacán",U,-99.15234000000001,19.328383000000002,614447
Pelearme con las hormigas que muerden mis plantas es mi pasión ❤️✨,Thu May 19 13:59:10 +0000 2022,México,"Lerma, Ejido de San Mateo Atarasquillo",R,-99.47699349999999,19.3262775,945
"@ArmoldoA @EvySoto En Brasil  y la amazona se encuentra la hormiga más venenosa,  como iniciación al varón le ponen… https://t.co/4PuB0cOlQt",Thu May 19 15:46:12 +0000 2022,Sonora,"Hermosillo, Vicente Guerrero",R,-111.498181,28.9698625,5
"Los hombre somos bien básicos.

Un amigo dijo que tenía un problema de hormigas, otro dice que venden una jeringa c… https://t.co/4RrXC5kXnN",Thu May 19 18:22:03 +0000 2022,Sonora,"Hermosillo, Vicente Guerrero",R,-111.498181,28.9698625,5
Con ganas de ir a Walmart a hacer robo hormiga https://t.co/RgFpQ6SIz2,Thu May 19 21:38:00 +0000 2022,Guerrero,"Acapulco de Juárez, El Zapote (Kilómetro Trece)",R,-99.73564950000001,16.9589495,5
Círculo de lectura de Hormigas en la lengua!!! 🍽📕❤️📣,Thu May 19 22:26:30 +0000 2022,Ciudad de México,"Tlalpan, Cañada del Acueducto",R,-99.208364,19.199485,161
Gastos hormiga que estoy feliz de haber cancelado porque de todos modos nunca compro: #AmazonPrime jajaja 🤡 espero… https://t.co/BdKNGw8NIZ,Thu May 19 22:44:06 +0000 2022,Michoacán de Ocampo,"Morelia, La Mintzita",R,-101.27577,19.652724,1014
Yo bien ciego no veía que estaba alimentando a toda la banda de hormigas que se estaban chingando las croquetas de mis gatos.,Thu May 19 22:45:19 +0000 2022,Yucatán,"Mérida, Mérida",U,-89.62361100000001,20.941035,921771
Cualquier mamada y se hace un cagadero de hormigas. Odio el verano.,Fri May 20 04:38:49 +0000 2022,Sonora,"Caborca, Ninguno [Sergio Reyes]",R,-112.59875650000001,30.901144000000002,3
Se me están subiendo las hormigas 🐜 🐜 🐜 https://t.co/QgUwxch2GV,Fri May 20 14:34:03 +0000 2022,Jalisco,"Zapopan, Zapopan",U,-103.390429,20.704666,1257547
@TitoVilla1982 Gran jugador! mediocampista de gran rendimiento laborioso una hormiga!pero hay ciclos k cumplir! lo mejor para Rafa Baca!,Fri May 20 15:34:41 +0000 2022,Campeche,"Carmen, Balchacah",R,-91.6332875,18.4528265,11
Pinches gatos hormiga,Fri May 20 21:11:00 +0000 2022,Tabasco,"Huimanguillo, Manuel Sánchez Mármol",R,-93.71282000000001,17.7624055,699
Pinches gastos hormiga,Fri May 20 21:11:16 +0000 2022,Tabasco,"Huimanguillo, Manuel Sánchez Mármol",R,-93.71282000000001,17.7624055,699
@RamoncitoHahaha @_dlo_olb_ La hormiga atómica https://t.co/6ND7fekxqA,Fri May 20 22:10:21 +0000 2022,Ciudad de México,"Miguel Hidalgo, Miguel Hidalgo",U,-99.2115105,19.4299345,414470
"Pero hay algunos que los comparan.
Hay que carecer de sentido crítico para hacerlo.
@Benzema es una hormiga al lado… https://t.co/ejilmp4Dmq",Fri May 20 22:22:17 +0000 2022,Querétaro,"Querétaro, El Huizachal de las Tetillas",R,-100.4405945,20.7152745,97
Madurar es darte cuenta que las hormigas son temibles.,Sat May 21 01:55:10 +0000 2022,Ciudad de México,"Tlalpan, Cañada del Acueducto",R,-99.208364,19.199485,161
"Me quedé en un Airbnb y hay hormigas (no estoy segura que sean hormigas, son muy pequeñas, color como gris, o blanc… https://t.co/FhTYo871pP",Sat May 21 15:16:01 +0000 2022,Puebla,"Tehuacán, Colonia Resurrección",R,-97.42237349999999,18.4661945,236
Mudanza de hormiga en El Domo SanLuis https://t.co/pDrvSjBwh1,Sat May 21 18:25:47 +0000 2022,San Luis Potosí,"San Luis Potosí, Jorge Ramos",R,-100.955511,22.3111195,0
Migajas??? Noooo mijita ni que fue hormiga.,Sat May 21 19:02:37 +0000 2022,Yucatán,"Mérida, Mérida",U,-89.62361100000001,20.941035,921771
@Inesz_tabilidad Cómo la hormiga?,Sat May 21 21:08:01 +0000 2022,Nuevo León,"Monterrey, Monterrey",U,-100.29359149999999,25.6417185,1142952
ojalá fuera esa hormiga:(,Sat May 21 21:14:57 +0000 2022,Ciudad de México,"Gustavo A. Madero, Gustavo A. Madero",U,-99.1158905,19.518656,1173351
"@migangelgarzam pequeñas hormigas negras se observan más comúnmente forrajeando en fuentes de azúcar, como mielato… https://t.co/61GDydTbO1",Sun May 22 02:04:41 +0000 2022,Tamaulipas,"Altamira, La Selva",R,-98.082815,22.560886000000004,3
"Buen día
Es la entrega 40 y se aborda un tema relacionado con las hormigas 🐜🐜🐜🐜🐜🐜, espero sea de su agrado y les ge… https://t.co/aH0HTgz4cx",Sun May 22 13:20:51 +0000 2022,Zacatecas,"Guadalupe, La Esmeralda",R,-102.42488650000001,22.7666095,2
@jordandemexico ¡mira! Una solución ecológica para las hormigas. 😅,Sun May 22 17:13:55 +0000 2022,Veracruz de Ignacio de la Llave,"Xalapa, La Troja",R,-96.886083,19.542054,88
Hormigas rojas teotihucanas en Teotihuacán https://t.co/U8ENPpP9D1,Sun May 22 17:39:08 +0000 2022,México,"Teotihuacán, Loma del Cerro Colorado",R,-98.876975,19.7016585,243
@ChicoHormiga Llevaba 6 meses y no sabes.... es top,Sun May 22 18:20:43 +0000 2022,Quintana Roo,"Benito Juárez, Premasa del Caribe",R,-87.0316645,21.048719,0
"@CallMeSassu @ciudadanochi Que dirán las hormigas....
Hay un pato en el césped",Sun May 22 19:52:02 +0000 2022,Ciudad de México,"Azcapotzalco, Azcapotzalco",U,-99.18212600000001,19.4857835,432205
Hormigas en la lengua 😛 https://t.co/ss4VsxrNwQ,Sun May 22 21:13:04 +0000 2022,Ciudad de México,"Cuauhtémoc, Cuauhtémoc",U,-99.153366,19.432836,545884
Hay un hombre hormiga y un hombre araña,Mon May 23 04:32:23 +0000 2022,Tabasco,"Comalcalco, Tupilquillo",R,-93.341606,18.291262,760
"@EMMARTMART1 @ciudadanochi No de cualquier tipo de hormiga, es más efectiva con las variedades ecatepecticus regeto… https://t.co/m61cjNdOeD",Mon May 23 05:23:27 +0000 2022,Nuevo León,"Linares, Tlahualile",R,-99.538038,24.8558175,2
"Tanto es el odió que OBRADOR le tiene a femsa que mandó a su ejército de robo hormiga, a terminar con Oxxo https://t.co/dBEELDehNT",Mon May 23 15:51:35 +0000 2022,México,"Ecatepec de Morelos, Ecatepec de Morelos",U,-99.0444445,19.56828,1643623
"@Menresa Chapulines ,ni hormigas,ni rata de campo",Mon May 23 21:07:43 +0000 2022,Nuevo León,"García, Enrique Solís (Las Águilas)",R,-100.640491,25.8057225,0
"Urge que haga frio, este nuevo gasto hormiga me dejara en la ruina",Tue May 24 15:08:59 +0000 2022,Sinaloa,"Culiacán, Santa Lucía",R,-107.3420565,24.6624885,0
@hormigapalacio2 @YosoyPedrero @ReporterosMX_ @alitomorenoc La negociación es parte del proceso de sanación.,Wed May 25 11:58:47 +0000 2022,Tabasco,"Centro, Medellín y Pigua 1ra. Sección",R,-92.9164995,18.0219595,352
Pon el rap de las hormigas @lunaoliva #LunaAlAireEnVinyl @ruidoblancofm,Wed May 25 16:57:55 +0000 2022,Ciudad de México,"Tláhuac, Las Calabacitas",R,-99.050461,19.342788499999997,19
La secuencia del helado y las hormigas de Better Call Saul es una belleza https://t.co/gwYLwEexsa,Thu May 26 00:49:35 +0000 2022,Ciudad de México,"Benito Juárez, Benito Juárez",U,-99.1614805,19.380613,434153
La Cigarra y la Hormiga,Thu May 26 03:13:37 +0000 2022,Ciudad de México,"Cuauhtémoc, Cuauhtémoc",U,-99.153366,19.432836,545884
"¿Habrá hormigas en las nubes? 

🐜☁️",Thu May 26 04:49:27 +0000 2022,Ciudad de México,"Cuauhtémoc, Cuauhtémoc",U,-99.153366,19.432836,545884
@andresguzbj LA HORMIGA ATÓMICA,Thu May 26 14:41:45 +0000 2022,Veracruz de Ignacio de la Llave,"Álamo Temapache, Tierra Blanca Booxter",R,-97.714151,20.9937245,1659
@andresguzbj La hormiga me gusta porque le echaba muchas ganas,Thu May 26 17:25:25 +0000 2022,Ciudad de México,"Miguel Hidalgo, Miguel Hidalgo",U,-99.2115105,19.4299345,414470
El hundimiento de Manuel Vilas @Granvilas y Salvamento de hormigas de @AnaMerinoPoeta publicados por @VisorLibros e… https://t.co/c0b1QuAe8I,Sat May 28 02:03:32 +0000 2022,Ciudad de México,"Coyoacán, Coyoacán",U,-99.15234000000001,19.328383000000002,614447
A LICHA SE LE ATRAVESÓ UNA HORMIGA O COMO CHINGADOS SE CAYÓ??????,Sat May 28 03:39:29 +0000 2022,Nuevo León,"Monterrey, Monterrey",U,-100.29359149999999,25.6417185,1142952
@AnaMarg12317270 Hola buen día 😃 amiga bendiciones para ti y tu familia 👼🏻 que tú ánimo sea como el de una hormiga… https://t.co/NhsTuTIT72,Sat May 28 15:14:13 +0000 2022,Oaxaca,"Oaxaca de Juárez, Guadalupe Victoria",R,-96.7250025,17.090319,685
@LujanVania16 Porque bailan banda en círculos como hormigas??,Sat May 28 17:43:51 +0000 2022,Sonora,"Caborca, Ninguno [Sergio Reyes]",R,-112.59875650000001,30.901144000000002,3
"Las hormigas, se quedan pegadas a mis plantas de lo buenas que están!🫣",Sat May 28 17:47:11 +0000 2022,Nuevo León,"Santiago, La Escondida",R,-100.2794735,25.374897,2
@dulcemorgana1 @agroecologo Para que no les suban las Talatas u Hormigas arrieras. Pero las varas que se sembraron… https://t.co/oHaClyYk6w,Sun May 29 00:41:14 +0000 2022,Morelos,"Jonacatepec de Leandro Valle, Las Bugambilias",R,-98.81335,18.6691735,12
@eltrezletraz1 @CostenoLife Se conocen cómo chicatanas (hormigas) y en la Costa de Guerrero y Oaxaca son preparadas… https://t.co/Oq88lCry22,Sun May 29 03:29:30 +0000 2022,Guerrero,"Acapulco de Juárez, El Zapote (Kilómetro Trece)",R,-99.73564950000001,16.9589495,5
"""Si te animas a ver algo grandioso, baja la cabeza, he ahí la hormiga"".
Withman. https://t.co/74Wm06w0B5",Sun May 29 07:25:14 +0000 2022,Chiapas,"Tuxtla Gutiérrez, Tuxtla Gutiérrez",U,-93.13965950000001,16.7424355,578830
"-Aquel día el universo nos recordó que solo somos humanos, pequeñas hormigas en el todo…",Sun May 29 15:01:16 +0000 2022,Baja California,"Playas de Rosarito, Mesa Redonda",R,-116.929102,32.3328765,9
El viernes me picaron los pies las hormigas y alv que horrible es traer tenis 😭,Sun May 29 20:37:53 +0000 2022,Nuevo León,"Monterrey, Monterrey",U,-100.29359149999999,25.6417185,1142952
"casi siempre mi alergia a las hormigas no va más allá de dolor en la zona de la picadura y la inflamación por días,… https://t.co/ub3C9mr0bi",Mon May 30 14:45:03 +0000 2022,Veracruz de Ignacio de la Llave,"Pánuco, SPR San José Tanchicuín",R,-98.289075,22.08013,0
Evita el robo hormiga… llámanos manejamos los productos más avanzados para detección de metales ferrosos y no ferro… https://t.co/HoWUMaOd9O,Mon May 30 16:57:36 +0000 2022,Ciudad de México,"Benito Juárez, Benito Juárez",U,-99.152042,19.382605,434153
El fin de semana me mordieron varias hormigas... Tiene algún remedio para la picazón y ronchas? Jaja no debí dormir… https://t.co/kgblJF1W7m,Mon May 30 19:39:19 +0000 2022,Nuevo León,"General Escobedo, Bios (Las Antonias)",R,-100.3652735,25.807314499999997,1
@apzarocker @SemillaHormiga Que se multipliquen https://t.co/xapuBDEFI2,Tue May 31 01:18:21 +0000 2022,Ciudad de México,"Azcapotzalco, Azcapotzalco",U,-99.18212600000001,19.4857835,432205
"Gracias a Movimiento: Operación Hormiga A.C. por recibirme, mi reconocimiento por el gran labor que realizan en dif… https://t.co/vOgF8ZjNqn",Tue May 31 02:35:45 +0000 2022,Ciudad de México,"Benito Juárez, Benito Juárez",U,-99.1614805,19.380613,434153
"La cantidad de hormigas en mi casa es una locura 🐜 
¿Alguna solución efectiva?",Wed Jun 01 00:10:09 +0000 2022,Ciudad de México,"Benito Juárez, Benito Juárez",U,-99.1614805,19.380613,434153
Nada más fui a que me picotearan las hormigas y los moscos 🥵,Wed Jun 01 04:31:40 +0000 2022,Querétaro,"Querétaro, El Huizachal de las Tetillas",R,-100.4405945,20.7152745,97
