Tweet,Fecha,Estado,Locacion,Tipo,Longitud,Latitud,Poblacion
"@Laura55935705 @retrochenta Me encantaba la ironía de la hormiga, me daba risa Piernas Locas Crane y dragón volador https://t.co/zxEj5bhGgh",Sun Sep 06 14:14:39 +0000 2020,Sonora,"Hermosillo, Vicente Guerrero",R,-111.498181,28.9698625,5
"@Deloquenohay Hagámoslo...
La ss se ha hecho ojo de hormiga..",Sun Sep 06 17:06:16 +0000 2020,Ciudad de México,"Coyoacán, Coyoacán",U,-99.15234000000001,19.328383000000002,614447
Si me como una hormiga me muero?,Mon Sep 07 18:53:34 +0000 2020,Nuevo León,"Guadalupe, Las Escobas",R,-100.196134,25.6766035,3
"@JanettePoncede3 Te falto ultramar y mazinger z, Bruce lee, el inspector ardilla y la hormiga atómica @g_quadri",Tue Sep 08 01:07:43 +0000 2020,Guanajuato,"Valle de Santiago, El Romance",R,-101.26996150000001,20.396824,0
"Día: 251 de 366

Imagina que eres una hormiga y que el resto de hormigas son nuestra sociedad. Todas ellas trabajan… https://t.co/LdG5UyDVgy",Tue Sep 08 01:45:19 +0000 2020,Nuevo León,"Guadalupe, Las Escobas",R,-100.196134,25.6766035,3
No sé cómo le voy hacer el día del parto de mi hija si apenas me pica una hormiga y ya estoy llorando 🥴,Tue Sep 08 06:22:05 +0000 2020,Guerrero,"Acapulco de Juárez, El Zapote (Kilómetro Trece)",R,-99.73564950000001,16.9589495,5
No sé cómo le voy hacer el día del parto si apenas me pica una hormiga y ya estoy llorando 🥴,Tue Sep 08 06:22:58 +0000 2020,Guerrero,"Acapulco de Juárez, El Zapote (Kilómetro Trece)",R,-99.73564950000001,16.9589495,5
Me picaron las hormigas es mis pies y tengo mucha comezon,Tue Sep 08 08:09:04 +0000 2020,Sinaloa,"Mazatlán, Telcoyonqui",R,-106.2717475,23.46814,53
cientos de hormigas gigantes y en chinga tomó su pistola y roció con veneno y me dice “Estas hormigas llegaron a in… https://t.co/l7O9d8bsAZ,Tue Sep 08 15:11:13 +0000 2020,Yucatán,"Mérida, Mérida",U,-89.62361100000001,20.941035,921771
¿Quieren acompañarnos? Hoy! 6:40 en twitch y 7:00 en Facebook #hormigasagilistas,Tue Sep 08 20:53:26 +0000 2020,Ciudad de México,"La Magdalena Contreras, La Magdalena Contreras",U,-99.24800950000001,19.318042,246428
Y que te pique una hormiga u otra cosa 🥺,Tue Sep 08 23:07:33 +0000 2020,Nuevo León,"Monterrey, Monterrey",U,-100.29359149999999,25.6417185,1142952
"Estoy en shock, y no por enterarme que hay ~ 12,000 especies de hormigas, si no por el hecho que se estima que por… https://t.co/qWrhIcyobF",Wed Sep 09 04:47:40 +0000 2020,Sonora,"Hermosillo, Vicente Guerrero",R,-111.498181,28.9698625,5
"Voy a escribir un libro que se titule “Amiga hormiga, amigo mosquito: Guía para convivir con estos malditos bichos… https://t.co/OXl5atMtU0",Wed Sep 09 16:56:10 +0000 2020,Guanajuato,"León, Rancho de Don Alberto García",R,-101.601401,21.09806,1
Maldita hormiga te odioooo 🐜😠,Wed Sep 09 18:47:01 +0000 2020,Tabasco,"Centro, Medellín y Pigua 1ra. Sección",R,-92.9164995,18.0219595,352
@Mahoboe @Kanortz Ya ves que a @Kanortz lo pican hasta las hormigas azucareras 😅,Wed Sep 09 22:11:30 +0000 2020,Quintana Roo,"Cozumel, Gastón Cantarell",R,-86.878029,20.4321525,0
Sufro cada que salgo a caminar tratando de no pisar hormigas.,Thu Sep 10 01:46:17 +0000 2020,Jalisco,"Zapopan, Tesistán (San Francisco Tesistán)",U,-103.48477450000001,20.790657000000003,91631
"@rivero_vic @VsLongoriaXx Cómo que no se puede? Si ya todos andan como hormigas con el hormiguero inundado....
Eres… https://t.co/mLk8xofYpv",Thu Sep 10 01:47:59 +0000 2020,Quintana Roo,"Benito Juárez, Premasa del Caribe",R,-87.0316645,21.048719,0
"Me recuerda aquellas platicas con el Mister Elo, cuando se enojaba por qué Queso se reía hasta por ver una hormiga… https://t.co/0EZvY9M2lH",Thu Sep 10 02:38:53 +0000 2020,Chiapas,"Tapachula, Buenos Aires",R,-92.3094495,14.920494999999999,1
Qp2 soy un Iman para las hormigas y moscos PTM,Thu Sep 10 05:24:52 +0000 2020,Campeche,"Campeche, Edzná F-Uno [Centro de Recría]",R,-90.27714,19.601414,0
Traía una hormiga 🐜 trotando en la pierna 🦵,Thu Sep 10 12:16:02 +0000 2020,Yucatán,"Mérida, Mérida",U,-89.62361100000001,20.941035,921771
@jthormigaaah Dontas?,Thu Sep 10 16:40:40 +0000 2020,Yucatán,"Mérida, Mérida",U,-89.62361100000001,20.941035,921771
Cuiden el gasto porque se va poner ojo de hormiga 🐜,Thu Sep 10 19:04:22 +0000 2020,Sinaloa,"Ahome, El Porvenir",R,-109.1037265,25.921946500000004,841
Ya extrañaba esto 😋 una sincronizada con @SemillaHormiga 👌🏻 https://t.co/SH4KbbETO9,Fri Sep 11 02:26:49 +0000 2020,Veracruz de Ignacio de la Llave,"Xalapa, La Troja",R,-96.886083,19.542054,88
@RaulMrtin Me ganaron las hormigas😪😂,Fri Sep 11 06:13:59 +0000 2020,Yucatán,"Oxkutzcab, X-Canajelé",R,-89.49113299999999,20.139091,1
"@berithaayala Muy tarde Birdie, ya me lo comí con todo y hormigas JAJAJAJ",Fri Sep 11 06:14:30 +0000 2020,Yucatán,"Oxkutzcab, X-Canajelé",R,-89.49113299999999,20.139091,1
"Hoy les vengo manejando una cinturita de hormiga muuuy deli deli... ✨👌🏾

😜 Jijiji... 🐜🐜🐜 https://t.co/Ck61YbS34M",Fri Sep 11 16:29:51 +0000 2020,Quintana Roo,"Benito Juárez, Aeropuerto",R,-86.873574,21.03954,0
@Sara__feliz @Fondeadora Y en cuestión de crédito cosas como ubers y gastos hormiga ya las hago con mi débito y par… https://t.co/wHwKyV5AW6,Fri Sep 11 20:11:44 +0000 2020,Ciudad de México,"Benito Juárez, Benito Juárez",U,-99.1614805,19.380613,434153
Inches hormigas 🐜😒 https://t.co/kkeb7d2K9a,Fri Sep 11 23:06:39 +0000 2020,Quintana Roo,"Benito Juárez, Premasa del Caribe",R,-87.0316645,21.048719,0
Salieron como 100 hormigas de un momento a otro en mi sala 👀,Sat Sep 12 00:40:53 +0000 2020,Nuevo León,"San Nicolás de los Garza, San Nicolás de los Garza",U,-100.27047400000001,25.736714999999997,412199
"""Quiero vengar, te quiero matar..."" 😎

 Ejército De Hormigas de La Gusana Ciega
https://t.co/dXhFBxJUj3",Sat Sep 12 03:18:38 +0000 2020,Ciudad de México,"Miguel Hidalgo, Miguel Hidalgo",U,-99.2115105,19.4299345,414470
"Quejándome de que hay hormigas en mi cama ahorita, PERO ANOOOOSHE bieeen agusto con mi paquetón de trikitrakes traganda la niña",Sat Sep 12 03:22:12 +0000 2020,Sonora,"Cajeme, La Poza (El Parque)",R,-109.84179,27.713652500000002,0
A las hormigas las rocíe con pledge abrillantador de maderas!!! https://t.co/ZXZlim2Z4t,Sat Sep 12 03:49:10 +0000 2020,Ciudad de México,"Coyoacán, Coyoacán",U,-99.15234000000001,19.328383000000002,614447
@iwt_fuck Y los piquetes de hormiga a la orden,Sat Sep 12 04:54:45 +0000 2020,México,"Tlalnepantla de Baz, Ejido de Tenayuca (Cola de Caballo)",R,-99.1642825,19.543933000000003,71
"MEXICANOS,seamos estas decididas hormigas https://t.co/gu4nQ7jf3h",Sat Sep 12 17:09:45 +0000 2020,Ciudad de México,"Cuajimalpa de Morelos, Convento del Desierto de los Leones",R,-99.30558049999999,19.318697,0
@UnaHormigaSad Heyyyy yo no soy toxico hormi 🤣🤣🤣,Sat Sep 12 19:08:01 +0000 2020,México,"Ecatepec de Morelos, Ecatepec de Morelos",U,-99.0444445,19.56828,1643623
@AurooGil de hormiga atómica será mejor dicho xD,Sun Sep 13 01:07:35 +0000 2020,Jalisco,"Guadalajara, Guadalajara",U,-103.335882,20.676651999999997,1385621
Revisa la tierra ! En ocasiones tienen hormigas 🐜 me paso con una orquídea @wonder_m_r,Sun Sep 13 12:55:21 +0000 2020,Guerrero,"Chilpancingo de los Bravo, Inscuinatoyac (El Pueblito)",R,-99.72418149999999,17.3916575,663
Las cosas que me atormentaban a los 18. Hoy son noticia en el periódico. Que asco neta su pinche humanidad hormiga.… https://t.co/KvYqfbEhxh,Sun Sep 13 15:20:18 +0000 2020,Querétaro,"Querétaro, El Huizachal de las Tetillas",R,-100.4405945,20.7152745,97
@VanDerIncubus Lo acaba de tirar una hormiga OJO 👀,Sun Sep 13 17:45:42 +0000 2020,Tabasco,"Centro, Medellín y Pigua 1ra. Sección",R,-92.9164995,18.0219595,352
Me estás diciendo que un golpe Especial de Gon no mata a una Hormiga Quimera?,Mon Sep 14 05:36:24 +0000 2020,Sinaloa,"Ahome, El Porvenir",R,-109.1037265,25.921946500000004,841
@SirHijoDePuta Huevecillos de hormigas... Escamoles se llaman...y además cotizados a la alza. https://t.co/wB7DoC4QHs,Mon Sep 14 08:24:24 +0000 2020,Ciudad de México,"La Magdalena Contreras, La Magdalena Contreras",U,-99.24800950000001,19.318042,246428
"Los lunes después de un buen fin de semana, inevitable no sentir hormigas en la panza por pendientes o xq se vence… https://t.co/S1hNwZYHgR",Mon Sep 14 12:37:16 +0000 2020,Jalisco,"Guadalajara, Guadalajara",U,-103.335882,20.676651999999997,1385621
La hormiga tacleadora ataca de nuevo 🐜🏈💪 en Azteca Tamaulipas https://t.co/u70TZwSLgs,Mon Sep 14 14:56:36 +0000 2020,Tamaulipas,"Victoria, La Esperanza",R,-99.187904,23.685934,0
"¿Estoy mal si hasta para caminar tengo cuidado porque no quiero pisar a las hormigas 🐜? 😕
Mi mamá me tacha de loca… https://t.co/yzbtkPcAJR",Mon Sep 14 17:32:22 +0000 2020,Puebla,"Puebla, Fundadores del Ejido Colonia Chapultepec",R,-98.1542665,19.0322295,550
@Don_Favs Igual yo ante las hormigas voladoras,Tue Sep 15 05:01:56 +0000 2020,Zacatecas,"Villa de Cos, La Soledad (Juan Antonio Cortés)",R,-102.5580375,23.6254185,2
@lesli_caperusa Piquetes de hormigas ?,Wed Sep 16 02:04:07 +0000 2020,Quintana Roo,"Benito Juárez, Premasa del Caribe",R,-87.0316645,21.048719,0
"Me picó una hormiga o algo, pasé de tener pata de tamal a tener pata de zacahuilt pero con la tina entera. Si mañan… https://t.co/1cO1GpSRqr",Wed Sep 16 06:57:05 +0000 2020,Tabasco,"Centro, Medellín y Pigua 1ra. Sección",R,-92.9164995,18.0219595,352
"Oh..thx from your brilliant mind. The word is ""hormiga"" in Spanish, you know, in case you need to make an ass out o… https://t.co/STQmZezyTY",Wed Sep 16 21:54:02 +0000 2020,Jalisco,"Zapopan, Tesistán (San Francisco Tesistán)",U,-103.48477450000001,20.790657000000003,91631
Yo con la Hormiga 🤭💕,Thu Sep 17 19:40:34 +0000 2020,Veracruz de Ignacio de la Llave,"Córdoba, Colonia Vicente",R,-96.937002,18.925289499999998,69
👀 @FJ_LaCorona Zote para hormigas,Thu Sep 17 20:12:38 +0000 2020,Veracruz de Ignacio de la Llave,"Veracruz, Valente Díaz",U,-96.22939650000001,19.183953,36818
"Mi roomie: ¿Por qué metes el cereal al refri?
Yo: Se lo comen las hormigas.
Mi roomie: Exageras.
Las hormigas: Cereal nuevo :)",Fri Sep 18 02:45:43 +0000 2020,Yucatán,"Mérida, Mérida",U,-89.62361100000001,20.941035,921771
"Con tanto filtro en su foto 
parece su carita hormiga.",Fri Sep 18 21:36:49 +0000 2020,Guanajuato,"Irapuato, Irapuato",U,-101.3403935,20.673542,452090
#Gardel2020 q pasó con Hermano Hormiga?,Sat Sep 19 01:58:47 +0000 2020,Ciudad de México,"Benito Juárez, Benito Juárez",U,-99.1614805,19.380613,434153
"@HectorSisan @LaHormiga68 @HECTORITO Que Él quiso entrejer
con el amor infinito!
Do la vida habría de ser
un sender… https://t.co/Kss2JAPQwk",Sat Sep 19 15:49:00 +0000 2020,Jalisco,"Zapopan, Tesistán (San Francisco Tesistán)",U,-103.48477450000001,20.790657000000003,91631
Wey ojala no existieran las putas hormigas las odio estan invadiendo mi casa desde que inicio el verano!!! Ya no se que hacer!!!,Sat Sep 19 17:10:22 +0000 2020,Sonora,"Hermosillo, Vicente Guerrero",R,-111.498181,28.9698625,5
"@soylayerbabuena @HectorSisan @LaHormiga68 @HECTORITO Jajajaja! 

Querida Peppermint:

Todavía pude usar el término… https://t.co/XrneUbBaky",Sat Sep 19 17:25:21 +0000 2020,Jalisco,"Zapopan, Tesistán (San Francisco Tesistán)",U,-103.48477450000001,20.790657000000003,91631
@soylayerbabuena @HectorSisan @LaHormiga68 @HECTORITO Si! https://t.co/D4kyARU9Tq,Sat Sep 19 17:30:32 +0000 2020,Jalisco,"Zapopan, Tesistán (San Francisco Tesistán)",U,-103.48477450000001,20.790657000000003,91631
¡Me cagan las putas hormigas!,Sun Sep 20 15:40:32 +0000 2020,Baja California,"Playas de Rosarito, Mesa Redonda",R,-116.929102,32.3328765,9
Hice pelear a una hormiga roja contra una negra 😈,Sun Sep 20 16:23:11 +0000 2020,Oaxaca,"San Pedro y San Pablo Teposcolula, San Francisco de Asís",R,-97.50126,17.4938165,135
"Muy de acuerdo. Dejar que un nido de hormigas se reproduzca en un campo de cultivo, es dejar que terminen hasta con… https://t.co/EDNN56DzhW",Sun Sep 20 16:25:04 +0000 2020,Puebla,"Puebla, Fundadores del Ejido Colonia Chapultepec",R,-98.1542665,19.0322295,550
"Ｖｕｅｌｖｅ Ｐｅｔｅｒ
@PeterElPiola 
@Scottlahormiga https://t.co/8Lx1tsQHnm",Mon Sep 21 17:24:38 +0000 2020,México,"Ecatepec de Morelos, Ecatepec de Morelos",U,-99.024784,19.623586,1643623
"Eso dice, pero la verdad es que se quería casar, tengo pruebas @Scottlahormiga",Mon Sep 21 17:39:46 +0000 2020,Nuevo León,"Apodaca, El Tasajillo",R,-100.1687175,25.778679,0
Wey las hormigas se estaban comiendo mi jabón otra vez,Tue Sep 22 16:40:08 +0000 2020,Quintana Roo,"Solidaridad, San Carlos",R,-87.346982,20.5845305,27
"¡Hay hormigas en mi puta cama!
¡ESTOY HARTOO! Me siento como en esas películas que las hormigas te atacan 🐜",Tue Sep 22 21:11:53 +0000 2020,Baja California,"Playas de Rosarito, Mesa Redonda",R,-116.929102,32.3328765,9
"Nomas se me suben las pinches hormigas, a que hora te subes tu bb 🥰🥺🥺",Tue Sep 22 21:13:48 +0000 2020,San Luis Potosí,"Soledad de Graciano Sánchez, La Nopalera",R,-100.860774,22.291455,0
"@denigb14 El único dulce soy yo, pero estoy ya hasta la verga de las putas hormigas, todo el puto verano de mierda en casa 🥺🥺",Tue Sep 22 21:16:44 +0000 2020,Baja California,"Playas de Rosarito, Mesa Redonda",R,-116.929102,32.3328765,9
Y si no cuidas a tu bombón se les suben las hormigas,Wed Sep 23 18:22:09 +0000 2020,Morelos,"Cuernavaca, Loma del Tilcuate",R,-99.260819,18.933812,2
@wonder_m_r Mis plantas se llenan de hormigas. Que puedo hacer,Wed Sep 23 23:55:41 +0000 2020,Ciudad de México,"Tláhuac, Tláhuac",U,-99.00501849999999,19.2623115,323771
@Ramiro_Escoto Es una casa de campaña para las hormigas!!,Thu Sep 24 03:40:47 +0000 2020,Jalisco,"Tlajomulco de Zúñiga, Las Tarjeas (La Huerta)",R,-103.407581,20.489708999999998,1
"Feliz Jueves!!
Ya identificaron sus gastos hormiga??
#educacionfinanciera
#soytuagentedeseguros 
#soyAMASFAC en Rox… https://t.co/F3SNhXFuzf",Thu Sep 24 14:06:16 +0000 2020,Veracruz de Ignacio de la Llave,"Pueblo Viejo, Chijol Corona",R,-97.8225365,22.283026,0
No mms siento algo q me toca y de inmediato siento/pienso que es una hormiga roja😭,Thu Sep 24 17:01:04 +0000 2020,Veracruz de Ignacio de la Llave,"Tuxpan, Tepeyac",R,-97.409066,20.936595500000003,2
@jgnaredo Si son 200 casitas de campaña y digamos un promedio de 2 personas x casita. Son como 400 hormigas?,Thu Sep 24 17:21:43 +0000 2020,Nuevo León,"Monterrey, Monterrey",U,-100.29359149999999,25.6417185,1142952
"Será fundamental evitar gastos improductivos, gastos hormiga jerarquizar pagos sin afectar la capacidad de ingreso.… https://t.co/yzKF7l9Lbn",Fri Sep 25 00:46:00 +0000 2020,Jalisco,"Zapopan, Tesistán (San Francisco Tesistán)",U,-103.48477450000001,20.790657000000003,91631
"*dejo una migaja de comida en mi escritorio*
Las hormigas: https://t.co/gY0jDa0aJU",Fri Sep 25 01:30:17 +0000 2020,Baja California,"Playas de Rosarito, Mesa Redonda",R,-116.929102,32.3328765,9
"Terrina de costilla de cerdo, mole de hormiga chicatana y risotto 💜 https://t.co/EkMXqxkCTP",Fri Sep 25 19:42:04 +0000 2020,Oaxaca,"Oaxaca de Juárez, Oaxaca de Juárez",U,-96.719754,17.065055,258913
@UnaHormigaSad https://t.co/xcK7DHvHsd,Sat Sep 26 01:21:59 +0000 2020,México,"Ecatepec de Morelos, Ecatepec de Morelos",U,-99.0444445,19.56828,1643623
@julioastillero Ahora si se puso color de hormiga. ¿Y ahora? https://t.co/slZaFn5X2B,Sat Sep 26 01:40:08 +0000 2020,Ciudad de México,"Gustavo A. Madero, Gustavo A. Madero",U,-99.1158905,19.518656,1173351
"#mezcal #oaxaca #mezcalelreyzapoteco #molenegro #chocolateoaxaqueño #hormigachicatana #salchicatana 
@bluebleuazul… https://t.co/ODmiNvf0nv",Sat Sep 26 06:49:18 +0000 2020,Ciudad de México,"Cuauhtémoc, Cuauhtémoc",U,-99.153366,19.432836,545884
@DrBioblogo @jmvidalcordero @eddytovarloz @BichoDatos @Arachno_Cosas De niño me enseñaron a temerle a las hormigas… https://t.co/QP6OKBlYpo,Sat Sep 26 12:57:37 +0000 2020,México,"Nezahualcóyotl, Nezahualcóyotl Segundo [Relleno Sanitario]",R,-99.01701650000001,19.432722,23
@anitaee73 @rocioglzm Mmmmmm esas hormigas hacen estragos en esta banda jajajajajaa,Sat Sep 26 17:00:36 +0000 2020,Oaxaca,"Santa María Huatulco, Pueblo Viejo",R,-96.210258,15.821722,172
Me chingaron las hormigas 🐜🥴,Sat Sep 26 17:25:19 +0000 2020,Chihuahua,"Cuauhtémoc, El Crucero",R,-106.90850850000001,28.7677765,5
#datoinutilsobremi de niño me comía las hormigas rojas porque según yo eran malas y dejaba vivir las negras porque eran buenas,Sat Sep 26 17:53:00 +0000 2020,Jalisco,"Guadalajara, Guadalajara",U,-103.335882,20.676651999999997,1385621
@soyjuantavares@ @FabiMaxima #datoinutilsobremi De niño me comía las hormigas rojas porque pensaba que eran malas y… https://t.co/DmjjhygLim,Sat Sep 26 17:59:08 +0000 2020,Jalisco,"Guadalajara, Guadalajara",U,-103.335882,20.676651999999997,1385621
@soyjuantavares @FabiMaxima  #datoinutilsobremi De niño me comía las hormigas rojas porque pensaba que eran malas y… https://t.co/LOsUMdZGcY,Sat Sep 26 18:00:50 +0000 2020,Jalisco,"Guadalajara, Guadalajara",U,-103.335882,20.676651999999997,1385621
"Mejor ser hormiga que saltamontes, tortuga que liebre. La paciencia es una virtud, la intensidad un desperfecto.… https://t.co/6IQhZNBwt9",Sat Sep 26 20:18:27 +0000 2020,Ciudad de México,"Cuauhtémoc, Cuauhtémoc",U,-99.153366,19.432836,545884
"""La cigarra y la hormiga solo es un cuento de bichos
Y yo soy un player, no pienso chiquito"" 
😉",Sun Sep 27 06:07:38 +0000 2020,México,"Texcoco, San Pablo Ixayoc",R,-98.787435,19.468545499999998,2725
Piquetes de hormiga para las mujeres que nos juegan mal... https://t.co/HYL2nDpfzG,Sun Sep 27 16:40:17 +0000 2020,Guanajuato,"San Luis de la Paz, El Rincón de la Mora",R,-100.4740435,21.38042,6
Oye @Javier_Corral ¿sabes la diferencia entre un elefante y una hormiga?,Sun Sep 27 18:31:17 +0000 2020,Sinaloa,"Mazatlán, Telcoyonqui",R,-106.2717475,23.46814,53
En mi casa hay muchas hormigas por todos lados 🥺,Sun Sep 27 20:28:30 +0000 2020,Sonora,"Nogales, La Escondida",R,-111.001401,31.192592,0
"Casi pierdo la vida hoy , me pico una feroz hormiga 🐜 del desierto 🌵 venenosa , ojalá que mañana si amanezca amigos… https://t.co/I28ruGB35y",Mon Sep 28 03:01:50 +0000 2020,Chihuahua,"Aldama, El Papalote",R,-106.1628985,28.941865999999997,0
"@atameAti Vi a dos hormigas en gran pelea y pese .Si la ve un panucho ,dirá que AMLO es culpable.",Mon Sep 28 14:15:08 +0000 2020,Ciudad de México,"Benito Juárez, Benito Juárez",U,-99.1614805,19.380613,434153
"@mongomerri Para empezar... ¿tu quien eres? Jajajaja

No ubico tu twitter pero se que eres amigo por ""hormiga"".

En… https://t.co/9j8U0KoOAW",Tue Sep 29 23:11:09 +0000 2020,Ciudad de México,"Miguel Hidalgo, Miguel Hidalgo",U,-99.2115105,19.4299345,414470
Esto se pone color de hormiga... 🐜,Wed Sep 30 01:12:13 +0000 2020,Morelos,"Cuernavaca, Loma del Tilcuate",R,-99.260819,18.933812,2
No me explico como una hormiga me pico en la lengua 🙂,Wed Sep 30 23:23:33 +0000 2020,San Luis Potosí,"Matehuala, Crucero la Luz",R,-100.6151555,23.531956,36
"🐜 Hoy nos visitó una señora hormiga.

Iba sin paraguas y sin recogerse las enaguas...

¡Bien por ella! https://t.co/a6BX2Sihk0",Thu Oct 01 12:49:40 +0000 2020,Veracruz de Ignacio de la Llave,"Veracruz, Valente Díaz",U,-96.22939650000001,19.183953,36818
"@LucassRosaless @mserrano2127 Perfecto, es importante identificar si las hormigas solo pasar o se comen a tu planta, gracias por la info...",Thu Oct 01 13:54:21 +0000 2020,Ciudad de México,"Coyoacán, Coyoacán",U,-99.15234000000001,19.328383000000002,614447
"@sopitas No trabaja el Cacas , termina su mañanera y se vuelve ojo de hormiga , se retira a su recámara a tramar qu… https://t.co/drT4oupaY1",Thu Oct 01 15:41:36 +0000 2020,Jalisco,"Zapopan, Tesistán (San Francisco Tesistán)",U,-103.48477450000001,20.790657000000003,91631
"@alexdarknight82 Entonces de meter a la Hormiga atómica o alguno de Sunset Riders ni hablamos, verdad u__u",Thu Oct 01 16:21:13 +0000 2020,Nuevo León,"Monterrey, Monterrey",U,-100.29359149999999,25.6417185,1142952
"@JoseiRasso resume el paso de las hormigas m(oren)arabunta por México... Destruyendo todo a su paso

Por órdenes, c… https://t.co/fBUBcHwHQh",Thu Oct 01 18:10:17 +0000 2020,Jalisco,"Zapopan, Tesistán (San Francisco Tesistán)",U,-103.48477450000001,20.790657000000003,91631
La verdad la cosa se esta poniendo color de hormiga pasa el esquema político. Una vez cayendo #Salinas empieza una… https://t.co/u2HjvZm8Fc,Thu Oct 01 20:56:25 +0000 2020,Yucatán,"Mérida, Mérida",U,-89.62361100000001,20.941035,921771
Esa captura fue cortesía de la hormiga de #BroncosCountry,Fri Oct 02 03:01:20 +0000 2020,Puebla,"Puebla, Fundadores del Ejido Colonia Chapultepec",R,-98.1542665,19.0322295,550
"No manchen quiero tener hormigas y cuidsrlas, tmbn quiero hacerles sus propios hormigueros que padre",Fri Oct 02 04:31:33 +0000 2020,Chihuahua,"Aldama, El Papalote",R,-106.1628985,28.941865999999997,0
"#FelizViernes de #PoblanosDestacados 🙋🏻‍♂️ donde hablaré de la agrupación poblana “La Hormiga Juana”, quienes con 1… https://t.co/VRTWAtUVHd",Fri Oct 02 13:53:58 +0000 2020,Puebla,"Puebla, Fundadores del Ejido Colonia Chapultepec",R,-98.1542665,19.0322295,550
"Hoy a Hermosillo, toda picada por las hormigas castrosa del sur de Sonora",Fri Oct 02 17:49:38 +0000 2020,Sonora,"Empalme, Punta Calaveras",R,-110.72232699999999,27.8836995,1
"se maten entre sí.
El asunto es que las hormigas rojas piensan que las negras son el enemigo y viceversa, cuando en… https://t.co/yv3qu8aCrQ",Fri Oct 02 19:22:45 +0000 2020,Coahuila de Zaragoza,"Saltillo, San Felipe",R,-101.166961,25.0326315,97
"Negro contra Blanco
Pro Máscara vs Anti Máscara
Hormiga vs Hormiga
Humano vs Humano

La verdadera pregunta que debe… https://t.co/NwPeODXoRF",Fri Oct 02 19:23:19 +0000 2020,Coahuila de Zaragoza,"Saltillo, San Felipe",R,-101.166961,25.0326315,97
Se busca persona honesta para ir a llevar una hormiga al veterinario,Sat Oct 03 02:20:08 +0000 2020,Durango,"Durango, Metates (Tenchontle)",R,-104.83757800000001,23.954162500000002,194
"A cómo están las cosas en México, me pregunto ¿Quién chingaos, sacudió el frasco?

(fábula del frasco y las hormiga… https://t.co/KGCTwlhffk",Sat Oct 03 05:38:41 +0000 2020,Ciudad de México,"Coyoacán, Coyoacán",U,-99.15234000000001,19.328383000000002,614447
Nos vemos a las 11 hormigas pedaleantes.,Sat Oct 03 14:51:22 +0000 2020,Ciudad de México,"Azcapotzalco, Azcapotzalco",U,-99.178787,19.464943,432205
"@Mexxxikn0 @mamidbichos Ya juntaste las hormigas para tu “experimento”? Para empezar, no las puedes agarrar y donde… https://t.co/cLjcK6mCHO",Sat Oct 03 17:32:14 +0000 2020,Jalisco,"Zapopan, Tesistán (San Francisco Tesistán)",U,-103.48477450000001,20.790657000000003,91631
"Si pones 100 hormigas negras y 100 rojas en un jarro y lo sacudes, comenzarán a matarse entre sí.
Las rojas creerán… https://t.co/yWF2JbTy3k",Sat Oct 03 20:45:08 +0000 2020,México,"Coacalco de Berriozábal, San Francisco Coacalco",U,-99.09030349999999,19.626005,293245
"¿Quién sacude el jarro?

Si recoges 100 hormigas negras y 100 hormigas rojas y las pones en un jarro de vidrio nada… https://t.co/3U5afdsIQ5",Sat Oct 03 22:00:58 +0000 2020,Quintana Roo,"Benito Juárez, Premasa del Caribe",R,-87.0316645,21.048719,0
La chiripiolca del carioca y se le subieron las hormigas,Sat Oct 03 22:30:23 +0000 2020,Nuevo León,"Juárez, Los Canelos",R,-100.118882,25.6083315,5
"Entre #sombras y flores en movimiento... #ants🐜 #hormigas #shadow #zaachila #oaxaca en Cuilapan De Guerrero, Oaxaca… https://t.co/jhlbCeiqJu",Sat Oct 03 22:45:48 +0000 2020,Oaxaca,"Cuilápam de Guerrero, Carrizal",R,-96.80849900000001,17.004507,367
"Si recoges 100 hormigas negras y 100 hormigas rojas y las pones en un jarro de vidrio nada pasará, pero si tomas el… https://t.co/4MFLdUAEb4",Sat Oct 03 23:00:34 +0000 2020,México,"Tlalnepantla de Baz, Ejido de Tenayuca (Cola de Caballo)",R,-99.1642825,19.543933000000003,71
@PabloGCadena Las hormigas tambien estan organizándise pa lo mimo,Sun Oct 04 01:19:24 +0000 2020,Coahuila de Zaragoza,"Piedras Negras, Centro de Readaptación Social Piedras Negras",R,-100.6071045,28.774769,941
"Dia 1 después del regreso a #Merida. Pinches mini 🐜 hormigas , mi peor enemigo , que la lucha comience de nuevo !… https://t.co/jy0Fz5mno4",Sun Oct 04 18:51:39 +0000 2020,Yucatán,"Mérida, Mérida",U,-89.62361100000001,20.941035,921771
"Las #hormigas desarrollaron la #agricultura hace 50 millones de años 

Los #humanos a menudo nos vemos como los pio… https://t.co/3g4JhwGjA3",Sun Oct 04 23:44:27 +0000 2020,Puebla,"Cuyoaco, San Gabriel",R,-97.58046800000001,19.583526499999998,5
"@infraganti45 En tu historia olvidaste mencionar que en ese ""jarro"" había unas cuantas hormigas que tenían hundidas… https://t.co/jFngDvrqYg",Mon Oct 05 05:13:48 +0000 2020,Nuevo León,"Monterrey, Monterrey",U,-100.29359149999999,25.6417185,1142952
Gasto hormiga lo comparto (finanzas sanas) @fermeade @Isabellascurain @maytelascurain https://t.co/SvcgryM4Ar,Mon Oct 05 14:11:22 +0000 2020,Nuevo León,"Monterrey, Monterrey",U,-100.29359149999999,25.6417185,1142952
@heraldodemexico ¿Derraman miel? ¡Aguas con las hormigas! 😏😏😏,Mon Oct 05 15:20:10 +0000 2020,Jalisco,"Guadalajara, Guadalajara",U,-103.335882,20.676651999999997,1385621
@paumoheno Perdón por no traerte el pinche suero para hormigas puejjjj,Tue Oct 06 01:04:18 +0000 2020,Guanajuato,"León, Rancho de Don Alberto García",R,-101.601401,21.09806,1
