Tweet,Fecha,Estado,Locacion,Tipo,Longitud,Latitud,Poblacion
"Supuse que eran hormigas reinas, pero jamás las había visto tan grandes y menos en tal cantidad. Aquí otro video. 👇🏿 https://t.co/OMwAnvhOhi",Tue Jun 01 21:56:51 +0000 2021,México,"Toluca, Toluca de Lerdo",U,-99.655676,19.284321499999997,223876
"Mira a detalle el hormiguero. Cada hormiga sabe lo que le toca hacer. Algunas se saludan, otras cargan flores, las… https://t.co/WMfimI47Bi",Wed Jun 02 00:57:17 +0000 2021,Ciudad de México,"Benito Juárez, Benito Juárez",U,-99.1614805,19.380613,434153
@Uber_Support y me gustaba uber pero super incompetentes... Parece robo hormiga 😂,Wed Jun 02 01:24:13 +0000 2021,Ciudad de México,"Cuauhtémoc, Cuauhtémoc",U,-99.153366,19.432836,545884
Ptm perras hormigas me acaban de morder en casi todo el cuerpo mlllv.,Wed Jun 02 01:38:18 +0000 2021,San Luis Potosí,"San Luis Potosí, Jorge Ramos",R,-100.955511,22.3111195,0
"@viejo_cuervo Gracias Cuervito querido! 

Soy como las hormigas con alas, salgo con la lluvia 🤣

Bonito día 🖤",Wed Jun 02 12:27:57 +0000 2021,San Luis Potosí,"San Luis Potosí, Jorge Ramos",R,-100.955511,22.3111195,0
Cuando te crees un soldado del imperio pero pareces la hormiga atómica https://t.co/NX6Iqop9lX,Wed Jun 02 12:34:39 +0000 2021,Quintana Roo,"Solidaridad, San Carlos",R,-87.346982,20.5845305,27
Ya cállate pinche niña hormiga,Wed Jun 02 13:59:17 +0000 2021,Yucatán,"Mérida, Mérida",U,-89.62361100000001,20.941035,921771
Ya van como cuatro hormigas vampiro que me muerden en el cuello :(,Wed Jun 02 18:46:22 +0000 2021,Campeche,"Carmen, Balchacah",R,-91.6332875,18.4528265,11
"“La hormiga, por odio a la cucaracha, votó por el insecticida. TODOS MURIERON incluso el grillo que se abstuvo de v… https://t.co/9iiOtQOCw3",Fri Jun 04 02:01:41 +0000 2021,Chihuahua,"Aldama, El Papalote",R,-106.1628985,28.941865999999997,0
"#Elecciones2021
#VotoÚtil #MORENAEsUnPeligroParaMéxico
Crédito: Anónimo ""Si recoges 100 hormigas rojas y 100 hormig… https://t.co/JKAkdUYgT4",Fri Jun 04 19:29:24 +0000 2021,Querétaro,"Querétaro, El Huizachal de las Tetillas",R,-100.4405945,20.7152745,97
"Pero si tomas el frasco y lo sacudes violentamente, de manera automática las hormigas comenzarán a matarse entre si… https://t.co/F4HF5W272Z",Fri Jun 04 19:30:24 +0000 2021,Querétaro,"Querétaro, El Huizachal de las Tetillas",R,-100.4405945,20.7152745,97
"@g_bouillon @GuillermoBGR Y si simplemente les valemos madre, cómo cuando nosotros vemos a una colonia de hormigas en chinga?",Sat Jun 05 21:49:47 +0000 2021,Ciudad de México,"Cuauhtémoc, Cuauhtémoc",U,-99.153366,19.432836,545884
"@hormigabeback @penileyramirez @UInvestiga Estas Orate,va a ser en contra, fuera .",Sat Jun 05 23:24:01 +0000 2021,Ciudad de México,"Benito Juárez, Benito Juárez",U,-99.1614805,19.380613,434153
"@templa_6 Decían que por envidia  a la cucaracha la hormiga voto por el pesticida, al final todos murieron, hasta e… https://t.co/n9NTshznUF",Sun Jun 06 14:59:49 +0000 2021,Morelos,"Xochitepec, Los Estanques",R,-99.2446225,18.7644275,9
"""La hormiga, por odio a la cucaracha, votó por el insecticida.

Murieron todos, hasta el grillo que se abstuvo.""",Sun Jun 06 16:10:57 +0000 2021,Guerrero,"Acapulco de Juárez, El Zapote (Kilómetro Trece)",R,-99.73564950000001,16.9589495,5
"Después de votar un paseo haz de dar... #chicatanas, creo ja. #river #rio #oaxaca #hormigas #ants #nature… https://t.co/ddi1TJ8eIr",Sun Jun 06 17:20:54 +0000 2021,Oaxaca,"Oaxaca de Juárez, Guadalupe Victoria",R,-96.7250025,17.090319,685
"@Claudiashein Menos para la dinastía del ganso, sobre todo los que se hicieron ojo de hormiga con lo de la línea 12 del metro",Sun Jun 06 18:42:42 +0000 2021,Oaxaca,"Cuilápam de Guerrero, Estrella Blanca",R,-96.7575325,17.008149500000002,334
"La hormiga, por odio a la cucaracha votó por el insecticida. Murieron todos, hasta el grillo que se abstuvo.",Mon Jun 07 05:30:20 +0000 2021,Colima,"Colima, El Guayabo",R,-103.65673849999999,19.100341999999998,0
"Cuanto a que @AntonioLobito01 a partir de hoy se hace ojo de hormiga.. (como siempre)

#LeroLero",Mon Jun 07 12:09:20 +0000 2021,Ciudad de México,"Venustiano Carranza, Venustiano Carranza",U,-99.087817,19.4320755,443704
"@AlfredoJalife2 ¿ Santiagazo ú ojo de hormiga ?

Se puedo evitar con la complicidad con la alianza @PRI y… https://t.co/CKzPEYv3pP",Mon Jun 07 16:34:18 +0000 2021,Sonora,"Hermosillo, Vicente Guerrero",R,-111.498181,28.9698625,5
La hormiga cansado de la termita optó por el insecticida,Mon Jun 07 16:55:06 +0000 2021,Baja California,"Playas de Rosarito, Mesa Redonda",R,-116.929102,32.3328765,9
Buscándole chichis a las hormigas.,Wed Jun 09 01:57:20 +0000 2021,Ciudad de México,"Coyoacán, Coyoacán",U,-99.15234000000001,19.328383000000002,614447
"@Adonmar_ Aunque hubiera sido genial verlo probar ajiaco, changua, hormigas culonas o arepas huevo",Wed Jun 09 17:46:44 +0000 2021,México,"Ecatepec de Morelos, Ecatepec de Morelos",U,-99.0444445,19.56828,1643623
"@perlavelasco Alguien debería hacer una crónica del robo hormiga de los 50 centavos y musicalizada por fifty cents, oh yeah! @MonrazDiego",Wed Jun 09 18:03:04 +0000 2021,Jalisco,"Guadalajara, Guadalajara",U,-103.335882,20.676651999999997,1385621
"Gracias calor, ya todo se llena de hormigas.",Wed Jun 09 21:49:09 +0000 2021,Sinaloa,"Mocorito, El Sauce de Arriba",R,-107.781978,25.3573605,0
"Las personas bajitas suelen reírse solas, porque escuchan chistes de las hormigas.",Wed Jun 09 23:16:31 +0000 2021,Veracruz de Ignacio de la Llave,"Xalapa, La Troja",R,-96.886083,19.542054,88
@SuavesLomitos @sandraml29  JAJAJAJA cuando te metio el pie la hormiga,Wed Jun 09 23:35:12 +0000 2021,Jalisco,"Guadalajara, Guadalajara",U,-103.335882,20.676651999999997,1385621
"No quería matar a las hormigas que pasaron, así que las dejé pasar https://t.co/iFtZx62b57",Thu Jun 10 03:22:18 +0000 2021,Durango,"Durango, Metates (Tenchontle)",R,-104.83757800000001,23.954162500000002,194
No quería matar a las hormigas que pasaron por ahí https://t.co/MCW5MGfRaz,Thu Jun 10 03:22:45 +0000 2021,Durango,"Durango, Metates (Tenchontle)",R,-104.83757800000001,23.954162500000002,194
"Me acaban de atacar las hormigas, me muero me mordisquearon por todos lados 😩😩😩 https://t.co/pKB8PW3cWo",Thu Jun 10 05:15:14 +0000 2021,San Luis Potosí,"Ciudad Valles, Santa Rita",R,-99.076267,22.0774745,0
"@lopezdoriga Y los boletos del avión ya los pagaron o se hicieron ojo de hormiga
O
Es otra extorsión la que les est… https://t.co/4liGRJ3H6A",Fri Jun 11 00:00:22 +0000 2021,Querétaro,"Querétaro, El Huizachal de las Tetillas",R,-100.4405945,20.7152745,97
De verdad que tengo la paciencia del tamaño de una hormiga y el Rodri es afortunado porque con él es de el tamaño de un elefante alv.,Fri Jun 11 01:12:27 +0000 2021,Hidalgo,"Tula de Allende, San Andrés (San Andrés Tultepec)",R,-99.384564,20.0567145,1606
@unahormigasad Que sed,Fri Jun 11 06:34:06 +0000 2021,Ciudad de México,"La Magdalena Contreras, La Magdalena Contreras",U,-99.24800950000001,19.318042,246428
En el #PRD # EdoMéx la cosa se puede poner color de hormiga. La militancia se rebela contra su dirigente… https://t.co/zNYfHjM0We,Fri Jun 11 15:08:13 +0000 2021,México,"Toluca, Toluca de Lerdo",U,-99.655676,19.284321499999997,223876
Otra ves? Otro pinche gasto innecesario? Para que se hagan ojo de hormiga y pura publicidad,Fri Jun 11 16:40:53 +0000 2021,Ciudad de México,"Cuauhtémoc, Cuauhtémoc",U,-99.153366,19.432836,545884
@Chocoslovac0 Hormigas voladoras de Papantla en Villahermosa. 🤭,Sat Jun 12 00:47:08 +0000 2021,Yucatán,"Mérida, Mérida",U,-89.62361100000001,20.941035,921771
"Cuando empiezas una obra tienes paciencia al 100%... 

Al final, le mientas la madre hasta a la hormiga que se ahog… https://t.co/Prap2hwIOk",Sat Jun 12 03:35:40 +0000 2021,Quintana Roo,"Solidaridad, San Carlos",R,-87.346982,20.5845305,27
"Primero calor sofocante, luego llueve a cántaros, luego salen las hormigas voladoras y al final los murciélagos dom… https://t.co/ydQa53X5R0",Sat Jun 12 08:09:45 +0000 2021,Oaxaca,"Cuilápam de Guerrero, El Rosario [Barrio]",R,-96.778582,16.962189000000002,140
"Hormiga chicatana con piña mezcal,  piquín visítanos en la Catrinita #lineaprehispanica en Bazaar Sábado https://t.co/RP0d83pZPU",Sat Jun 12 19:33:32 +0000 2021,Ciudad de México,"La Magdalena Contreras, La Magdalena Contreras",U,-99.24800950000001,19.318042,246428
"El entrenamiento de supervivencia de los Elric y la deducción de Edward metafórica de la hormiga, me dejó pensando",Sun Jun 13 05:29:08 +0000 2021,Tabasco,"Cárdenas, El Jobo (Punta Brava)",R,-93.70619099999999,18.163317,431
"Suficiente según él, pues hay que recalcarle que existe el robo hormiga, que consiste en que la oposición empieza r… https://t.co/dZrbdxvvKg",Sun Jun 13 06:49:12 +0000 2021,San Luis Potosí,"Ciudad Valles, Santa Rita",R,-99.076267,22.0774745,0
@cochehormiga Mi hada favorita es esta y la tuya? 😊 https://t.co/MyL2Vi7Ra3,Mon Jun 14 18:32:55 +0000 2021,Querétaro,"Querétaro, El Huizachal de las Tetillas",R,-100.4405945,20.7152745,97
"Hormiga Reyna cavando su hormiguero, pueden ver que como recibe ayuda en Colonia Del Empleado. https://t.co/LOyemUKxyV",Mon Jun 14 20:45:04 +0000 2021,Morelos,"Cuernavaca, Loma del Tilcuate",R,-99.260819,18.933812,2
"@LGSrock101 Los mexicanos tenemos una memoria de hormiga!! Todas las estupideces, arrogancias, descuidos y valemadr… https://t.co/7lIEpVADxP",Tue Jun 15 00:35:57 +0000 2021,Ciudad de México,"La Magdalena Contreras, La Magdalena Contreras",U,-99.24800950000001,19.318042,246428
Hormigas saltan en mi pecho desnudo 💕 https://t.co/A4Fm2UHnIC,Tue Jun 15 01:52:07 +0000 2021,Veracruz de Ignacio de la Llave,"Emiliano Zapata, Los Reyes",R,-96.7223325,19.455647499999998,56
De esas veces que lavas trastes y te pica una hormiga en la panza.,Tue Jun 15 14:23:13 +0000 2021,Coahuila de Zaragoza,"Castaños, San Rafael",R,-101.4111225,26.524907500000005,2
@kary31758559 Es una hormiga?,Tue Jun 15 15:38:52 +0000 2021,Campeche,"Campeche, Edzná F-Uno [Centro de Recría]",R,-90.27714,19.601414,0
@DavidPramo2 Como dice mi papa con paciencia y saliva el elefante se cogio a la hormiga animo bro y la mejor de las vibras,Tue Jun 15 20:20:47 +0000 2021,Querétaro,"Querétaro, El Huizachal de las Tetillas",R,-100.4405945,20.7152745,97
Las cosas con Podolski se están poniendo color hormiga 😔,Wed Jun 16 01:49:26 +0000 2021,Querétaro,"Corregidora, La Cueva",R,-100.43973100000001,20.478755,2494
@apzarocker @SemillaHormiga Esta genial 👌🏼,Thu Jun 17 02:11:53 +0000 2021,Veracruz de Ignacio de la Llave,"Xalapa, La Troja",R,-96.886083,19.542054,88
"@JorgeEn01352100 @SinLinea_Mx O con la boca llena de hormiga en una zanja.abusivos, irrespetuosos.",Thu Jun 17 17:39:46 +0000 2021,Chiapas,"Palenque, Belem",R,-91.8061025,17.4616645,80
@DuquesaHarley @jlmarlora @gatitorelax @Sergedcg @Hormiga_Grunge @Francis50184075 @dinluz1 UE inteligente,Thu Jun 17 20:57:03 +0000 2021,Guanajuato,"León, Rancho de Don Alberto García",R,-101.601401,21.09806,1
"Hormigas 😍 🐜

#Insectos #Hormigas #Trabajadoras #Oaxaca https://t.co/LjUS0INSXQ",Fri Jun 18 02:52:32 +0000 2021,Oaxaca,"Oaxaca de Juárez, Guadalupe Victoria",R,-96.7250025,17.090319,685
Esto de que en Guadalajara tengamos hormigas voladoras del tamaño de cucarachas no lo supero eh,Fri Jun 18 09:54:02 +0000 2021,Jalisco,"Guadalajara, Guadalajara",U,-103.335882,20.676651999999997,1385621
"@p0psurt Oye yo también!!! De hormigas negras, en mi depa hay bastantes!!! 😠",Fri Jun 18 23:39:11 +0000 2021,Nuevo León,"Monterrey, Monterrey",U,-100.29359149999999,25.6417185,1142952
Me picó una hormiga reina en el pie y no quiten saber qué molesto.,Sat Jun 19 02:48:48 +0000 2021,Jalisco,"Guadalajara, Guadalajara",U,-103.335882,20.676651999999997,1385621
Yo siento que siempre traigo hormigas sobre de mi!,Sat Jun 19 07:13:26 +0000 2021,Quintana Roo,"Felipe Carrillo Puerto, Nohkancab",R,-88.0134815,19.749553,11
"""Hormigas"" de Ramón López Velarde un poema que nos acompañó en la juventud, tomado de la edición de Diana Rodríguez… https://t.co/40nkWMJGf9",Sat Jun 19 15:42:44 +0000 2021,Ciudad de México,"Cuauhtémoc, Cuauhtémoc",U,-99.153366,19.432836,545884
@vivirquintana #todassomoslahormigasolitaria 🤣,Sat Jun 19 22:31:59 +0000 2021,Morelos,"Tepoztlán, Tepoztlán",U,-99.10199700000001,18.991533,14719
Aqui chiflandole a las hormigas 💦💦 https://t.co/4OWP1PPeaC,Sun Jun 20 06:28:40 +0000 2021,Tamaulipas,"Reynosa, Agua Negra",R,-98.36253100000002,25.836567499999997,0
"Aquí literal llueven mangos, hormigas gigantes y te dan las buenas noches miles de sapos 😂",Sun Jun 20 13:35:17 +0000 2021,San Luis Potosí,"Tamasopo, La Chaca",R,-99.3495535,21.931283,0
@Capitan__Nemo @LaHormiga68 @HectorSisan @M451054R3 @HECTORITO Muy bueno,Sun Jun 20 15:01:51 +0000 2021,Jalisco,"Zapopan, Tesistán (San Francisco Tesistán)",U,-103.48477450000001,20.790657000000003,91631
"Me gusta sentarme cerca de la ventana, disfrutar un espacio verde. Ese baldío tiene cocuyos, hormigas, polillas, li… https://t.co/EmHiVM8zrg",Sun Jun 20 19:58:25 +0000 2021,Chiapas,"Tuxtla Gutiérrez, Tuxtla Gutiérrez",U,-93.13965950000001,16.7424355,578830
@Venussexxx @Sofiaripoll11 Café nambe mejor unas cheves con el café se me suben las hormigas,Sun Jun 20 20:24:26 +0000 2021,Nuevo León,"General Escobedo, Bios (Las Antonias)",R,-100.3652735,25.807314499999997,1
Amaaaaaaaá hoy comí hormiga Chicatana! https://t.co/rr5PiKZHcF,Sun Jun 20 20:57:53 +0000 2021,Chiapas,"San Cristóbal de las Casas, El Monte de Sión",R,-92.534411,16.663044499999998,246
"Ahora traía encima, lo que parece ser una hormiga voladora 😭
Me estoy planteando seriamente, usar repelente de inse… https://t.co/sRKnhylNsy",Mon Jun 21 04:44:53 +0000 2021,Ciudad de México,"Cuauhtémoc, Cuauhtémoc",U,-99.153366,19.432836,545884
Aquí hay muchas hormigas 🐜,Mon Jun 21 15:52:23 +0000 2021,Morelos,"Temixco, Unidad Piscícola Joya Palomares",R,-99.27392950000001,18.8466465,54
@BrigadaHormigas @ManosTierra @BicitlanRadio @BicireporteraDF @MayaEnBici @AbrilReza @BiciManager @BiciOrientados… https://t.co/FdCJlmTsFT,Mon Jun 21 19:45:41 +0000 2021,Ciudad de México,"Gustavo A. Madero, Gustavo A. Madero",U,-99.1158905,19.518656,1173351
@lopezdoriga Si las donaciones no alcanzaban ahora ya saben por donde estaba el robo hormiga!,Tue Jun 22 02:16:39 +0000 2021,México,"Lerma, Ejido de San Mateo Atarasquillo",R,-99.47699349999999,19.3262775,945
You mean… cogerse de la mano? Porque la Nohemí de la prepa hablaba con las hormigas 👀 https://t.co/IfDtIlpVka,Tue Jun 22 02:42:18 +0000 2021,Jalisco,"Guadalajara, Guadalajara",U,-103.335882,20.676651999999997,1385621
"Y hablando de estos malditos gastos hormiga… 💸🐜

https://t.co/54GnyAbkYB",Tue Jun 22 21:23:11 +0000 2021,Ciudad de México,"Cuauhtémoc, Cuauhtémoc",U,-99.153366,19.432836,545884
"Desde aquel día me trajeron para acá
¿Será porque no me dejaba rasurar?
Ya no me hablan ni si quiera las hormigas
¿… https://t.co/0ln1OVoA4x",Wed Jun 23 01:29:55 +0000 2021,Sinaloa,"Culiacán, Culiacán Rosales",U,-107.397805,24.814668,808416
@CartonCalderon El famoso gasto hormiga,Wed Jun 23 14:09:03 +0000 2021,Sinaloa,"Culiacán, Santa Lucía",R,-107.3420565,24.6624885,0
Somos las hormigas que robamos tu comida... en Museo de Historia Natural https://t.co/5NINAFHzhR,Wed Jun 23 16:27:31 +0000 2021,Ciudad de México,"Miguel Hidalgo, Miguel Hidalgo",U,-99.2115105,19.4299345,414470
"ANT de “Anterior”, no de hormiga. Parece que Google no es tan listo como parece. https://t.co/JZXjSmCEfX",Wed Jun 23 19:47:55 +0000 2021,Aguascalientes,"Aguascalientes, El Centavito 2",R,-102.327207,21.849459000000003,6
"Les recomiendo muchísimo la pomada para rozaduras #Hipoglos 😍
Para acné, picaduras de moscos, hormigas, aclarado de… https://t.co/7NxMS3tG8k",Thu Jun 24 04:05:16 +0000 2021,Veracruz de Ignacio de la Llave,"Pueblo Viejo, Chijol Corona",R,-97.8225365,22.283026,0
"@PauSchrodinger @SemillaHormiga Totalmente de acuerdo, esas salsas están de👌🏼",Thu Jun 24 16:37:10 +0000 2021,Veracruz de Ignacio de la Llave,"Xalapa, La Troja",R,-96.886083,19.542054,88
"@JUMAMHER Si. Hormigas Reyna.
Hoy salen a buscar nueva vida...algunas acaban en el molcajete.",Thu Jun 24 21:46:51 +0000 2021,Ciudad de México,"Coyoacán, Coyoacán",U,-99.15234000000001,19.328383000000002,614447
"Ya vieron mi último Tik tok dónde hablo de la hormiga chicatana?

Bueno aquí se los dejo 

https://t.co/fAys2gHP9U",Thu Jun 24 22:19:26 +0000 2021,México,"Cuautitlán Izcalli, Ejido Santa María Tianguistengo",R,-99.233657,19.6562895,6730
"Hormigas somos todós, solo cambia el hormiguero.

#NeverGiveUp 
#TiemposDeCambio 🥀 en Multimedios TV https://t.co/wy4vUUg6up",Fri Jun 25 03:01:02 +0000 2021,Nuevo León,"Monterrey, Monterrey",U,-100.29359149999999,25.6417185,1142952
Y mis pies en el suelo tanto que hasta oigo el paso de las hormigas,Fri Jun 25 14:51:49 +0000 2021,Nuevo León,"San Nicolás de los Garza, San Nicolás de los Garza",U,-100.27047400000001,25.736714999999997,412199
El día de hoy les vengo manejando una terrible invasión de hormigas rojas en mi cuarto!! Llevo ya a la conclusión d… https://t.co/tTvDXz4jWS,Fri Jun 25 19:33:01 +0000 2021,Quintana Roo,"Solidaridad, San Carlos",R,-87.346982,20.5845305,27
Resulta q las hormigas son n microwave safe,Fri Jun 25 19:56:25 +0000 2021,Chihuahua,"Juárez, Luis Carlos Ruiz",R,-106.568008,31.452274000000003,0
"Nos mudamos
#Hormigas en Queretaro https://t.co/9pXsM5HWpB",Sat Jun 26 04:32:39 +0000 2021,Querétaro,"Querétaro, El Huizachal de las Tetillas",R,-100.4405945,20.7152745,97
La hormiga atómica en Cerro del Chupon https://t.co/krF2LV8XzN,Sat Jun 26 16:03:50 +0000 2021,Nuevo León,"Monterrey, Monterrey",U,-100.29359149999999,25.6417185,1142952
mi noche iba cnmadre hasta que a 2 hormigas se les ocurrió picarme en el párpado 😩 ahora toy tuerta,Sat Jun 26 18:41:41 +0000 2021,Coahuila de Zaragoza,"Piedras Negras, Centro de Readaptación Social Piedras Negras",R,-100.6071045,28.774769,941
"Las odio hormigas, las odio.",Sun Jun 27 00:46:46 +0000 2021,Nuevo León,"San Nicolás de los Garza, San Nicolás de los Garza",U,-100.27047400000001,25.736714999999997,412199
"Mis papás no me dejan salir por el puto covid, y la gente de mi ciudad como si nada, salen y andan alv como hormiga… https://t.co/vaECZagYOc",Sun Jun 27 02:35:31 +0000 2021,Campeche,"Carmen, Balchacah",R,-91.6332875,18.4528265,11
Enorme Hormiga! Solo aquí... En #Queretaro https://t.co/Y9RgBboVNp,Sun Jun 27 02:47:22 +0000 2021,Querétaro,"El Marqués, El Pozo",R,-100.33349,20.649345,1335
"A propósito de todo lo que a diario encuentro en Twitter, les comparto este mensaje:🧵 

Si recoges 100 hormigas neg… https://t.co/RPhJTaWz5h",Sun Jun 27 13:40:40 +0000 2021,México,"Toluca, Toluca de Lerdo",U,-99.655676,19.284321499999997,223876
@Cuauhtemoc_1521 Me gustan más solas o así:  queso fresco de petate de Oaxaca con hormigas chicatanas y/o con gusan… https://t.co/9wa2m4G0a2,Sun Jun 27 18:38:08 +0000 2021,Ciudad de México,"Coyoacán, Coyoacán",U,-99.1525965,19.3206955,614447
Últimamente veo y siento el mundo gigante y yo una hormiga. ¿Luna en Géminis ?,Mon Jun 28 03:05:44 +0000 2021,Campeche,"Campeche, Edzná F-Uno [Centro de Recría]",R,-90.27714,19.601414,0
@EliezerMansilla A las hormigas les da dolor de hormigas ?,Tue Jun 29 04:36:12 +0000 2021,Tamaulipas,"Victoria, La Esperanza",R,-99.187904,23.685934,0
"@pollitodecolors Confirmadisimo, tengo hormigas por todos lados 😭",Tue Jun 29 04:43:45 +0000 2021,Veracruz de Ignacio de la Llave,"Boca del Río, Veracruz",U,-96.0989905,19.1431005,132011
"Asegurese de que este bien construido, de que no haya robo hormiga y que sea de material indicado porqué  si no a q… https://t.co/4kPr4xFmuh",Tue Jun 29 23:04:07 +0000 2021,Durango,"Gómez Palacio, Colonia Agrícola Buendía",R,-103.50417999999999,25.711095,11
"Hoy me picaron 3 abejas y un chingo de moscos y hormigas, y aún así, fui feliz con mi chelita Superior. https://t.co/8CKiQKIGTR",Wed Jun 30 01:42:13 +0000 2021,Veracruz de Ignacio de la Llave,"Nautla, La Aurora",R,-96.798368,20.119326,1
"@dannnnnnnnnnny1 ¡Aguas con los gastos hormiga! 
Divide tu dinero... Real, de que renta, super, transporte, incluso… https://t.co/zo2fcIBJoG",Wed Jun 30 09:18:13 +0000 2021,Querétaro,"Querétaro, El Huizachal de las Tetillas",R,-100.4405945,20.7152745,97
"No se trata de estar ocupado, las hormigas lo están 🐜

La pregunta es ¿ocupado en qué? 🤔

Una de las frases que más… https://t.co/UB1VMAyil0",Wed Jun 30 14:11:26 +0000 2021,Aguascalientes,"Aguascalientes, El Centavito 2",R,-102.327207,21.849459000000003,6
"@_CarlieYo Las hormigas también tienen barba, no lo sabía. https://t.co/2kRjgQOF7m",Wed Jun 30 18:39:39 +0000 2021,Sonora,"Empalme, Punta Calaveras",R,-110.72232699999999,27.8836995,1
@unahormigasad 😧😦😮,Wed Jun 30 23:34:39 +0000 2021,Ciudad de México,"La Magdalena Contreras, La Magdalena Contreras",U,-99.24800950000001,19.318042,246428
Odio que las hormigas se suban a mi cuerpo. 😥,Thu Jul 01 09:29:48 +0000 2021,Baja California Sur,"La Paz, Aguajito de Castro",R,-110.8545845,24.107996999999997,0
"Pues obviaaaaaaa mi ciiieeeelaaaaa!!!!! Estamos del mismo tamaño que las hormigas🤷‍♀️🤣 en San Andrés Ixtlán, Jalisc… https://t.co/dnCQJ4MeUU",Thu Jul 01 13:39:10 +0000 2021,Jalisco,"Gómez Farías, Los Pozos",R,-103.4185115,19.860804,0
"@BanorteEscucha ¿Porqué hacen robos hormiga? Ya van dos veces que me falta dinero de mi tarjeta sin usarla ,😐",Thu Jul 01 13:59:15 +0000 2021,Nuevo León,"Monterrey, Monterrey",U,-100.29359149999999,25.6417185,1142952
@MiseleccionFem A de estar matando hormigas!! Muy grande le quedó el puesto de DT!! No creo que en el pasto esté la… https://t.co/VJ1puEi9Fm,Sat Jul 03 03:53:06 +0000 2021,Nuevo León,"Apodaca, El Tasajillo",R,-100.1687175,25.778679,0
No sé si realmente me picó una hormiga o es por que ando bien peda/high,Sat Jul 03 05:56:03 +0000 2021,Sonora,"San Luis Río Colorado, Estación Torres",R,-114.2965185,31.992337,0
Aún se pueden dar los buenos días? La favorita de mi hijo 🌶@SemillaHormiga https://t.co/f9jufzsA56,Sat Jul 03 17:11:50 +0000 2021,Veracruz de Ignacio de la Llave,"Xalapa, La Troja",R,-96.886083,19.542054,88
Acaricias a las hormigas,Sat Jul 03 18:17:54 +0000 2021,México,"Ecatepec de Morelos, Ecatepec de Morelos",U,-99.0444445,19.56828,1643623
@RoyCampos Estimado Roy: ¿Y la hormiga chicatana no cuenta porque estaba de espaldas?,Sat Jul 03 21:56:58 +0000 2021,Ciudad de México,"Benito Juárez, Benito Juárez",U,-99.1614805,19.380613,434153
@CamilaPelcastre Además el extra se cuida el bolsillo porque como se va $ en bebidas embotelladas en gasto hormiga,Sun Jul 04 01:41:30 +0000 2021,Baja California,"San Quintín, El Tablón",R,-115.5798785,30.156488499999995,4
"Robo hormiga en  @DHMonterrey  están haciendo robo con las pruebas de #COVID19 lo están  cobrando en  $4,600 pesos… https://t.co/OsOjtqHqzL",Sun Jul 04 03:00:28 +0000 2021,Nuevo León,"Monterrey, Monterrey",U,-100.29359149999999,25.6417185,1142952
Color de hormiga 🐜,Sun Jul 04 20:18:06 +0000 2021,Puebla,"Puebla, Fundadores del Ejido Colonia Chapultepec",R,-98.1542665,19.0322295,550
"@CerdonioBrandon @Soy_leonidas @fernandeznorona Esa asquerosidad de ser humano no lo siguen ni las hormigas... 
#Noroñalamierdademexico",Mon Jul 05 15:14:25 +0000 2021,México,"Toluca, Toluca de Lerdo",U,-99.655676,19.284321499999997,223876
@diegochro Deja tú las hormigas …,Mon Jul 05 17:41:43 +0000 2021,Sonora,"Hermosillo, Vicente Guerrero",R,-111.498181,28.9698625,5
@unahormigasad Rompemelo,Mon Jul 05 19:19:02 +0000 2021,Ciudad de México,"La Magdalena Contreras, La Magdalena Contreras",U,-99.24800950000001,19.318042,246428
Una hormiga me pico el labio como casi ni tengo 🤣 comenzando el martes con todo.,Tue Jul 06 11:38:45 +0000 2021,Tabasco,"Centro, Medellín y Pigua 1ra. Sección",R,-92.9164995,18.0219595,352
"Yo, a una hormiga en la cocina: 
–¿No te avisaron? Ya nadie pasa por aquí.",Tue Jul 06 16:12:17 +0000 2021,Jalisco,"Guadalajara, Guadalajara",U,-103.335882,20.676651999999997,1385621
@BunnyDballZ Estos jijos de se rchm ..😡😡y yo aquí disfrutando mis hormigas. https://t.co/2xPq9n3R8V,Tue Jul 06 16:57:01 +0000 2021,Colima,"Colima, El Guayabo",R,-103.65673849999999,19.100341999999998,0
@IoMhero Se te van a subir las hormigas,Tue Jul 06 20:13:55 +0000 2021,Sonora,"Hermosillo, Vicente Guerrero",R,-111.498181,28.9698625,5
"Lo andamos buscando doctora, pero ""se hizo ojo de hormiga trágame tierra, yo te reclamó""

🤣🤣🤣

Tu crees? 🧐",Wed Jul 07 02:25:50 +0000 2021,Ciudad de México,"Gustavo A. Madero, Gustavo A. Madero",U,-99.1158905,19.518656,1173351
"Me levante muy temprano para hacer operación hormiga y robarme limones de rancho de mi tío.

Mi día comenzó al millón 😍",Wed Jul 07 12:25:03 +0000 2021,Veracruz de Ignacio de la Llave,"Poza Rica de Hidalgo, Salinas",R,-97.44439349999999,20.5103815,3
JAJAJAJAJAJAJA por eso nomás hay que treparse a la barra y ellxs vienen como hormigas al dulce 😂,Wed Jul 07 13:22:39 +0000 2021,Quintana Roo,"Solidaridad, San Carlos",R,-87.346982,20.5845305,27
"La relación que mantienen las hormigas y las acacias es bien interesante y un ejemplo maravilloso de coevolución, y… https://t.co/xmvWuZfg0F",Wed Jul 07 14:50:30 +0000 2021,Hidalgo,"Mineral de la Reforma, San Luis II",R,-98.7155595,20.053718500000002,1457
"Al que es puro dulce, se lo comen las hormigas ... en Ciudad de Mexico CDMX https://t.co/9q21xBOgrn",Wed Jul 07 23:31:22 +0000 2021,Ciudad de México,"Benito Juárez, Benito Juárez",U,-99.1614805,19.380613,434153
