Tweet,Fecha,Estado,Locacion,Tipo,Longitud,Latitud,Poblacion
"Es Queso Oaxaca boludos, no mamen con los que dicen quesillo xddddd",Sat Feb 20 23:16:57 +0000 2021,Ciudad de México,"La Magdalena Contreras, Primer Dinamo",R,-99.26452649999999,19.2755645,0
@CartunMemes Quesillo/queso Oaxaca 🤭,Sat Feb 20 23:23:38 +0000 2021,Puebla,"Puebla, Fundadores del Ejido Colonia Chapultepec",R,-98.1542665,19.0322295,550
"@Terribledavid @CartunMemes Hebra, Oaxaca, quesillo",Sat Feb 20 23:44:18 +0000 2021,Chiapas,"Palenque, Belem",R,-91.8061025,17.4616645,80
"@CartunMemes Es quesillo, no?",Sun Feb 21 00:14:50 +0000 2021,Nuevo León,"Monterrey, Monterrey",U,-100.29359149999999,25.6417185,1142952
"@kal33552316 Pues es queso Oaxaca.
También llamado quesillo.
""Queso"" no!!",Sun Feb 21 01:14:56 +0000 2021,Puebla,"San Gregorio Atzompa, San Miguel",R,-98.3447715,19.0145205,454
@CartunMemes Quesillo #Puebla,Sun Feb 21 01:26:26 +0000 2021,Puebla,"Puebla, Fundadores del Ejido Colonia Chapultepec",R,-98.1542665,19.0322295,550
@BlancoGeneral General para Los Oaxaqueños éste es nuestro QUESILLO: https://t.co/Zc60rcJhBY,Sun Feb 21 01:27:42 +0000 2021,Oaxaca,"San Mateo Yoloxochitlán, San Mateo Yoloxochitlán",U,-96.869612,18.137318999999998,2752
No creo que el Queso Oaxaca sepa igual que el “Quesillo” 😉,Sun Feb 21 05:10:07 +0000 2021,Nuevo León,"Guadalupe, Las Escobas",R,-100.196134,25.6766035,3
@kary_Bella1 También le dicen quesillo en CdMx,Sun Feb 21 05:32:16 +0000 2021,Ciudad de México,"Gustavo A. Madero, Gustavo A. Madero",U,-99.1158905,19.518656,1173351
"@GatoFenriz @Ninurri Sorry no andaba por aquí, pero ahora si XD XD y no, en Oaxaca se llama quesillo. P ejemplo el… https://t.co/44hnDzC2Te",Sun Feb 21 07:02:01 +0000 2021,Oaxaca,"Oaxaca de Juárez, Guadalupe Victoria",R,-96.7250025,17.090319,685
"Queso Oaxaca o quesillo, como quieran llamarle pero es lo más puto rico del mundo, punto.",Sun Feb 21 07:20:49 +0000 2021,Guerrero,"Acapulco de Juárez, El Zapote (Kilómetro Trece)",R,-99.73564950000001,16.9589495,5
"@CartunMemes Queso Oaxaca o quesillo, lo venden en Oaxaca, pero lo hacen en Chipilo, Puebla.",Sun Feb 21 15:02:05 +0000 2021,Querétaro,"Huimilpan, La Cuesta",R,-100.296487,20.418515499999998,181
@CartunMemes Quesillo,Sun Feb 21 17:03:51 +0000 2021,Quintana Roo,"Benito Juárez, Premasa del Caribe",R,-87.0316645,21.048719,0
@GeorginaHolguin @Andres_Vaca_ Para las quesadillas nada mejor que un exquisito quesillo de Oaxaca: https://t.co/wcnl7MSdvs,Sun Feb 21 18:51:56 +0000 2021,Oaxaca,"San Mateo Yoloxochitlán, San Mateo Yoloxochitlán",U,-96.869612,18.137318999999998,2752
"Cojín de ""quesillo"", también conocido como Queso Oaxaca 🤭✨

https://t.co/CniAC5QWiK
https://t.co/IH1tAYqRKL
**… https://t.co/YkOMPMsU8U",Sun Feb 21 21:26:38 +0000 2021,Oaxaca,"Oaxaca de Juárez, Oaxaca de Juárez",U,-96.723858,17.06547,258913
Quesillo.,Sun Feb 21 21:41:53 +0000 2021,Querétaro,"El Marqués, Don Chepe [Rancho]",R,-100.2783405,20.7456405,0
"A #ComerOaxaca con esta blanda de chorizo. 
En su interior descansa una base de quesillo, frijol, cebolla, perejil… https://t.co/X29BIfJQSB",Mon Feb 22 01:32:25 +0000 2021,Oaxaca,"Santiago Apóstol, Santiago Apóstol",U,-96.7161255,16.783264000000003,3821
Para participar vayan a nuestro instagram 🤭✨El primer lugar se lleva un Peluche de Quesillo o también conocido como… https://t.co/zJypjL8mzV,Tue Feb 23 19:34:10 +0000 2021,Oaxaca,"Oaxaca de Juárez, Guadalupe Victoria",R,-96.7250025,17.090319,685
Si me voy por un quesillo de alcachofas del 55,Tue Feb 23 21:31:50 +0000 2021,Sonora,"Empalme, Punta Calaveras",R,-110.72232699999999,27.8836995,1
@memocrata eso no lo discuto ni lo contradigo pero... pinches Poblanos. *come quesillo Poblano pirata*,Wed Feb 24 19:34:40 +0000 2021,Oaxaca,"Oaxaca de Juárez, Guadalupe Victoria",R,-96.7250025,17.090319,685
"Se me antoja un quesillo doble crema, una galleta dos naciones y una coquita #HeavenOnEarth",Thu Feb 25 13:31:57 +0000 2021,Tabasco,"Nacajuca, El Hormiguero",R,-92.9447745,18.175748,531
"Si llevo quesos 🧀 (no quesillo, no hebra, no queso tipo) ¿Me compran?
Asadero, Clavel, Menonita, Chihuahua. 
Esos q… https://t.co/JFrbBD5EvY",Thu Feb 25 19:25:40 +0000 2021,Chihuahua,"Juárez, Luis Carlos Ruiz",R,-106.568008,31.452274000000003,0
Ya se me acabó el tasajo y quesillo https://t.co/CTKkJydtIK,Thu Feb 25 22:50:41 +0000 2021,Ciudad de México,"Gustavo A. Madero, Gustavo A. Madero",U,-99.1158905,19.518656,1173351
"En Oaxaca accidentalmente inventaton el quesillo, cualquier otro nombre es locura de un ranchero!! 😂",Fri Feb 26 16:37:49 +0000 2021,Oaxaca,"Oaxaca de Juárez, Guadalupe Victoria",R,-96.7250025,17.090319,685
@dindopaulo Y con una bolsita de quesillo,Fri Feb 26 18:32:36 +0000 2021,México,"Huehuetoca, Privadas del Valle [Fraccionamiento]",U,-99.25942699999999,19.827575000000003,3733
"@ElRancheroLoco Quesillo, queso hebra,",Fri Feb 26 21:53:25 +0000 2021,Oaxaca,"Oaxaca de Juárez, Guadalupe Victoria",R,-96.7250025,17.090319,685
"Me hice un vampiro con tortilla de nopal y quesillo... No lo hagan, siento vergüenza de esto.",Sat Feb 27 06:55:22 +0000 2021,Sinaloa,"Culiacán, Santa Lucía",R,-107.3420565,24.6624885,0
@Jaxmetalmax Queso Oaxaca pero pss realmente se llama quesillo.,Sat Feb 27 07:09:48 +0000 2021,Sinaloa,"Culiacán, Santa Lucía",R,-107.3420565,24.6624885,0
@mujerdeoaxaca Lo mejor es que ahorea existe un peluche de Quesillo ✨🤭,Sat Feb 27 20:02:38 +0000 2021,Oaxaca,"Oaxaca de Juárez, Guadalupe Victoria",R,-96.7250025,17.090319,685
"@vic_tigre @MatamorosGuridi Lo que sería ""queso Oaxaca"" o quesillo",Sun Feb 28 20:23:28 +0000 2021,México,"Toluca, Toluca de Lerdo",U,-99.655676,19.284321499999997,223876
"“Fuerza de voluntad.”

Deshebrar el quesillo sin comerte un pedazo.",Mon Mar 01 15:55:28 +0000 2021,México,"Ixtapaluca, El Campamento (Las Cocinas)",R,-98.7972475,19.359356,8
Los CDC advierten a las personas que no deben comer quesillo y requesón debido a la posible contaminación por liste… https://t.co/Trsj5SkQV7,Mon Mar 01 16:47:26 +0000 2021,México,"Nezahualcóyotl, Nezahualcóyotl Segundo [Relleno Sanitario]",R,-99.01701650000001,19.432722,23
Por favor no metan al Quesillo Oaxaqueño en esos dilemas.,Mon Mar 01 19:43:19 +0000 2021,Oaxaca,"Oaxaca de Juárez, Guadalupe Victoria",R,-96.7250025,17.090319,685
"Team el frío es mejor,unos Buenos machetes de bistec con quesillo y su harta salsuca,eso si es sabrosura, con su re… https://t.co/NWoHtisUsy",Thu Mar 04 01:03:09 +0000 2021,México,"Ecatepec de Morelos, Ecatepec de Morelos",U,-99.0444445,19.56828,1643623
Chale... Pedí una Nutella y me dijeron que las gorditas llevan quesillo 😞,Sat Mar 06 19:49:24 +0000 2021,Ciudad de México,"Coyoacán, Coyoacán",U,-99.15234000000001,19.328383000000002,614447
"Productos de una época🤤🤤 recuerdo que eran parte de mi merienda escolar, la gelatina, quesillo y el arroz con leche… https://t.co/bRgXql09Zr",Mon Mar 08 22:56:55 +0000 2021,Jalisco,"Zapopan, Tesistán (San Francisco Tesistán)",U,-103.48477450000001,20.790657000000003,91631
@NoraGuillen63 Mi mamá me  compraba el quesillo que es el que recuerdo🤤,Tue Mar 09 00:25:59 +0000 2021,Jalisco,"Zapopan, Tesistán (San Francisco Tesistán)",U,-103.48477450000001,20.790657000000003,91631
#9M2021 Día nacional de la Gordita con quesillo 😂🙌🏼🤷🏻‍♂️,Tue Mar 09 13:54:26 +0000 2021,Ciudad de México,"Gustavo A. Madero, Gustavo A. Madero",U,-99.1158905,19.518656,1173351
Extrañaba mucho el quesillo 🥺,Thu Mar 11 01:26:33 +0000 2021,Oaxaca,"Oaxaca de Juárez, Guadalupe Victoria",R,-96.7250025,17.090319,685
"Hoy... Enmoladas, con quesillo y harta crema!! 🤘🏻🤘🏻🤘🏻🤘🏻🤘🏻🤘🏻😋 https://t.co/eqIXPHWS8z",Thu Mar 11 15:16:27 +0000 2021,Ciudad de México,"Tlalpan, Cañada del Acueducto",R,-99.208364,19.199485,161
Por qué le dicen quesillo al queso Oaxaca ! 🤔🤔🤔🤔,Thu Mar 11 20:50:23 +0000 2021,Chiapas,"Las Margaritas, Santuario",R,-91.747266,16.377216500000003,125
"Grave error de mi mamá ese de ponerme a deshebrar el quesillo, me lo termino tragando todo 😟",Thu Mar 18 19:39:21 +0000 2021,Puebla,"Puebla, Fundadores del Ejido Colonia Chapultepec",R,-98.1542665,19.0322295,550
"@LaQueretanita Te iba a ofrecer con quesillo, pero ya te lo gratinaron 😜",Sat Mar 20 12:43:16 +0000 2021,México,"Cuautitlán, Paseos del Bosque [Conjunto Urbano]",U,-99.1634475,19.678076,3983
"Me acabo de preparar unos huevos revueltos con #quesillo, es lo más delicioso del mundo 🤤",Mon Mar 22 15:53:24 +0000 2021,Oaxaca,"Oaxaca de Juárez, Guadalupe Victoria",R,-96.7250025,17.090319,685
"Siempre me da algo cuando le dicen así al quesillo, por lo menos espero sea producto de aquí y no de Puebla.",Tue Mar 23 14:51:01 +0000 2021,Oaxaca,"Oaxaca de Juárez, Guadalupe Victoria",R,-96.7250025,17.090319,685
"Justo lo que necesito. 🥰 
#MiniQuesillos 🤤 https://t.co/enrD2lRGnC",Tue Mar 23 18:39:18 +0000 2021,Oaxaca,"San Mateo Cajonos, San Mateo Cajonos",U,-96.21069,17.1575475,483
@pandirux Quesillo es el queso Oaxaca ? Jejeje yo le digo queso de resorte,Tue Mar 23 21:03:14 +0000 2021,Veracruz de Ignacio de la Llave,"Emiliano Zapata, Los Reyes",R,-96.7223325,19.455647499999998,56
En dónde viven ¿a como las tortas de Milanesa con quesillo?  Acá de a 50,Wed Mar 24 01:54:43 +0000 2021,Ciudad de México,"Azcapotzalco, Azcapotzalco",U,-99.18212600000001,19.4857835,432205
Quesillo *,Wed Mar 24 02:53:37 +0000 2021,Jalisco,"Zapopan, Tesistán (San Francisco Tesistán)",U,-103.48477450000001,20.790657000000003,91631
@rimeldemieI aguas que al rato llega la policía del queso a decir que se dice _quesillo o queso de hebra_,Wed Mar 24 04:10:48 +0000 2021,Chihuahua,"Aldama, El Papalote",R,-106.1628985,28.941865999999997,0
@tesiture Checa nuestra tienda✨ tenemos quesillos  de peluche 🤩 #quesillo #quesooaxaca https://t.co/b0HUHX6dGE,Thu Mar 25 01:20:37 +0000 2021,Oaxaca,"Oaxaca de Juárez, Guadalupe Victoria",R,-96.7250025,17.090319,685
"Reyes Etla, la cuna del quesillo.
https://t.co/Abu3BevvOn",Thu Mar 25 16:16:39 +0000 2021,Oaxaca,"Oaxaca de Juárez, Guadalupe Victoria",R,-96.7250025,17.090319,685
"@luis_jesusruiz @tesiture Quesillo botanero jajaja, o quesillo bebé JAJAJA",Fri Mar 26 00:59:31 +0000 2021,Oaxaca,"San Pablo Etla, Camino al Seminario (Tercera Sección)",R,-96.72434799999999,17.1526365,15
"Ps ya ni pedo me comí mi taco.
Acto seguido llega otra persona y pide su quesadilla con *quesillo* y si le ponen QU… https://t.co/1wl6EXpulJ",Sun Mar 28 01:19:34 +0000 2021,Ciudad de México,"Benito Juárez, Benito Juárez",U,-99.1614805,19.380613,434153
Sin olvidar el quesillo de Oaxaca y el Chihuahua 🤤🤤🤤🤤,Sun Mar 28 03:38:49 +0000 2021,Nayarit,"Bahía de Banderas, Juan Colorado",R,-105.2845295,20.835845,0
Amo decir quesillo. https://t.co/s0bSHbdL1n,Mon Mar 29 02:11:42 +0000 2021,Baja California,"Playas de Rosarito, Mesa Redonda",R,-116.929102,32.3328765,9
Yo soy #TeamQuesillo ¿y tú?,Mon Mar 29 03:46:36 +0000 2021,México,"Tultepec, Paraje Trigo Tenco",R,-99.119063,19.678236,832
@yerpcr @DelimarR @DiegoRuzzarin Eso no es quesillo :v,Mon Mar 29 08:05:42 +0000 2021,Oaxaca,"Magdalena Apasco, Santa Martha Etla",R,-96.8115645,17.2502435,867
"@msalgadort Lisiado, quesillo, colación",Tue Mar 30 21:48:34 +0000 2021,Aguascalientes,"Aguascalientes, El Centavito 2",R,-102.327207,21.849459000000003,6
Valiendo quesillo 😬,Wed Mar 31 04:12:39 +0000 2021,Coahuila de Zaragoza,"Viesca, El Alto del Palomillo",R,-103.23313,25.244222999999998,0
@Quesillo_o @ZazCross @AverageMexGuy Plot twist,Wed Mar 31 16:06:00 +0000 2021,Michoacán de Ocampo,"Zamora, Romero de Guzmán",R,-102.26462249999999,20.0301115,1280
¿Será que me tatuó a Lenny (mi laptop) en la siguiente sesión? 🤔🤔🤔 A Lenny y un quesillo porque #prioridades claro… https://t.co/duj5a2d2UJ,Wed Mar 31 18:54:23 +0000 2021,Oaxaca,"Oaxaca de Juárez, Guadalupe Victoria",R,-96.7250025,17.090319,685
"Las hamburguesas no llevan jamón, quesillo, piña, cebolla caramelizada, chipotle, aguacate ni nada que sea mexicano… https://t.co/1zaKlDxrRa",Sun Apr 04 14:50:39 +0000 2021,Tlaxcala,"Tlaxcala, San Hipólito Chimalpa",U,-98.24676550000001,19.3184175,2851
"Dos super quesadillas con harto quesillo y una michelada
Creo es suficiente.
Buen provecho amigos.",Sun Apr 04 19:43:13 +0000 2021,México,"Ixtapaluca, El Campamento (Las Cocinas)",R,-98.7972475,19.359356,8
Enamorada del quesillo🤍,Sun Apr 04 23:07:45 +0000 2021,Ciudad de México,"Coyoacán, Coyoacán",U,-99.15234000000001,19.328383000000002,614447
Huarache verde con costilla y quesillo. Buen lunes. https://t.co/qapOhF52VY,Mon Apr 05 18:02:00 +0000 2021,Ciudad de México,"Coyoacán, Coyoacán",U,-99.15234000000001,19.328383000000002,614447
Ya huele a quesillo 🌧 .,Tue Apr 06 00:36:10 +0000 2021,Oaxaca,"Oaxaca de Juárez, Guadalupe Victoria",R,-96.7250025,17.090319,685
@Quesillo_o Por eso lo haré con el de abajo XD,Tue Apr 06 03:07:10 +0000 2021,Michoacán de Ocampo,"Zamora, Romero de Guzmán",R,-102.26462249999999,20.0301115,1280
"Tipo que aquí no se da el quesillo y estaba muy preocupada porque weeey yo sobrevivo de quesadillas, y hoy después… https://t.co/za8kdCPMcI",Tue Apr 06 21:27:55 +0000 2021,Guanajuato,"Celaya, El Alto",R,-100.772211,20.5226915,4
Mi abuelita nos mando quesillo de Oaxaca y tasajo 🤩🤩.,Thu Apr 08 01:46:00 +0000 2021,Zacatecas,"Guadalupe, La Esmeralda",R,-102.42488650000001,22.7666095,2
¡Que pinches ganas de una torta de pierna con quesillo de cualquier puesto callejero de la CDMX!,Fri Apr 09 15:40:59 +0000 2021,Oaxaca,"Oaxaca de Juárez, Guadalupe Victoria",R,-96.7250025,17.090319,685
"Quesillo y queso ❤️❤️❤️ en Mexico City, Mexico https://t.co/YJgzb9mzwp",Mon Apr 12 02:31:59 +0000 2021,Ciudad de México,"Cuauhtémoc, Cuauhtémoc",U,-99.153366,19.432836,545884
"@ciudadanochi Por cierto Padre Santo, nosotros ponemos verdes esos parquesillos de muchos fraccionamientos nuevos.… https://t.co/4243AcnXQT",Mon Apr 12 04:58:33 +0000 2021,Nuevo León,"San Nicolás de los Garza, San Nicolás de los Garza",U,-100.27047400000001,25.736714999999997,412199
"@webcamsdemexico Híjole!
Difícil elección! 😅
🤔🤔🤔🤔 ... 🤔🤔🤔🤔
Yo creo que Milanesa, pero con quesillo! 🤤🤤🤤
O la Hawaiana... 😆",Mon Apr 12 18:47:00 +0000 2021,Chihuahua,"Aldama, El Papalote",R,-106.1628985,28.941865999999997,0
@webcamsdemexico Ninguna. De salchicha con quesillo.,Mon Apr 12 18:49:26 +0000 2021,Ciudad de México,"Benito Juárez, Benito Juárez",U,-99.1614805,19.380613,434153
@webcamsdemexico De milanesa con quesillo🥙😋,Mon Apr 12 19:02:49 +0000 2021,México,"Ecatepec de Morelos, Ecatepec de Morelos",U,-99.0444445,19.56828,1643623
🥺 ¿Alguien que quiera comprar una bola de quesillo conmigo y comerla?,Mon Apr 12 23:10:09 +0000 2021,Ciudad de México,"Tlalpan, Cañada del Acueducto",R,-99.208364,19.199485,161
Me dio un ataquesillo leve de ansiedad... 👀,Tue Apr 13 05:37:39 +0000 2021,Nuevo León,"Monterrey, Monterrey",U,-100.29359149999999,25.6417185,1142952
"Lo he conocido por: queso asadero, queso Oaxaca, quesillo y queso de hebra.",Wed Apr 14 05:23:26 +0000 2021,Nuevo León,"San Nicolás de los Garza, San Nicolás de los Garza",U,-100.27047400000001,25.736714999999997,412199
"Buen día de miércoles mundo. Los saludo desde Oaxaca tierra del quesillo, las tlayudas y el mezcal.",Wed Apr 14 14:35:42 +0000 2021,Oaxaca,"Oaxaca de Juárez, Guadalupe Victoria",R,-96.7250025,17.090319,685
Quesillo 1000 veces Quesillos,Thu Apr 15 19:44:26 +0000 2021,Oaxaca,"Oaxaca de Juárez, Guadalupe Victoria",R,-96.7250025,17.090319,685
"Hace un rato estuve apunto de morir, una quesadilla con quesillo. Aha , la mitad en la boca y la otra en la garganta. Ay no 🥲😥",Sun Apr 18 04:40:05 +0000 2021,Ciudad de México,"Cuauhtémoc, Cuauhtémoc",U,-99.153366,19.432836,545884
Estoy programando son casi las 3 de la mañana y ya me bajé a comer jajaja un huevito con quesillo si no no pongo atención,Sun Apr 18 07:28:13 +0000 2021,Puebla,"Puebla, Fundadores del Ejido Colonia Chapultepec",R,-98.1542665,19.0322295,550
cuando mis compas me agarran un toquesillo https://t.co/C8Zc2RWyQk,Sun Apr 18 22:13:55 +0000 2021,Nuevo León,"Monterrey, Monterrey",U,-100.29359149999999,25.6417185,1142952
@EPNComandante Quesillo,Tue Apr 20 17:14:21 +0000 2021,Nayarit,"Tepic, Piedra China",R,-104.8725575,21.626666,16
@AlExXcOl @soyelquesillo @soliaseruntal Salió más cobarde que su patrón. Si no les gusta lo que publica que el los… https://t.co/3M0NeLA6QP,Wed Apr 21 03:26:28 +0000 2021,Colima,"Colima, El Guayabo",R,-103.65673849999999,19.100341999999998,0
"@soyelquesillo Creó además que ya estamos grandecitos para andar con esos jueguitos, sigo al que quiero y si en un… https://t.co/35gqLyYoIP",Wed Apr 21 03:44:59 +0000 2021,Ciudad de México,"Miguel Hidalgo, Miguel Hidalgo",U,-99.2115105,19.4299345,414470
"@soyelquesillo @AlExXcOl @soliaseruntal Estás ardido del * quien manda condicionar los seguimientos,es porque traes dolor en el q-lo.",Wed Apr 21 03:45:06 +0000 2021,Colima,"Colima, El Guayabo",R,-103.65673849999999,19.100341999999998,0
@soliaseruntal @AlExXcOl @soyelquesillo Traer ardor en el * 😄😂🤣,Wed Apr 21 03:46:53 +0000 2021,Colima,"Colima, El Guayabo",R,-103.65673849999999,19.100341999999998,0
@BunnyDballZ @MiguelCoronaGa2 @soyelquesillo @rosy1alex @Edd_Campe Jajajaja 😂,Wed Apr 21 03:49:01 +0000 2021,Colima,"Colima, El Guayabo",R,-103.65673849999999,19.100341999999998,0
@BunnyDballZ @MiguelCoronaGa2 @soyelquesillo @rosy1alex @Edd_Campe Jajajaja 😂 nos va bloquear.🤣😂,Wed Apr 21 03:49:31 +0000 2021,Colima,"Colima, El Guayabo",R,-103.65673849999999,19.100341999999998,0
@soyelquesillo @MiguelCoronaGa2 @BunnyDballZ @rosy1alex @Edd_Campe Es que estás de chiste 😃😄😅🤣😃,Wed Apr 21 03:54:53 +0000 2021,Colima,"Colima, El Guayabo",R,-103.65673849999999,19.100341999999998,0
"@soyelquesillo @BunnyDballZ @MiguelCoronaGa2 @rosy1alex @Edd_Campe Pero cuenta pues,cuál es tu ardor con conejo y fulano de tal.",Wed Apr 21 03:59:11 +0000 2021,Colima,"Colima, El Guayabo",R,-103.65673849999999,19.100341999999998,0
"@soyelquesillo @BunnyDballZ @MiguelCoronaGa2 @rosy1alex @Edd_Campe Para comprender tu histeria,que te hicieron.
😅😃🤣😂😄",Wed Apr 21 03:59:54 +0000 2021,Colima,"Colima, El Guayabo",R,-103.65673849999999,19.100341999999998,0
@soyelquesillo @Rafa77265655 @BunnyDballZ @MiguelCoronaGa2 @rosy1alex @Edd_Campe Te vas porque te dieron tu arrastr… https://t.co/cRWcv3flVN,Wed Apr 21 04:06:01 +0000 2021,Colima,"Colima, El Guayabo",R,-103.65673849999999,19.100341999999998,0
@MiguelCoronaGa2 @soyelquesillo @Rafa77265655 @BunnyDballZ @rosy1alex @Edd_Campe Jajajaja 😂 yo creo que quiere que… https://t.co/mxFC5PvA1I,Wed Apr 21 04:07:45 +0000 2021,Colima,"Colima, El Guayabo",R,-103.65673849999999,19.100341999999998,0
"Cosas que me ponen de malas, encontrar cabellos en el quesillo🤬🤬🤬🤬 echen ojo cuando compren su quesillo en #arce ya… https://t.co/o7exF7zHRW",Thu Apr 22 23:19:32 +0000 2021,Oaxaca,"Oaxaca de Juárez, Guadalupe Victoria",R,-96.7250025,17.090319,685
@drawstimes @Quesillo_o Cc @Zyo_Draws @KatzuyaSagara @ZanVG,Fri Apr 23 03:07:59 +0000 2021,Michoacán de Ocampo,"Zamora, Romero de Guzmán",R,-102.26462249999999,20.0301115,1280
"@ElizLolaa Desayune un huevo revuelto con quesillo y queso panela, frijoles refritos, jugo verde y café 😉☕️",Fri Apr 23 16:33:53 +0000 2021,Ciudad de México,"Miguel Hidalgo, Miguel Hidalgo",U,-99.2115105,19.4299345,414470
"Al fin quesito Pijiji!! 🥰🤤

#quetantoestantito #quesocrema #quesilloconhabanero #quesopijijiapan #chiapaneco… https://t.co/qRL76stXSc",Fri Apr 23 23:08:10 +0000 2021,Querétaro,"Querétaro, El Huizachal de las Tetillas",R,-100.4405945,20.7152745,97
"@Fan__2758 Ire a por unas kekas de huitlacoche y de pancita con quesillo, le ponen crema y queso rallado y salsa mu… https://t.co/nPP3ZCNrDy",Sat Apr 24 14:23:56 +0000 2021,Ciudad de México,"Cuauhtémoc, Cuauhtémoc",U,-99.153366,19.432836,545884
"El almuerzo chingon de el día 
Omelette c/quesillo y agua de aguacate, no saben que delicia 😋👌🏻 #soytotalmentecochis https://t.co/bg7mt35oYP",Sun Apr 25 18:17:15 +0000 2021,Guanajuato,"San Miguel de Allende, San Miguel Viejo",R,-100.7761945,20.9100115,833
Upsss ya valieron quesillo.,Tue Apr 27 14:33:39 +0000 2021,Puebla,"Puebla, Fundadores del Ejido Colonia Chapultepec",R,-98.1542665,19.0322295,550
"@vitadefresa Huevo revuelto con quesillo, leche con Nescafé sabor Crema Irlandesa, pan de yema y jugo de arándanos.… https://t.co/d6EeL9zPkN",Tue Apr 27 15:43:32 +0000 2021,Oaxaca,"Oaxaca de Juárez, Guadalupe Victoria",R,-96.7250025,17.090319,685
"@Quesillo_o Mira @RommyVanegas, indirectamente llegaste al Maau. Eres grande, te lo dije.",Tue Apr 27 18:58:56 +0000 2021,Michoacán de Ocampo,"Zamora, Romero de Guzmán",R,-102.26462249999999,20.0301115,1280
"Queso de #Hebra #Quesillo
#Oaxaca o #Asadero Soyenco
https://t.co/5fds20Zsxu en Quesos De Tabasco En Merida Yucatan https://t.co/FTfYI1yqI3",Wed Apr 28 16:00:41 +0000 2021,Yucatán,"Mérida, Mérida",U,-89.62361100000001,20.941035,921771
"Quesos de Hebra, Quesillo o Oaxaca de Tabasco en Meridá
#Celular9999973799 en Quesos De Tabasco En Merida Yucatan https://t.co/XEPXYxppKS",Wed Apr 28 16:05:09 +0000 2021,Yucatán,"Mérida, Mérida",U,-89.62361100000001,20.941035,921771
"Quesillo
Oaxaca
Asadero
Hebra en Quesos De Tabasco En Merida Yucatan https://t.co/sv1ZTJlFOs",Wed Apr 28 22:44:34 +0000 2021,Yucatán,"Mérida, Mérida",U,-89.62361100000001,20.941035,921771
Finalmente en la tierra del mezcal y del quesillo (@ Aeropuerto Internacional de Oaxaca (OAX) in Santa Cruz Xoxocot… https://t.co/CofydDqUq7,Thu Apr 29 16:55:07 +0000 2021,Oaxaca,"Cuilápam de Guerrero, Estrella Blanca",R,-96.7575325,17.008149500000002,334
"Quesos de Hebra, Quesillo o Oaxaca de Tabasco en Meridá
#Celular9999973799 en Quesos De Tabasco En Merida Yucatan https://t.co/T9PtADuQGD",Fri Apr 30 23:35:23 +0000 2021,Yucatán,"Mérida, Mérida",U,-89.62361100000001,20.941035,921771
"Queso de #Hebra #Quesillo
#Oaxaca o #Asadero Soyenco
https://t.co/5fds20Zsxu en Quesos De Tabasco En Merida Yucatan https://t.co/WFDGqP1Ts0",Fri Apr 30 23:35:36 +0000 2021,Yucatán,"Mérida, Mérida",U,-89.62361100000001,20.941035,921771
"Día de antojos; unas empanadas de flor de calabaza, con quesillo y  chicharrón, bañadas con crema y una salsa verde… https://t.co/nFuYhvwtJg",Sat May 01 14:53:49 +0000 2021,Veracruz de Ignacio de la Llave,"Fortín, Instituto Tecnológico de Estudios Superiores de Monterrey",R,-96.981183,18.894686,3
"Quesillo
Oaxaca
Asadero
Hebra en Quesos De Tabasco En Merida Yucatan https://t.co/z4dXkIbAlq",Sun May 02 11:13:39 +0000 2021,Yucatán,"Mérida, Mérida",U,-89.62361100000001,20.941035,921771
"Quesillo
Oaxaca
Asadero
Hebra en Quesos De Tabasco En Merida Yucatan https://t.co/Z5xqAJFgmX",Sun May 02 13:30:09 +0000 2021,Yucatán,"Mérida, Mérida",U,-89.62361100000001,20.941035,921771
@khonoor Una de milanesa con quesillo y aaaarto papalo,Tue May 04 03:06:54 +0000 2021,Tlaxcala,"Apizaco, San Luis Apizaquito",U,-98.1218485,19.4260765,7234
Me siento feo junto a ese quesillo,Tue May 04 23:35:01 +0000 2021,Jalisco,"Guadalajara, Guadalajara",U,-103.335882,20.676651999999997,1385621
"Nunca hay que hablar de política, religión o de si se llama quesillo o quedo Oaxaca

(We know que se llama queso Oaxaca)",Tue May 04 23:38:27 +0000 2021,Jalisco,"Guadalajara, Guadalajara",U,-103.335882,20.676651999999997,1385621
"Quesillo
Oaxaca
Asadero
Hebra en Quesos De Tabasco En Merida Yucatan https://t.co/fZjghlxiAZ",Wed May 05 15:44:39 +0000 2021,Yucatán,"Mérida, Mérida",U,-89.62361100000001,20.941035,921771
"Quesos de Hebra, Quesillo o Oaxaca de Tabasco en Meridá
#Celular9999973799 en Quesos De Tabasco En Merida Yucatan https://t.co/ieF8y7adJR",Wed May 05 15:46:51 +0000 2021,Yucatán,"Mérida, Mérida",U,-89.62361100000001,20.941035,921771
"Queso de #Hebra #Quesillo
#Oaxaca o #Asadero Soyenco
https://t.co/5fds20Zsxu en Quesos De Tabasco En Merida Yucatan https://t.co/HrepUYoNSh",Wed May 05 15:47:05 +0000 2021,Yucatán,"Mérida, Mérida",U,-89.62361100000001,20.941035,921771
"Quesillo
Oaxaca
Asadero
Hebra en Quesos De Tabasco En Merida Yucatan https://t.co/jhx6J4ml69",Thu May 06 05:00:27 +0000 2021,Yucatán,"Mérida, Mérida",U,-89.62361100000001,20.941035,921771
"Quesos de Hebra, Quesillo o Oaxaca de Tabasco en Meridá
#Celular9999973799 en Quesos De Tabasco En Merida Yucatan https://t.co/LnOpNq2yoX",Thu May 06 05:00:59 +0000 2021,Yucatán,"Mérida, Mérida",U,-89.62361100000001,20.941035,921771
@versoshumedos Esa si es una quesadilla mamalona!!!!! Así así mi estilo con quesillo.,Fri May 07 02:03:32 +0000 2021,Guerrero,"Chilpancingo de los Bravo, Inscuinatoyac (El Pueblito)",R,-99.72418149999999,17.3916575,663
"@Ba_k Y yo un quesillo, de hecho ya tengo el boseto 😅😁🙈🙈🙈",Sat May 08 04:36:00 +0000 2021,Oaxaca,"Oaxaca de Juárez, Guadalupe Victoria",R,-96.7250025,17.090319,685
"Quesillo
Oaxaca
Asadero
Hebra en Quesos De Tabasco En Merida Yucatan https://t.co/S1hV6HMC2T",Sat May 08 14:26:22 +0000 2021,Yucatán,"Mérida, Mérida",U,-89.62361100000001,20.941035,921771
"Quesos de Hebra, Quesillo o Oaxaca de Tabasco en Meridá
#Celular9999973799 en Quesos De Tabasco En Merida Yucatan https://t.co/D5By8aex8N",Sat May 08 14:26:55 +0000 2021,Yucatán,"Mérida, Mérida",U,-89.62361100000001,20.941035,921771
"Queso de #Hebra #Quesillo
#Oaxaca o #Asadero Soyenco
https://t.co/5fds20Zsxu en Quesos De Tabasco En Merida Yucatan https://t.co/AnBa8UZ27m",Sat May 08 14:27:10 +0000 2021,Yucatán,"Mérida, Mérida",U,-89.62361100000001,20.941035,921771
