Tweet,Fecha,Locacion,Longitud(V1),Latitud(V1),Longitud(V2),Latitud(V2),Longitud(V3),Latitud(V3),Longitud(V4),Latitud(V4)
"@mandqrinas Asustame. Acá compramos mucho quesillo y queso ""fresco"", de ese que se deshace muy rápido y que creo que no es pasteurizado 😱🤢",Thu Oct 15 16:36:08 +0000 2020,"Tuxtla Gutiérrez, Chiapas",-93.243094,16.645909,-93.243094,16.838962,-93.036225,16.838962,-93.036225,16.645909
"Oración para antes de comer quesillo oaxaqueño.
@fcoronado @Mexico_Tv @JuanCRiveraC @mexdesconocido @Oaxtravel… https://t.co/jcKl6BpVPe",Thu Oct 15 16:45:46 +0000 2020,"Oaxaca de Juárez, Oaxaca",-96.780697,17.015437,-96.780697,17.165201,-96.669308,17.165201,-96.669308,17.015437
@MartiniIlo @masthergg Pues los de Oaxaca dicen que se llama quesillo  https://t.co/AaqXUH7SrC,Thu Oct 15 17:36:39 +0000 2020,"Hermosillo, Sonora",-112.615459,28.228442,-112.615459,29.711283,-110.380903,29.711283,-110.380903,28.228442
@FinisimaPersona cuando menos de pierna española y quesillo todavía tienen 🤣 https://t.co/iiguMGak2X,Thu Oct 15 19:47:26 +0000 2020,"Benito Juárez, Distrito Federal",-99.191996,19.357102,-99.191996,19.404124,-99.130965,19.404124,-99.130965,19.357102
#QuesoPoderoso El Quesillo 👌🏼 solo en #Oaxaca,Thu Oct 15 20:38:40 +0000 2020,"Oaxaca de Juárez, Oaxaca",-96.780697,17.015437,-96.780697,17.165201,-96.669308,17.165201,-96.669308,17.015437
@hwsupermariana Hola buena noche de la función y que bueno tengo una gordita de chicharrón con quesillo,Fri Oct 16 01:08:47 +0000 2020,"La Paz, México",-98.994694,19.332316,-98.994694,19.38905,-98.899983,19.38905,-98.899983,19.332316
En #Oaxaca hasta el tostiesquite es #Gourmet maíz 🌽 tuétano 🐂 salsa de Chicatana y chapulín quesillo y mayonesa ♥️ https://t.co/mU5lh6g537,Fri Oct 16 01:19:04 +0000 2020,"Oaxaca de Juárez, Oaxaca",-96.780697,17.015437,-96.780697,17.165201,-96.669308,17.165201,-96.669308,17.015437
Espero que la profeco no se de cuenta que el quesillo que me sale alrededor de la bergha no es quesillo.,Fri Oct 16 01:23:34 +0000 2020,"Club de Golf de Cuernavaca, Cuernavaca",-99.241425,18.901023,-99.241425,18.915687,-99.234794,18.915687,-99.234794,18.901023
"saludos desde Sayulita, me gustaria escuchar algo #pachecosmico si. 😍 #ConvoyQuesoAmarilloQueSíEsQuesillo https://t.co/fzxtMBwkB5",Fri Oct 16 01:35:35 +0000 2020,"Sayulita, Nayarit",-105.232608,20.602419,-105.232608,20.602419,-105.232608,20.602419,-105.232608,20.602419
"Muchos hablan de Convoy,pero la mayoría de la minoría lo escuchamos #abusados @edgardavid #ConvoyQuesoAmarilloQueSíEsQuesillo",Fri Oct 16 01:42:06 +0000 2020,"Toluca, México",-99.782579,19.076393,-99.782579,19.49225,-99.528773,19.49225,-99.528773,19.076393
#ConvoyQuesoAmarilloQueSíEsQuesillo https://t.co/o7ExMQ6ioj,Fri Oct 16 01:46:14 +0000 2020,"Atizapán de Zaragoza, México",-99.330259,19.51799,-99.330259,19.611185,-99.208125,19.611185,-99.208125,19.51799
Yo prefiero el manchego o el gouda #ConvoyQuesoAmarilloQueSíEsQuesillo,Fri Oct 16 01:47:05 +0000 2020,"Victoria, Tamaulipas",-99.42842,23.389556,-99.42842,23.982312,-98.947388,23.982312,-98.947388,23.389556
#ConvoyQuesoAmarilloQueSíEsQuesillo https://t.co/GlHjvK3YiO,Fri Oct 16 02:15:24 +0000 2020,"Victoria, Tamaulipas",-99.42842,23.389556,-99.42842,23.982312,-98.947388,23.982312,-98.947388,23.389556
#Teamtlayuda ☝🏽 #ConvoyQuesoAmarilloQueSiEsQuesillo,Fri Oct 16 02:22:46 +0000 2020,"Victoria, Tamaulipas",-99.42842,23.389556,-99.42842,23.982312,-98.947388,23.982312,-98.947388,23.389556
Yo prefiero el queso rajo al queso babas  #ConvoyQuesoAmarilloQueSiEsQuesillo,Fri Oct 16 02:23:38 +0000 2020,"Victoria, Tamaulipas",-99.42842,23.389556,-99.42842,23.982312,-98.947388,23.982312,-98.947388,23.389556
@edgardavid ahora si me sorprendió con esa rola!!! Me la sé completita #ConvoyQuesoAmarilloQueSíEsQuesillo,Fri Oct 16 02:42:36 +0000 2020,"Atizapán de Zaragoza, México",-99.330259,19.51799,-99.330259,19.611185,-99.208125,19.611185,-99.208125,19.51799
#ConvoyQuesoAmarilloQueSíEsQuesillo https://t.co/nkz9LJlYRF,Fri Oct 16 02:43:20 +0000 2020,"Atizapán de Zaragoza, México",-99.330259,19.51799,-99.330259,19.611185,-99.208125,19.611185,-99.208125,19.51799
Con esa me grupo Niche me dieron ganas de invitar a bailar a @edgardavid 💃🕺#ConvoyQuesoAmarilloQueSíEsQuesillo https://t.co/ANhp7j6rGm,Fri Oct 16 02:48:04 +0000 2020,"Atizapán de Zaragoza, México",-99.330259,19.51799,-99.330259,19.611185,-99.208125,19.611185,-99.208125,19.51799
@nyehya Jajaja pero no te metas con el quesillo que no es queso ni tipo Oaxaca. Saludos,Fri Oct 16 06:44:19 +0000 2020,"Oaxaca de Juárez, Oaxaca",-96.780697,17.015437,-96.780697,17.165201,-96.669308,17.165201,-96.669308,17.015437
Sándwiches de Quesillo ... 😋 https://t.co/mcs6zoFA8l,Fri Oct 16 13:26:57 +0000 2020,"Durango, México",-105.573153,23.478062,-105.573153,24.430263,-104.102003,24.430263,-104.102003,23.478062
"@kevin_vell19 @Quesillo14 
Les amo jaja aveda, no si❤✨",Fri Oct 16 15:07:14 +0000 2020,"Nanchital de Lázaro Cárdenas del Río, Veracruz de Ignacio de la Llave",-94.421471,18.033681,-94.421471,18.097535,-94.342955,18.097535,-94.342955,18.033681
@Quesillo14 @kevin_vell19 Loviu :'3,Fri Oct 16 15:23:06 +0000 2020,"Nanchital de Lázaro Cárdenas del Río, Veracruz de Ignacio de la Llave",-94.421471,18.033681,-94.421471,18.097535,-94.342955,18.097535,-94.342955,18.033681
"¡Qué Alegría, no estuvo considerado el «quesillo oaxaqueño» en la lista de productos inobservantes de la normativid… https://t.co/uXi2zNbL1y",Sat Oct 17 04:39:49 +0000 2020,"Oaxaca de Juárez, Oaxaca",-96.780697,17.015437,-96.780697,17.165201,-96.669308,17.165201,-96.669308,17.015437
@Quesillo_o Igual... igual.,Sat Oct 17 08:15:37 +0000 2020,"Zamora, Michoacán de Ocampo",-102.408768,19.948965,-102.408768,20.111258,-102.120477,20.111258,-102.120477,19.948965
Mis michis comen quesillo.,Sun Oct 18 03:03:32 +0000 2020,"Oaxaca de Juárez, Oaxaca",-96.780697,17.015437,-96.780697,17.165201,-96.669308,17.165201,-96.669308,17.015437
"CHICHARRÓN DE QUESILLO CON CHAPULINES 🦗,DELICIA en Cd. y puerto de Salina Cruz, Oax. https://t.co/utUrw0V6aQ",Tue Oct 20 02:04:53 +0000 2020,"Salina Cruz, Oaxaca",-95.286785,16.117196,-95.286785,16.302926,-95.136704,16.302926,-95.136704,16.117196
Mi cena de hoy sólo es una doblada de quesillo con jamón. 🥺🥺🥺🥺🥺😩😩😩,Wed Oct 21 03:03:25 +0000 2020,"Puebla, México",-98.289206,18.83765,-98.289206,19.226809,-98.019327,19.226809,-98.019327,18.83765
"#omelette de espinaca, pimientos y quesillo , el mejor pan de #masamadre de @kiiwikrestaurante intentando comer… https://t.co/05KIi50RZY",Thu Oct 22 14:48:16 +0000 2020,"Mérida, Yucatán",-89.798197,20.695104,-89.798197,21.186966,-89.449025,21.186966,-89.449025,20.695104
"Quesillo, sabor de Oaxaca que ha trascendido fronteras

Sabor y calidad, sólo en Oaxaca https://t.co/pnQUcOiZFR",Fri Oct 23 21:52:55 +0000 2020,"Oaxaca de Juárez, Oaxaca",-96.780697,17.015437,-96.780697,17.165201,-96.669308,17.165201,-96.669308,17.015437
"#CuandoLlegueALaCiudad y hasta ahora, hacía corajes cada que iba a la tienda a comprar quesillo y me decían ¡No ten… https://t.co/jJ7AayRR5W",Sat Oct 24 13:46:35 +0000 2020,"Ciudad Ixtepec, Oaxaca",-95.16251,16.511502,-95.16251,16.694688,-94.995249,16.694688,-94.995249,16.511502
"Un toquesillo, dos, antes dirme a misa 😌",Sun Oct 25 13:17:52 +0000 2020,"Torreón, Coahuila de Zaragoza",-103.511379,24.793821,-103.511379,25.694625,-102.954881,25.694625,-102.954881,24.793821
"@TuLawyerReturn Seguramente le llega su chequesillo, si no es así, pues si está bien tontita",Tue Oct 27 02:53:06 +0000 2020,"León, Guanajuato",-101.833743,20.863352,-101.833743,21.332768,-101.369059,21.332768,-101.369059,20.863352
@BriandaesCortes “Quesillo”  🤣,Tue Oct 27 04:42:04 +0000 2020,"Hermosillo, Sonora",-112.615459,28.228442,-112.615459,29.711283,-110.380903,29.711283,-110.380903,28.228442
@Sergioredye Vamosay mi apa ahí después le caigo al barrio a darle a las retas en el parquesillo agaves:.,Tue Oct 27 05:40:51 +0000 2020,"Hermosillo, Sonora",-112.615459,28.228442,-112.615459,29.711283,-110.380903,29.711283,-110.380903,28.228442
@Quesillo_o De recordarlo ya huele a carnitas,Tue Oct 27 22:19:22 +0000 2020,"Jacona, Michoacán de Ocampo",-102.377533,19.883189,-102.377533,19.999266,-102.242958,19.999266,-102.242958,19.883189
@JesseVallejOWNS dinner: torta de milanesa con quesillo y agua de  jamaica - $6.18 with delivery tip https://t.co/khZdTVAZrU,Wed Oct 28 01:14:34 +0000 2020,"Oaxaca de Juárez, Oaxaca",-96.780697,17.015437,-96.780697,17.165201,-96.669308,17.165201,-96.669308,17.015437
"una delicia no necesariamente debe ser SOFISTICADA o de elaboración complicada 

#cacahuate y #quesillo podría defi… https://t.co/v3QP7JHVF6",Wed Oct 28 17:37:08 +0000 2020,Rafael Pascacio Gamboa,-93.11764,16.750249,-93.11764,16.750249,-93.11764,16.750249,-93.11764,16.750249
"@ObservadBinario Se le olvidó el postre, torta negra, quesillo, dulce de lechoza...",Wed Oct 28 18:13:58 +0000 2020,"Benito Juárez, Distrito Federal",-99.191996,19.357102,-99.191996,19.404124,-99.130965,19.404124,-99.130965,19.357102
@juanborrelli Quesillo con huequitos...,Fri Oct 30 15:43:50 +0000 2020,"García, Nuevo León",-100.865061,25.628133,-100.865061,25.983312,-100.415921,25.983312,-100.415921,25.628133
#quesillo repitan after me que-sí-llo... si le dicen como viene en la bolsita del supermercado se van a quedar solo… https://t.co/dRZOdBx1q6,Sat Oct 31 19:48:15 +0000 2020,"Oaxaca de Juárez, Oaxaca",-96.780697,17.015437,-96.780697,17.165201,-96.669308,17.165201,-96.669308,17.015437
"@rammosjose @USAmbMex Es la tortilla de tlayuda con asiento (no son frijoles), quesillo, lechuga, jitomate, aguacat… https://t.co/2IX2F5mboR",Sun Nov 01 02:47:35 +0000 2020,"Miguel Hidalgo, Distrito Federal",-99.259495,19.386371,-99.259495,19.473498,-99.163526,19.473498,-99.163526,19.386371
@juanfractal22 Siempre  lo conocí como quesillo.,Sun Nov 01 18:41:17 +0000 2020,"Tuxtla Gutiérrez, Chiapas",-93.243094,16.645909,-93.243094,16.838962,-93.036225,16.838962,-93.036225,16.645909
"@juanfractal22 Hebra, OAXACA, quesillo!!",Sun Nov 01 21:00:45 +0000 2020,"Veracruz, Veracruz de Ignacio de la Llave",-96.340535,19.102814,-96.340535,19.265092,-96.118258,19.265092,-96.118258,19.102814
@fannnel ¿Todavía no les ponen quesillo?,Mon Nov 02 03:06:05 +0000 2020,"Saltillo, Coahuila de Zaragoza",-101.620178,24.542295,-101.620178,25.522968,-100.713744,25.522968,-100.713744,24.542295
#hotdogs con tocino y quesillo 🌭 en Mr. Burger https://t.co/BjveMIj6n0,Mon Nov 02 03:11:40 +0000 2020,"Nezahualcóyotl, México",-99.067766,19.366862,-99.067766,19.498582,-98.966267,19.498582,-98.966267,19.366862
"El único ser que se merece esta nueva versión mejorada de mí es @conQdequesillo 
Tengo 0 pruebas y 0 dudas.",Mon Nov 02 06:23:21 +0000 2020,"Puebla, México",-98.289206,18.83765,-98.289206,19.226809,-98.019327,19.226809,-98.019327,18.83765
"¡Hola chilangos!, ya llegó su quesillo para gratinarles el mollete. ¡Buenos días, #FelizLunes! (@ Aeropuerto Intern… https://t.co/4EA9aBpMco",Mon Nov 02 14:28:13 +0000 2020,"Venustiano Carranza, Distrito Federal",-99.128294,19.404352,-99.128294,19.459799,-99.04734,19.459799,-99.04734,19.404352
#desayuno de #viernes #omelette de #piquillos y #quesillo con ensalada mamalona y #pan de melaza y arándanos de… https://t.co/13j90MyYEu,Fri Nov 06 14:57:14 +0000 2020,"Mérida, Yucatán",-89.798197,20.695104,-89.798197,21.186966,-89.449025,21.186966,-89.449025,20.695104
Estaba pensando que en los tanquesillos que me di no me pegaron pero que descaro si ya estoy bien pasheco,Sat Nov 07 06:06:15 +0000 2020,"Valle de Chalco Solidaridad, México",-98.975864,19.22413,-98.975864,19.340046,-98.905782,19.340046,-98.905782,19.22413
"Las de chicharrón prensado, quesillo con champiñón, sesos y pancita!!",Sat Nov 07 18:35:49 +0000 2020,"Álvaro Obregón, Distrito Federal",-99.324375,19.232228,-99.324375,19.403856,-99.171644,19.403856,-99.171644,19.232228
Cosas de gordo...pedir una gordita de chicharrón con picadillo y quesillo 😋,Sun Nov 08 17:21:33 +0000 2020,"Cuauhtémoc, Distrito Federal",-99.18435,19.399835,-99.18435,19.465837,-99.122382,19.465837,-99.122382,19.399835
"@majoo_ar Pls invítenme, yo les llevo quesillo chiapaneco",Mon Nov 09 21:05:32 +0000 2020,"Tuxtla Gutiérrez, Chiapas",-93.243094,16.645909,-93.243094,16.838962,-93.036225,16.838962,-93.036225,16.645909
La comedera de Oaxaca #tasajo #quesillo #quesodehebra #tlayuda #Oaxaca #sinfiltro en Oaxaca City https://t.co/16sTNDpKzq,Wed Nov 11 15:27:53 +0000 2020,"Oaxaca de Juárez, Oaxaca",-96.780697,17.015437,-96.780697,17.165201,-96.669308,17.165201,-96.669308,17.015437
"Ustedes no están para saberlo, pero jijoesuchingadamadre con el huarache con costilla y quesillo que me acabo de ch… https://t.co/Ymgvg75XXm",Wed Nov 11 19:43:48 +0000 2020,"Coyoacán, Distrito Federal",-99.205809,19.297011,-99.205809,19.359755,-99.098871,19.359755,-99.098871,19.297011
Ha de ser horrible ser la señora de las quesadillas y no poder comerte el quesillo cuando lo deshebras porque te estás comiendo tu negociooo,Fri Nov 13 14:46:45 +0000 2020,"San Andrés Cholula, Puebla",-98.363779,18.980181,-98.363779,19.065807,-98.253419,19.065807,-98.253419,18.980181
#omelette de pimientos #xcatic #quesillo y #champiñones #desayuno con la guía de @molinasnutricion… https://t.co/iLsR9qOrpj,Fri Nov 13 15:03:36 +0000 2020,"Mérida, Yucatán",-89.798197,20.695104,-89.798197,21.186966,-89.449025,21.186966,-89.449025,20.695104
"Mousse de quesillo... tienen que probarlo antes de morir.
En @expendio_tradicion 
#postres #dessert… https://t.co/gmBuVaASx7",Sun Nov 15 03:29:26 +0000 2020,"Oaxaca de Juárez, Oaxaca",-96.780697,17.015437,-96.780697,17.165201,-96.669308,17.165201,-96.669308,17.015437
Podría comer quesillo por kilo,Mon Nov 16 03:46:49 +0000 2020,"Coyoacán, Distrito Federal",-99.205809,19.297011,-99.205809,19.359755,-99.098871,19.359755,-99.098871,19.297011
#huevo con #pechugadepavo y #quesillo #ensalada #desayuno #saludable siguiendo la guía de @molinasnutricion… https://t.co/5zYp4Rxshm,Tue Nov 17 15:23:38 +0000 2020,"Mérida, Yucatán",-89.798197,20.695104,-89.798197,21.186966,-89.449025,21.186966,-89.449025,20.695104
Sali a correr para poder cenarme una tlayuda y tostadas de quesillo sin culpa,Wed Nov 18 06:08:26 +0000 2020,"San Blas Atempa, Oaxaca",-95.232468,16.259388,-95.232468,16.46137,-95.066346,16.46137,-95.066346,16.259388
"#CosasDePobres una sopa instantánea con salsa botanera aguacate y su quesillo, todo un buffet. @yaparateoficial… https://t.co/NcPxIFLMJT",Wed Nov 18 12:23:16 +0000 2020,"León, Guanajuato",-101.833743,20.863352,-101.833743,21.332768,-101.369059,21.332768,-101.369059,20.863352
@NudesFoods Quesillo 🤤,Wed Nov 18 17:41:24 +0000 2020,"Santa María Tonameca, Oaxaca",-96.851726,15.655914,-96.851726,15.912908,-96.504345,15.912908,-96.504345,15.655914
#omelette #quesillo #pechugadepavo #guacamole #tomatecherry #elotes #desayuno de #viernes con la guía de… https://t.co/6kx6pLRNEW,Fri Nov 20 15:47:54 +0000 2020,"Mérida, Yucatán",-89.798197,20.695104,-89.798197,21.186966,-89.449025,21.186966,-89.449025,20.695104
"@HistoriaPedro Que delicia de comida @HistoriaPedro, y si es cecina enchilada, con quesillo fresco de Oaxaca, no q cosa...",Tue Nov 24 00:59:52 +0000 2020,"Cuauhtémoc, Distrito Federal",-99.18435,19.399835,-99.18435,19.465837,-99.122382,19.465837,-99.122382,19.399835
"@todotentacion No es queso oaxaca, es quesillo!!!",Tue Nov 24 04:50:32 +0000 2020,"Oaxaca de Juárez, Oaxaca",-96.780697,17.015437,-96.780697,17.165201,-96.669308,17.165201,-96.669308,17.015437
"@marlene_cm Spaghetti Alfredo, salmon con salsa de mango chipotle y verduras al vapor con quesillo gratinado 🤤 no t… https://t.co/fSocopudcW",Tue Nov 24 05:04:39 +0000 2020,"Tlajomulco de Zúñiga, Jalisco",-103.616261,20.358642,-103.616261,20.620776,-103.198901,20.620776,-103.198901,20.358642
"@Quesillo_o Siempre lo he tenido claro. La Rule 34 siempre será NSFW, pero NSFW no siempre significa que tiene que ser de la Rule 34.",Thu Nov 26 20:32:27 +0000 2020,"Zamora, Michoacán de Ocampo",-102.408768,19.948965,-102.408768,20.111258,-102.120477,20.111258,-102.120477,19.948965
"Seré breve, las hamburguesas llevan PEPINILLOS, no llevan jamón ni quesillo.",Fri Nov 27 21:43:46 +0000 2020,"Chiautempan, Tlaxcala",-98.219582,19.252767,-98.219582,19.330454,-98.033227,19.330454,-98.033227,19.252767
Hoy toca empanadas Taniperla (de plátano relleno de quesillo),Sat Nov 28 23:08:44 +0000 2020,"San Cristóbal de las Casas, Chiapas",-92.724496,16.539194,-92.724496,16.786895,-92.344326,16.786895,-92.344326,16.539194
@Quesillo_o 😶,Sun Nov 29 00:45:45 +0000 2020,"Zamora, Michoacán de Ocampo",-102.408768,19.948965,-102.408768,20.111258,-102.120477,20.111258,-102.120477,19.948965
"@Quesillo_o Sinceramente, con @LiconaTrash https://t.co/s3GIUWTnjY",Sun Nov 29 22:06:45 +0000 2020,"Jacona, Michoacán de Ocampo",-102.377533,19.883189,-102.377533,19.999266,-102.242958,19.999266,-102.242958,19.883189
"@LiconaTrash Con @Quesillo_o, ya lo dije...",Sun Nov 29 23:46:46 +0000 2020,"Jacona, Michoacán de Ocampo",-102.377533,19.883189,-102.377533,19.999266,-102.242958,19.999266,-102.242958,19.883189
@Quesillo_o @LiconaTrash Por eso es un shippeo... Es algo que claramente no va a suceder.,Mon Nov 30 00:14:33 +0000 2020,"Jacona, Michoacán de Ocampo",-102.377533,19.883189,-102.377533,19.999266,-102.242958,19.999266,-102.242958,19.883189
"Quesadilla con quesillo y pollo, plátanos fritos, papaya y café",Tue Dec 01 18:19:36 +0000 2020,"Tlalpan, Distrito Federal",-99.315748,19.087511,-99.315748,19.311459,-99.10098,19.311459,-99.10098,19.087511
#desayuno #omelette con #nopal y #quesillo #frijol y #ensalda @molinasnutricion en Mérida Yucatán https://t.co/k7O54NXXCb,Wed Dec 02 15:17:23 +0000 2020,"Mérida, Yucatán",-89.798197,20.695104,-89.798197,21.186966,-89.449025,21.186966,-89.449025,20.695104
@Karensoy_ Quesillo 🤤🤤🤤,Thu Dec 03 01:56:11 +0000 2020,"Tizayuca, Hidalgo",-99.02376,19.799941,-99.02376,19.90681,-98.904755,19.90681,-98.904755,19.799941
@fishin_door @Quesillo_o Pero sí mambo number five v:,Sat Dec 05 18:01:45 +0000 2020,"Zamora, Michoacán de Ocampo",-102.408768,19.948965,-102.408768,20.111258,-102.120477,20.111258,-102.120477,19.948965
@repartidorr @PresuntoC @pasotti_ @ferfisfer @VirizAngel @PePedaleando @quesillo @equis_oh Ahorita por la covid no… https://t.co/mZpxnkSuku,Sun Dec 06 21:46:58 +0000 2020,"Benito Juárez, Distrito Federal",-99.191996,19.357102,-99.191996,19.404124,-99.130965,19.404124,-99.130965,19.357102
"Tengo antojo de un plátano macho con quesillo, queso y crema 🤤🤤",Wed Dec 09 04:02:23 +0000 2020,"Cuautlancingo, Puebla",-98.300186,19.077688,-98.300186,19.160921,-98.222497,19.160921,-98.222497,19.077688
"DESAYUNOS ANTOLINA
martes a domingo de 9:30am a 1:30pm

*Huevos orgánicos con chorizo oaxaqueño y quesillo chinampe… https://t.co/Q3FaKPq5vR",Fri Dec 11 15:32:08 +0000 2020,"Cuauhtémoc, Distrito Federal",-99.18435,19.399835,-99.18435,19.465837,-99.122382,19.465837,-99.122382,19.399835
"No podia faltar la famosisima #Cemita con su respectivos quesillo, papalo, aceite de oliva y chipotle 
#Puebla https://t.co/m9P3bXzWR6",Mon Dec 14 04:20:28 +0000 2020,Centro Histórico,-98.198215,19.043602,-98.198215,19.043602,-98.198215,19.043602,-98.198215,19.043602
"@AreliPaz Qué hay, me trajiste quesillo, pan de yema, mole, etc. O esa es tu presentación, es tu primer twitteé?",Wed Dec 16 21:12:54 +0000 2020,"Iztacalco, Distrito Federal",-99.137171,19.375769,-99.137171,19.422433,-99.055821,19.422433,-99.055821,19.375769
"@JackyPetite008 @EPNComandante @ChargerJZ @SiSoy_Dian @BeniiBenito @ImDrChimichanga @PolloThor99 Al padre Quesillo,… https://t.co/dziEBHsUhW",Sat Dec 19 13:06:03 +0000 2020,"Othón P. Blanco, Quintana Roo",-89.207999,17.893998,-89.207999,19.292983,-87.563488,19.292983,-87.563488,17.893998
@JackyPetite008 @EPNComandante @ChargerJZ @SiSoy_Dian @BeniiBenito @ImDrChimichanga @PolloThor99 Quesillo,Sat Dec 19 14:14:05 +0000 2020,"León, Guanajuato",-101.833743,20.863352,-101.833743,21.332768,-101.369059,21.332768,-101.369059,20.863352
"Los Morelenses sin entendér por qué pelean por el ""queso de hebra"" si no es quesillo ni queso Oaxaca...",Sat Dec 19 14:42:05 +0000 2020,"Cuautla, Morelos",-99.020208,18.757508,-99.020208,18.89733,-98.886707,18.89733,-98.886707,18.757508
"@4topoderoax ¡Tú lo pides como quieras! 
""--Me da una Keka de chicharrón""
Te preguntan...¿Con quesillo?
""--Me prepa… https://t.co/hFJ7DonPay",Sat Dec 19 15:25:37 +0000 2020,"Ecatepec de Morelos, México",-99.118665,19.484399,-99.118665,19.652161,-98.970224,19.652161,-98.970224,19.484399
"-Porque tendrá tantas ganas de comer Quesillo?
-Que parió señor oaxaqueño ""el Quesillo"".
-Entonces como se dice?
-Q… https://t.co/qKbZe1pFJJ",Sat Dec 19 15:39:00 +0000 2020,"Oaxaca de Juárez, Oaxaca",-96.780697,17.015437,-96.780697,17.165201,-96.669308,17.165201,-96.669308,17.015437
"-Por todos sus años como oaxaqueño traerá el Queso Oaxaca.
-Quesillo, se dice QUE SI LLO. https://t.co/5EGkLG9U9Y",Sat Dec 19 15:44:41 +0000 2020,"Oaxaca de Juárez, Oaxaca",-96.780697,17.015437,-96.780697,17.165201,-96.669308,17.165201,-96.669308,17.015437
@rthur_013 Se dice quesillo. He dicho!,Sat Dec 19 16:42:21 +0000 2020,"Pachuca de Soto, Hidalgo",-98.863407,20.023592,-98.863407,20.187683,-98.688209,20.187683,-98.688209,20.023592
"Quesillo o block user
🤭",Sat Dec 19 16:45:20 +0000 2020,"Tijuana, Baja California",-117.298421,32.098292,-117.298421,32.567461,-116.559783,32.567461,-116.559783,32.098292
"#Quesillo ptm! En Oaxaca no existe el ""queso Oaxaca""!! 🙄",Sat Dec 19 17:22:03 +0000 2020,"San Pedro Pochutla, Oaxaca",-96.531534,15.657492,-96.531534,15.920642,-96.260538,15.920642,-96.260538,15.657492
"@DiegOrtiz_26 Le decimos quesillo en Puebla, así que la próxima vez que vaya para Mty nos vemos para el tiro Jajajaj",Sat Dec 19 17:48:05 +0000 2020,"Puebla, México",-98.289206,18.83765,-98.289206,19.226809,-98.019327,19.226809,-98.019327,18.83765
"Es queso de hebra, queso asadero, queso de bola, queso Oaxaca, todo menos #quesillo",Sat Dec 19 18:12:43 +0000 2020,"Altamira, Tamaulipas",-98.344297,22.320985,-98.344297,22.800787,-97.821333,22.800787,-97.821333,22.320985
@Mictlan4TT Quesillo,Sat Dec 19 18:21:11 +0000 2020,Ciudad de México,-99.132771,19.432985,-99.132771,19.432985,-99.132771,19.432985,-99.132771,19.432985
"Yo no sé si lo correcto sea #Quesillo o Queso de #Oaxaca , lo que si les puede decir el #NotarioBloguero este día d… https://t.co/XBdSsBI9CE",Sat Dec 19 18:30:24 +0000 2020,"Puebla, México",-98.289206,18.83765,-98.289206,19.226809,-98.019327,19.226809,-98.019327,18.83765
@VaniaHdez4 @porkestendencia Quesillo por siempre y para siempre,Sat Dec 19 18:47:10 +0000 2020,"Veracruz, Veracruz de Ignacio de la Llave",-96.340535,19.102814,-96.340535,19.265092,-96.118258,19.265092,-96.118258,19.102814
@Tony200999 Aaaa una rica bola de quesillo,Sat Dec 19 19:46:26 +0000 2020,"Puebla, México",-98.289206,18.83765,-98.289206,19.226809,-98.019327,19.226809,-98.019327,18.83765
@SimpsonitOaxaca Aaaa el buen quesillo nunca falla!!!,Sat Dec 19 19:47:00 +0000 2020,"Puebla, México",-98.289206,18.83765,-98.289206,19.226809,-98.019327,19.226809,-98.019327,18.83765
@fabian_pg3 Quesillo 😌😍😍😍😍😍😍,Sat Dec 19 20:28:44 +0000 2020,"Solidaridad, Quintana Roo",-87.777003,20.356869,-87.777003,20.812192,-86.916961,20.812192,-86.916961,20.356869
Queso o quesillo // quesadilla con queso o con otro guiso // déjame decirte que me gusta y sabe chingonnnnnnn,Sat Dec 19 20:41:42 +0000 2020,"Coyoacán, Distrito Federal",-99.205809,19.297011,-99.205809,19.359755,-99.098871,19.359755,-99.098871,19.297011
@abbyflg Aaa jaja. Pues yo solo sé que se llama queso Oaxaca y no quesillo 🤷‍♂️,Sat Dec 19 22:09:26 +0000 2020,"Benito Juárez, Quintana Roo",-87.322724,20.734206,-87.322724,21.363232,-86.740605,21.363232,-86.740605,20.734206
"Si roke que es de Oaxaca le dice queso Oaxaca, me niego a decirle quesillo 🥴",Sat Dec 19 22:25:10 +0000 2020,"Querétaro, Querétaro Arteaga",-100.596343,20.50317,-100.596343,20.927379,-100.284846,20.927379,-100.284846,20.50317
"-Esta es la diferencia entre el Queso Oaxaca y el Quesillo.
-Oye oye más despacio cerebrito. https://t.co/Z8LWgBuvly",Sat Dec 19 22:33:17 +0000 2020,"Oaxaca de Juárez, Oaxaca",-96.780697,17.015437,-96.780697,17.165201,-96.669308,17.165201,-96.669308,17.015437
Yo lo conozco como quesillo. 🤔,Sat Dec 19 22:55:40 +0000 2020,"Monterrey, Nuevo León",-100.421037,25.480538,-100.421037,25.802899,-100.166146,25.802899,-100.166146,25.480538
@alan_estrada El buen quesillo,Sun Dec 20 00:59:13 +0000 2020,"Puebla, México",-98.289206,18.83765,-98.289206,19.226809,-98.019327,19.226809,-98.019327,18.83765
"Que se armen los chingadazos queseros

#teamquesillo 
#Quesillo https://t.co/TFBk2Tmib4",Sun Dec 20 01:01:06 +0000 2020,"Carmen, Campeche",-92.468889,17.873531,-92.468889,19.032122,-90.797686,19.032122,-90.797686,17.873531
"@horaciocorro A wiwi,unos malotes con chapulín de milpa y quesillo....y para que no brinquen  los chapulines un mezcal minero.",Sun Dec 20 02:24:58 +0000 2020,"Iztapalapa, Distrito Federal",-99.140238,19.284692,-99.140238,19.400885,-98.960684,19.400885,-98.960684,19.284692
Mejor definición no había! Cómo el quesillo ninguno 😍,Sun Dec 20 04:17:24 +0000 2020,"Zapopan, Jalisco",-103.664175,20.583418,-103.664175,20.997896,-103.305374,20.997896,-103.305374,20.583418
@jazaquin0 En Chiapas hacen un quesillo de primera,Sun Dec 20 14:58:13 +0000 2020,"Tuxtla Gutiérrez, Chiapas",-93.243094,16.645909,-93.243094,16.838962,-93.036225,16.838962,-93.036225,16.645909
