Tweet,Fecha,Estado,Locacion,Tipo,Longitud,Latitud,Poblacion
Tarde y sin lagañas le damos la bienvenida a la semana en la grata compañía de la @ERADINOSAURIO por @Reactor105… https://t.co/bFzpZ0cl7i,Sun Aug 28 13:44:47 +0000 2022,Ciudad de México,"Benito Juárez, Benito Juárez",U,-99.166982,19.387733,434153
Si van a subir fotos del regreso a clases de se bendi. Mínimo quitenle la lagaña jajajaja,Mon Aug 29 15:40:17 +0000 2022,Tabasco,"Centro, Medellín y Pigua 1ra. Sección",R,-92.9164995,18.0219595,352
¿Serían Andy Benavides diciendo que sus hijas JAMÁS han tenido lagañas? Jajajajajaja la amo,Fri Sep 02 15:18:46 +0000 2022,Sonora,"Hermosillo, Vicente Guerrero",R,-111.498181,28.9698625,5
Prendo un philie en la mañana sin sacarme la lagañas 💿🎶 https://t.co/Pk1tnY212P,Sun Sep 11 14:32:30 +0000 2022,Nuevo León,"Juárez, Los Canelos",R,-100.118882,25.6083315,5
@ericrey01423542 Auuuch yo apenas limpiando lagañas de mis ojitos,Tue Sep 13 12:42:00 +0000 2022,Querétaro,"Querétaro, El Huizachal de las Tetillas",R,-100.4405945,20.7152745,97
Soy el cuarto productor mundial de lagaña chinguiñosa.,Mon Sep 19 13:24:04 +0000 2022,Puebla,"Puebla, Fundadores del Ejido Colonia Chapultepec",R,-98.1542665,19.0322295,550
"MENSAJE A LA DERROTADA Y MICROSCÓPICA OPOSICIÓN!!
VEAN PARA QUÉ  SE LIMPIEN LAS LAGAÑAS 
AMLO LIDER DE AMÉRICA LATI… https://t.co/fFO5xSuwt0",Mon Sep 26 00:11:05 +0000 2022,Veracruz de Ignacio de la Llave,"Pueblo Viejo, Chijol Corona",R,-97.8225365,22.283026,0
Tiene una lagaña. https://t.co/havR7FIFh0,Fri Sep 30 21:46:47 +0000 2022,Chihuahua,"Juárez, Luis Carlos Ruiz",R,-106.568008,31.452274000000003,0
"Empezando otra semana, comienza San Lunes, a quitarse las lagañas ja, ja, y a sacar los pendientes para seguir cump… https://t.co/uy9CgUyVEm",Mon Oct 03 11:33:13 +0000 2022,Veracruz de Ignacio de la Llave,"Xalapa, La Troja",R,-96.886083,19.542054,88
"Por que nos engañaste ?@SancadillaNorte 
Por queee? Traías más lagañas que yo 😅y eso que eran las 9 pasaditas https://t.co/GcvarQ0pUB",Mon Oct 03 15:20:25 +0000 2022,Nuevo León,"Santa Catarina, Buenos Aires",R,-100.48274899999998,25.5835005,25
tengo el gusto culposo de quitarle las lagañas a cuaaaaalquier perrito que se me ponga enfrente 😪,Wed Oct 05 15:01:18 +0000 2022,Tamaulipas,"Altamira, La Selva",R,-98.082815,22.560886000000004,3
@GlodeJo07 Con lagañas!,Sun Oct 09 01:31:02 +0000 2022,Ciudad de México,"Cuauhtémoc, Cuauhtémoc",U,-99.153366,19.432836,545884
Con mucho cariño para todos/as los /as fanaticos/as religiosos/as…déjennos disfrutar estas fiestas lagañas que son… https://t.co/HOD9s1D92m,Thu Oct 13 00:36:26 +0000 2022,Jalisco,"Mascota, Las Vegas",R,-105.14858050000001,20.697052499999998,6
"@GlodeJo07 No le quitan ni las lagañas al señor presidente, ya busquense mejores patrañas",Thu Oct 13 20:10:36 +0000 2022,Chiapas,"Comitán de Domínguez, Tuila el Grande",R,-92.1752655,16.289696,135
"Vino a consulta una señora porque tenía lagañas...
Aun así pues que chido que su señor esposo se haya preocupado",Sun Oct 23 17:00:11 +0000 2022,Tabasco,"Centro, Medellín y Pigua 1ra. Sección",R,-92.9164995,18.0219595,352
@tumbaburross Para que se limpien las lagañas …!!!,Tue Oct 25 15:54:19 +0000 2022,Guanajuato,"León, Rancho de Don Alberto García",R,-101.601401,21.09806,1
"La mayor parte de la ciudadanía aún no se quita las lagañas para empezar a entender la pesadilla que ya comienza.
""… https://t.co/kN2fqNZQRj",Fri Oct 28 16:48:37 +0000 2022,Baja California,"Playas de Rosarito, Mesa Redonda",R,-116.929102,32.3328765,9
@Menresa ¿Serías la lagaña de un ojo?,Sat Oct 29 02:51:11 +0000 2022,Ciudad de México,"Azcapotzalco, Azcapotzalco",U,-99.18212600000001,19.4857835,432205
"Hoy cité a un padre de familia, el motivo, entre otras cosas es que su hijo siempre trae lagañas. Tenía la duda si… https://t.co/9dZFbbG6AU",Fri Nov 04 19:18:38 +0000 2022,San Luis Potosí,"Soledad de Graciano Sánchez, La Nopalera",R,-100.860774,22.291455,0
Me tatuó hasta sus lagañas...,Sun Nov 06 23:20:58 +0000 2022,Ciudad de México,"Tláhuac, Las Calabacitas",R,-99.050461,19.342788499999997,19
@EdMoroyoqui @Ramartinactriz No mames pues quítate las lagañas de los ojos mierda porque tiene el nombre arriba de… https://t.co/ouVjWK4zjU,Thu Nov 10 19:05:36 +0000 2022,Querétaro,"Querétaro, El Huizachal de las Tetillas",R,-100.4405945,20.7152745,97
@juanburgos @fedayeenelunico Pa que te limpies las lagañas obrador,Fri Nov 11 01:55:25 +0000 2022,Nuevo León,"San Nicolás de los Garza, San Nicolás de los Garza",U,-100.27047400000001,25.736714999999997,412199
"Tarde pero sin lagañas , casi …buen día #Cafe ?",Fri Nov 11 14:40:16 +0000 2022,Ciudad de México,"Cuajimalpa de Morelos, Convento del Desierto de los Leones",R,-99.30558049999999,19.318697,0
Publica que tiene el rimel seco cuando lo que tiene realmente seco son las lagañas...,Fri Nov 11 22:23:58 +0000 2022,Sonora,"Hermosillo, Vicente Guerrero",R,-111.498181,28.9698625,5
me gusta comerme mis lagañas,Sat Nov 12 22:03:40 +0000 2022,México,"Atizapán de Zaragoza, Rancho Nuestra Señora de los Ángeles",R,-99.269192,19.564587500000002,16
@jgnaredo Ya quítate las lagañas. Noroñita Jr. Un buen baño dominguero no te hará daño ..,Sun Nov 13 21:11:51 +0000 2022,Tabasco,"Centro, Medellín y Pigua 1ra. Sección",R,-92.9164995,18.0219595,352
@PonchoGutz Limpiate bien las lagañas con esto. https://t.co/b7BgAYr86f,Mon Nov 14 07:17:05 +0000 2022,Guanajuato,"Irapuato, Irapuato",U,-101.3403935,20.673542,452090
"@OmniPresente @cabobarba @lorenzocordovav Limpiate bien las lagañas, y deja de repetir consignas que graban en tu c… https://t.co/GCsNE0G4RP",Mon Nov 14 20:40:50 +0000 2022,Guanajuato,"Irapuato, Irapuato",U,-101.3403935,20.673542,452090
"@acostanaranjo Que se limpien las lagañas los de la 4T, para que cuenten bien, cuantas personas marcharon el día 13, para defender al INE",Tue Nov 15 14:58:46 +0000 2022,Puebla,"Puebla, Fundadores del Ejido Colonia Chapultepec",R,-98.1542665,19.0322295,550
Primera foto del día!😌🤭 nisiquiera me he quitado la lagaña de los ojos y ya ando tomándome fotos ! 😝🤫 un bechito pu… https://t.co/viWFYeDh0J,Fri Nov 18 17:36:44 +0000 2022,Ciudad de México,"Tláhuac, Las Calabacitas",R,-99.050461,19.342788499999997,19
"¿Qué con esa tendencia de las chavitas de maquillarse y ponerse dos puntitos en la parte interior de ojo? 

Parece que traen lagañas…",Tue Nov 29 14:30:07 +0000 2022,Ciudad de México,"Coyoacán, Coyoacán",U,-99.15234000000001,19.328383000000002,614447
"@Tonatiuh_88 @Televisa Pues por eso ya nadie los ve, solo los que siguen con lagañas mentales 🧠",Thu Dec 01 04:37:30 +0000 2022,Ciudad de México,"La Magdalena Contreras, La Magdalena Contreras",U,-99.24800950000001,19.318042,246428
"Buen día ! Tarde pero sin lagañas …comprobado, el mejor remedio para el insomnio es una conciencia tranquila.
La se… https://t.co/23vmbUKxJZ",Fri Dec 02 14:29:58 +0000 2022,Ciudad de México,"Cuajimalpa de Morelos, Convento del Desierto de los Leones",R,-99.30558049999999,19.318697,0
Tengo una obsesión con limpiarle los ojos a los perritos. Si me ves quitándole las lagañas a tu perro no te moleste… https://t.co/NsULaMjQLZ,Fri Dec 02 17:12:27 +0000 2022,Nuevo León,"Guadalupe, Las Escobas",R,-100.196134,25.6766035,3
Eso pasa cuando las morras se ponen a ponerse filtro hasta en las chingadas lagañas… acéptense como son morras!!!,Mon Dec 05 20:47:26 +0000 2022,Ciudad de México,"Tlalpan, Cañada del Acueducto",R,-99.208364,19.199485,161
@ElGrill028 Jajaja el cabron se la pasa quitándose las lagañas.,Thu Dec 08 03:40:29 +0000 2022,Quintana Roo,"Felipe Carrillo Puerto, Nohkancab",R,-88.0134815,19.749553,11
"Buen día para vos qué estás con cara de ogt, lleno de lagañas yendo a trabajar con mala gana... Ponete los auris, u… https://t.co/gpmkfj99ge",Mon Dec 12 12:32:16 +0000 2022,Quintana Roo,"Benito Juárez, Premasa del Caribe",R,-87.0316645,21.048719,0
"Cuando a media cena familiar me dice mi tía que le tiembla un ojo y que todas las mañanas le sale lagañas.
*Yo:* https://t.co/DDpTgFXcEk",Fri Dec 16 15:47:21 +0000 2022,Ciudad de México,"Benito Juárez, Benito Juárez",U,-99.1614805,19.380613,434153
"@PedroFerriz Limpiate las pin lagañas, pin ardido!! 👇 https://t.co/5fHQxCp9tn",Mon Dec 19 18:21:16 +0000 2022,Ciudad de México,"Gustavo A. Madero, Gustavo A. Madero",U,-99.1158905,19.518656,1173351
yo llegando bien feli a las 8 am con lagañas a la panadería por mi rosca 💓,Fri Jan 06 15:14:02 +0000 2023,Veracruz de Ignacio de la Llave,"Veracruz, Valente Díaz",U,-96.22939650000001,19.183953,36818
"@mrgeovas Pues tampoco mega producción pero si hay que limpiarse la lagaña o la baba al menos antes de salir 😅
Y pu… https://t.co/Sr0WPUqpPG",Mon Jan 09 16:14:50 +0000 2023,Yucatán,"Dzemul, Santa Magdalena",R,-89.36163950000001,21.25045,0
El perro gato limpianzose las lagañas https://t.co/AHGluGhXZL,Sat Jan 14 04:11:52 +0000 2023,Baja California,"Mexicali, Familia Reatiga Maytorell",R,-115.50236550000001,32.617324499999995,7
@EvelyynChavez No dejas ni quitarnos la lagaña perreeee,Sat Jan 14 14:38:36 +0000 2023,Chihuahua,"Aldama, El Papalote",R,-106.1628985,28.941865999999997,0
@kainne616 @brendaavm Traerás lagañas de que no te has bañado. Súbete en tu patineta y cuenta de diez en diez porqu… https://t.co/d1TwM4zPWn,Sat Oct 03 17:40:04 +0000 2020,México,"Atizapán de Zaragoza, Rancho Nuestra Señora de los Ángeles",R,-99.269192,19.564587500000002,16
Le acabo de quitar las 2 pingas de lagañas que tiene porque no se dejaba. 🙄,Wed Oct 07 01:14:06 +0000 2020,Querétaro,"Querétaro, El Huizachal de las Tetillas",R,-100.4405945,20.7152745,97
@Rayoxa Son lagañas,Mon Oct 12 17:24:51 +0000 2020,Ciudad de México,"Coyoacán, Coyoacán",U,-99.1525965,19.3206955,614447
Le mando Sra. Liliana Asna @LillyTellez este cartelito para que se limpie las lagañas y aprenda a no ser tan pelada… https://t.co/C6TgQzmKay,Wed Oct 14 03:48:09 +0000 2020,Ciudad de México,"Benito Juárez, Benito Juárez",U,-99.1614805,19.380613,434153
A quitarse la lagaña y dense...,Fri Oct 16 14:23:52 +0000 2020,Querétaro,"Querétaro, El Huizachal de las Tetillas",R,-100.4405945,20.7152745,97
"Buen día raza, ya se lavaron la cara para que se les despeguen los ojos con lagañas?",Sat Oct 17 14:53:30 +0000 2020,Ciudad de México,"Gustavo A. Madero, Gustavo A. Madero",U,-99.1158905,19.518656,1173351
Amanecí como gato recién nacido. Con un ojo lleno de lagañas!,Sat Oct 17 14:54:03 +0000 2020,Ciudad de México,"Gustavo A. Madero, Gustavo A. Madero",U,-99.1158905,19.518656,1173351
"Nostoy llorando, se me metió una lagaña al ojo 😢 https://t.co/2vmXbcXokX",Sun Oct 18 15:09:44 +0000 2020,Guanajuato,"Dolores Hidalgo Cuna de la Independencia Nacional, La Erre",R,-100.918596,21.1059435,717
@Nutela_Caazares Jajajajaa las lagañas,Tue Oct 20 05:14:37 +0000 2020,Nuevo León,"San Nicolás de los Garza, San Nicolás de los Garza",U,-100.27047400000001,25.736714999999997,412199
Se arranca el día con una deliciosa taza de café negro para terminar de quitarse las lagañas. Sin dejar la actitud… https://t.co/Gg5b5gd8Dy,Wed Oct 21 11:43:00 +0000 2020,Veracruz de Ignacio de la Llave,"Papantla, Rubén Sánchez Patiño",R,-97.31118099999999,20.419946,1
Capaz que Kamijo tenía una lagaña y nosotros en dramas :v uwu,Sun Oct 25 23:25:23 +0000 2020,México,"Tlalnepantla de Baz, Ejido de Tenayuca (Cola de Caballo)",R,-99.1642825,19.543933000000003,71
Que hermoso así quisiera se bañara mi Yorkshire ni las lagañas sabe limpiar :),Wed Oct 28 14:05:19 +0000 2020,Veracruz de Ignacio de la Llave,"Emiliano Zapata, Los Reyes",R,-96.7223325,19.455647499999998,56
"Mi auto corrector de la vrg, y mis lagañas no me dejan escribir bien amikes...!",Sun Nov 01 14:56:15 +0000 2020,Baja California,"Playas de Rosarito, Mesa Redonda",R,-116.929102,32.3328765,9
Quiero que no dejes de estrujar me sin que yo te diga nada que tus yemas sean lagañas enganchadas a mis vértices me… https://t.co/Vxe8AF2Mrj,Mon Nov 02 16:22:49 +0000 2020,Ciudad de México,"Benito Juárez, Benito Juárez",U,-99.1614805,19.380613,434153
@juliopatan09 Voy!!! Me quito la lagaña y leo 😬☺,Thu Nov 05 13:55:34 +0000 2020,Yucatán,"Mérida, Mérida",U,-89.62361100000001,20.941035,921771
Tengo lagañas en el tercer ojo.,Fri Nov 06 19:44:05 +0000 2020,Guanajuato,"León, Rancho de Don Alberto García",R,-101.601401,21.09806,1
no mame profe ni chanza me dio de quitarme las lagañas jajajj,Mon Nov 09 14:22:30 +0000 2020,Tamaulipas,"Victoria, La Esperanza",R,-99.187904,23.685934,0
@jenarovillamil ¿Y los expertos en quitarle las lagañas con la lengua al presidente?,Mon Nov 16 17:09:31 +0000 2020,Nuevo León,"Monterrey, Monterrey",U,-100.29359149999999,25.6417185,1142952
Con lagañas y web amooos! 🤪🤭,Tue Nov 17 17:17:44 +0000 2020,Baja California,"Mexicali, Ejido José Saldaña Número 2",R,-115.22918000000001,31.789669500000002,19
Qué asco los perros con lagañas weee. 🤮,Sat Nov 21 16:16:50 +0000 2020,Hidalgo,"Tecozautla, El Zundhó",R,-99.6513435,20.540146999999997,95
Lagaña con guayabera 👌🏼,Sat Nov 28 00:59:28 +0000 2020,Jalisco,"Guadalajara, Guadalajara",U,-103.335882,20.676651999999997,1385621
@SirCafeta Lagañas jajaja,Sat Dec 12 00:25:12 +0000 2020,Campeche,"Campeche, Edzná F-Uno [Centro de Recría]",R,-90.27714,19.601414,0
@carlos_omarthe @kali12103439 Mis micos tus lagañas.,Tue Dec 22 23:26:02 +0000 2020,Yucatán,"Mérida, Mérida",U,-89.62361100000001,20.941035,921771
"Ustedes me ven bien por fuera, pero por dentro quiero ponerme las lagañas de mi perro para ver si es cierto que ves la muerte.",Wed Dec 30 23:07:57 +0000 2020,Durango,"Lerdo, La Nogalera Nueva España",R,-103.657843,25.471381,7
Lea bien joven. Es mejor que él se entregue. No conozco a la victima; es una buena sugerencia. Quítese las lagañas,Mon Jan 04 03:20:21 +0000 2021,Durango,"Durango, Metates (Tenchontle)",R,-104.83757800000001,23.954162500000002,194
Limpienle las lagañas a sus perros no mamen.,Sat Jan 09 19:23:35 +0000 2021,Jalisco,"Guadalajara, Guadalajara",U,-103.335882,20.676651999999997,1385621
@MariellaGT5 Lagañas? 🙊🙊🙊,Tue Jan 12 06:37:09 +0000 2021,Baja California,"Mexicali, Ejido José Saldaña Número 2",R,-115.22918000000001,31.789669500000002,19
@oficialkenia Traes lagañas,Thu Jan 14 02:26:26 +0000 2021,Jalisco,"Mascota, Las Vegas",R,-105.14858050000001,20.697052499999998,6
"Por favorsito  no se toquen sus ojitos ni para quitarse las lagañas. Este consejo les doy, porque su amiga Jessy soy.",Sat Jan 16 00:13:50 +0000 2021,San Luis Potosí,"San Luis Potosí, Jorge Ramos",R,-100.955511,22.3111195,0
Traigo las lagañas bien pegadas,Sun Jan 17 15:00:24 +0000 2021,Guanajuato,"Celaya, El Alto",R,-100.772211,20.5226915,4
"Amanecí con los dos ojos llenos de lagaña e hinchados, eso solo quiere decir que me van a tener que hacer cirugía otra vez 😭😩",Tue Jan 19 14:18:37 +0000 2021,Ciudad de México,"Benito Juárez, Benito Juárez",U,-99.1614805,19.380613,434153
"@JavoDlg Deja tú el café, las lagañas!!",Wed Jan 20 14:49:44 +0000 2021,Jalisco,"Tlajomulco de Zúñiga, Las Tarjeas (La Huerta)",R,-103.407581,20.489708999999998,1
@jafetdmty También aquí aún con lagañas y saliva seca 😅,Sat Jan 23 14:27:12 +0000 2021,Guanajuato,"San Miguel de Allende, San Miguel Viejo",R,-100.7761945,20.9100115,833
"@elgejor Chinga tu madre como ves asi se te quita la lagaña de tu ojo,?",Sun Jan 24 07:50:23 +0000 2021,Chiapas,"Villaflores, El Brillante",R,-93.4085195,16.378732,6
A ustedes no les decían de chiquitos que había una personita que venía en las noches a ponerte las lagañas en los o… https://t.co/w0mx5kUsI9,Thu Jan 28 13:06:43 +0000 2021,Nuevo León,"Monterrey, Monterrey",U,-100.29359149999999,25.6417185,1142952
"Buena tarde solesi... oh espera tengo una lagaña. en Nuevo León, Guadalupe https://t.co/r0AkD5hLlQ",Thu Jan 28 20:49:47 +0000 2021,Nuevo León,"Guadalupe, Las Escobas",R,-100.196134,25.6766035,3
Le dije a mi mamá que le compré unos pads a Teodora para quitarle las lagañas y solo me miró juzgando la compra que hice,Wed Feb 03 00:11:41 +0000 2021,Nuevo León,"Villaldama, Jesús Villarreal",R,-100.356007,26.476498999999997,0
@IvanElSonrix Quitate la lagaña,Sat Feb 13 15:32:12 +0000 2021,Quintana Roo,"Benito Juárez, Premasa del Caribe",R,-87.0316645,21.048719,0
Claro que no! Viñas no alineó! Y deja de joder al mejor América y limpia te las lagañas líder y ya!,Mon Feb 22 00:57:20 +0000 2021,Querétaro,"Querétaro, El Huizachal de las Tetillas",R,-100.4405945,20.7152745,97
"No entiendo por qué la gente que compra perros de raza elige gastar dinero EN UN POODLE, pinches perros feos llenos de lagaña color rojo 🥴🥴🥴",Tue Feb 23 01:36:34 +0000 2021,Jalisco,"Zapopan, Tesistán (San Francisco Tesistán)",U,-103.48477450000001,20.790657000000003,91631
"BUENOS DÍAS ☀️ 
Ya es hora de quitarse lagañas y saliva seca",Thu Feb 25 13:09:06 +0000 2021,Guanajuato,"San Miguel de Allende, San Miguel Viejo",R,-100.7761945,20.9100115,833
Aún con lagañas en los ojos 😘 https://t.co/qix0ybQsUw,Thu Feb 25 13:35:38 +0000 2021,Guanajuato,"San Miguel de Allende, San Miguel Viejo",R,-100.7761945,20.9100115,833
No confío en la gente que llega con lagañas a trabajar...,Thu Mar 11 14:36:03 +0000 2021,Sonora,"Hermosillo, Vicente Guerrero",R,-111.498181,28.9698625,5
Buenos días Comuna. Es hora de desenlagañarse.....el día será muuuuuuy largo..,Mon Mar 22 11:10:22 +0000 2021,Querétaro,"Querétaro, El Huizachal de las Tetillas",R,-100.4405945,20.7152745,97
"Puedo traer lagañas o mocos secos pero los zapatos bien brillosos, porque los zapatos son la carta de presentación.",Tue Mar 23 17:45:40 +0000 2021,Sinaloa,"Culiacán, Santa Lucía",R,-107.3420565,24.6624885,0
"Mi mamá: ""¿Estás llorando? Ah no, es una lagaña 😳",Wed Mar 24 22:29:29 +0000 2021,Nuevo León,"Anáhuac, La Mascota",R,-100.031508,27.3224295,0
@A_ausdenRuthen Se le atravesó una lagaña por tanto llorar ayer. Su reforma energética está siendo enterrada.,Thu Mar 25 16:09:34 +0000 2021,Ciudad de México,"Cuauhtémoc, Cuauhtémoc",U,-99.153366,19.432836,545884
@RahulkMx Cómo que a la BOATRIZ se le olvida limpiarle las lagañas al PEJEKKS...,Fri Mar 26 04:48:31 +0000 2021,Quintana Roo,"Benito Juárez, Premasa del Caribe",R,-87.0316645,21.048719,0
@ryodeDios No le limpió las lagañas la BOATRIZ..,Fri Mar 26 21:30:28 +0000 2021,Quintana Roo,"Benito Juárez, Premasa del Caribe",R,-87.0316645,21.048719,0
"@Robotania También con lagañas, jajaja. ✨😅💙✨",Fri Apr 02 17:26:22 +0000 2021,Ciudad de México,"Cuauhtémoc, Cuauhtémoc",U,-99.153366,19.432836,545884
Mis ojitos amanecieron con mucha lagaña... se sienten arenosos... :(,Sat Apr 17 14:43:38 +0000 2021,Ciudad de México,"Tlalpan, Cañada del Acueducto",R,-99.208364,19.199485,161
Que rico despertar tarde con la almohada babeada y chingos de lagañas 🥱,Sat Apr 24 14:06:25 +0000 2021,Guanajuato,"San Miguel de Allende, San Miguel Viejo",R,-100.7761945,20.9100115,833
@Charlywafflez El q duerme solo cultiva lagañas jajaja,Wed Apr 28 12:49:42 +0000 2021,Ciudad de México,"Benito Juárez, Benito Juárez",U,-99.1614805,19.380613,434153
La lagaña de mis ojos ❤️ https://t.co/asJEyI40yl,Wed May 05 03:33:24 +0000 2021,Querétaro,"Querétaro, El Huizachal de las Tetillas",R,-100.4405945,20.7152745,97
"Cuando mis lagañas son negras, solo puede significar una cosa... PTM, me dormí y no me desmaquille ojos.
Sumen una… https://t.co/1yrHSdzlOj",Tue May 18 13:47:32 +0000 2021,Yucatán,"Mérida, Mérida",U,-89.62361100000001,20.941035,921771
"@anitaee73 Pensé que eran lagañas....perdón conozco la salida...
La neta están impresionantes de bonitos...
Saludos.",Wed May 19 18:58:21 +0000 2021,Nuevo León,"Monterrey, Monterrey",U,-100.29359149999999,25.6417185,1142952
"Buen día Tuiterland! 

Sin lagañas, sin pestañas, pero con actitud de finde!

✌🏼 vamos a prepararnos para el detox… https://t.co/713ZHrVSF7",Fri May 21 14:50:55 +0000 2021,Sonora,"Hermosillo, Vicente Guerrero",R,-111.498181,28.9698625,5
"Buen día Tuiterland! 

Sin lagañas, sin pestañas, pero con actitud de finde!

✌🏼 vamos a prepararnos para el “Retox… https://t.co/9ACYYHuojb",Fri May 21 14:51:50 +0000 2021,Sonora,"Hermosillo, Vicente Guerrero",R,-111.498181,28.9698625,5
"@ClaraEnrquez ¿Y a MORENA, sí?..limpiese ud. los labios sangrantes, o las lagañas que le impiden ver, estimada Seño… https://t.co/lbAQEOgXwk",Sat May 22 05:16:49 +0000 2021,Jalisco,"Zapopan, Tesistán (San Francisco Tesistán)",U,-103.48477450000001,20.790657000000003,91631
@FerchiRmz Aaay esque el tuyo está bonito y cuidado!!🤍 los que siempre veo están hasta cafés de los ojos por las lagañas y cero esponjaditos,Sun May 30 23:44:53 +0000 2021,Durango,"Durango, Metates (Tenchontle)",R,-104.83757800000001,23.954162500000002,194
¿A que edad se enteraron que no son lagañas sino legañas? https://t.co/MxKRnyU8hW,Wed Jun 02 15:18:05 +0000 2021,Yucatán,"Mérida, Mérida",U,-89.62361100000001,20.941035,921771
"Lagaña &amp; Moyete en Santa Rosa, Apodaca https://t.co/5DEuYKX061",Fri Jun 04 02:12:47 +0000 2021,Nuevo León,"Apodaca, El Tasajillo",R,-100.1687175,25.778679,0
"Si te deje que me escucharás roncar, que me vieras con lagañas y saliva escurrida seca de mi boca, te amaba de verdad.",Thu Jun 10 14:48:04 +0000 2021,Ciudad de México,"Benito Juárez, Benito Juárez",U,-99.1614805,19.380613,434153
“Habíamos dormido tan poquito que las lagañas ni siquiera nos habían madurado”,Tue Jun 22 02:03:41 +0000 2021,Nuevo León,"Monterrey, Monterrey",U,-100.29359149999999,25.6417185,1142952
"@JicPayan @VicenteFoxQue Límpiate las lagañas, vivir de manera austera no cómo jeque árabe🤷‍♀️",Sat Jun 26 01:32:49 +0000 2021,Hidalgo,"Pachuca de Soto, Aquiles Serdán",R,-98.77580800000001,20.1056375,0
Q hermosa mi lagaña la tqm,Fri Jul 02 03:29:38 +0000 2021,Ciudad de México,"Cuauhtémoc, Cuauhtémoc",U,-99.153366,19.432836,545884
@Mfxxt7 Yo creí que así eran las lagañas de las divas,Sat Jul 03 00:29:00 +0000 2021,Zacatecas,"Guadalupe, La Esmeralda",R,-102.42488650000001,22.7666095,2
"Perate @Rayados, todavía ni me quito las lagañas de los ojos y ya andas anunciando + refuerzos🤪😂",Wed Jul 07 15:20:21 +0000 2021,Nuevo León,"Monterrey, Monterrey",U,-100.29359149999999,25.6417185,1142952
"@brendaleal04 Yo veo el cielo en tus ojos…

…y las montañas, en tus lagañas. 
😅👏🏼😂👏🏼
¡Poeta!",Fri Jul 09 00:15:44 +0000 2021,Ciudad de México,"Coyoacán, Coyoacán",U,-99.15234000000001,19.328383000000002,614447
Yo quería ser cardióloga Jajajaja 🧐 y ahora estoy en el mundo de las lagañas,Sat Jul 10 13:43:56 +0000 2021,Jalisco,"Zapopan, Tesistán (San Francisco Tesistán)",U,-103.48477450000001,20.790657000000003,91631
"¡Gur mornin!
Ya es hora de quitarse las lagañas de los ojos, ¡Despierten!
#FelizLunes #FelizInicioDeSemana",Mon Jul 12 11:46:19 +0000 2021,Ciudad de México,"Benito Juárez, Benito Juárez",U,-99.1614805,19.380613,434153
Hoy me limpio las lagañas me lavo la cara y pongo los pies en la tierra,Tue Jul 13 05:13:14 +0000 2021,Veracruz de Ignacio de la Llave,"Veracruz, Valente Díaz",U,-96.22939650000001,19.183953,36818
Después de las lagañas vienen los lentes sucios. Al despertar inicia la batalla de buscar la claridad para ver el m… https://t.co/wggUXv6QdG,Wed Jul 21 13:41:24 +0000 2021,Querétaro,"Querétaro, El Huizachal de las Tetillas",R,-100.4405945,20.7152745,97
"@idanielth @lopezobrador_ Bolívar tenía miras
Anlo tiene lagañas

Y defender una dictadura? 
Alinear mezquindades d… https://t.co/BCeipODCDD",Sun Jul 25 01:02:23 +0000 2021,Jalisco,"Zapopan, Tesistán (San Francisco Tesistán)",U,-103.48477450000001,20.790657000000003,91631
Cuando suben historias a ig con android siento que le tienen que limpiar la lagaña a su cámara 🤭,Sun Jul 25 09:12:54 +0000 2021,Quintana Roo,"Benito Juárez, Premasa del Caribe",R,-87.0316645,21.048719,0
Donde quedaron los hinchas de Colchon y dos lagañas para el analisis tactico y fino del partido🤔🤭🤷🏻‍♂️🤦🏻‍♂️🇲🇽⚽️,Wed Jul 28 13:43:03 +0000 2021,Nuevo León,"Monterrey, Monterrey",U,-100.29359149999999,25.6417185,1142952
Siempre vemos la lagaña en el ojo ajeno...👁,Fri Jul 30 21:00:58 +0000 2021,Sonora,"Hermosillo, Vicente Guerrero",R,-111.498181,28.9698625,5
@lopezdoriga Con lagañas...,Tue Aug 03 11:43:11 +0000 2021,San Luis Potosí,"San Luis Potosí, Jorge Ramos",R,-100.955511,22.3111195,0
"@hectorscaballer Viri es como Genaro Lozano: Un día se portan ""mal"" y al otro le limpian las lagañas a lengüetazos.",Fri Aug 06 01:21:39 +0000 2021,Nuevo León,"Monterrey, Monterrey",U,-100.29359149999999,25.6417185,1142952
Buenos días amiguitos con lagañas 😌,Sat Aug 14 15:10:37 +0000 2021,Veracruz de Ignacio de la Llave,"Xalapa, La Troja",R,-96.886083,19.542054,88
@alde_barano Saludos a toda la pandilla de @Ibero909FM que despierta en #AldebaranoEnLaMañana y sacude la lagaña y… https://t.co/loEW7g7vJo,Mon Aug 23 14:24:38 +0000 2021,Ciudad de México,"Tláhuac, Las Calabacitas",R,-99.050461,19.342788499999997,19
Cuánto tiempo duró la lagañanera ahora que no estuvo #YaSabenQuien ? #RCATimes,Fri Aug 27 15:11:36 +0000 2021,Sonora,"Nogales, La Escondida",R,-111.001401,31.192592,0
"Ayer, mi hermana y yo vimos a una pareja quitarse lagañas mutuamente e hicimos esta cara al mismo tiempo. 
Si ella… https://t.co/VXLvA1ZZqt",Mon Aug 30 16:19:49 +0000 2021,Ciudad de México,"Cuajimalpa de Morelos, Convento del Desierto de los Leones",R,-99.30558049999999,19.318697,0
