Tweet,Fecha,Estado,Locacion,Tipo,Longitud,Latitud,Poblacion
"Cachetada guajolotera, arañazo, mallugón de bubi y otras técnicas femeninas para romper madres.",Tue Apr 21 21:27:22 +0000 2020,Nuevo León,"General Escobedo, Bios (Las Antonias)",R,-100.3652735,25.807314499999997,1
"@fermar_hdz Yo no estaba llena de arañazos bueno solo cuando teníamos gatos bebés por que ellos aún no sabían controlar su fuerza.

XD",Thu Apr 23 12:39:01 +0000 2020,México,"Nezahualcóyotl, Nezahualcóyotl Segundo [Relleno Sanitario]",R,-99.01701650000001,19.432722,23
Hoy les tocó desparasitada a los gatos y arañazos a @anea_colacao y a mi . Ese Tanto le hace honor a su nombre https://t.co/Sw0nRoJ4EX,Sun Apr 05 03:40:43 +0000 2020,Ciudad de México,"Azcapotzalco, Azcapotzalco",U,-99.18212600000001,19.4857835,432205
"@lamadela Jaja ni los bañaste nadamas les echaste agua jajaja,ches arañazos tan cañones ,",Sun Apr 05 06:45:42 +0000 2020,Jalisco,"Zapopan, Tesistán (San Francisco Tesistán)",U,-103.48477450000001,20.790657000000003,91631
"@PulkaRodrigo @radiolared Si, como 5 arañazos",Sun Apr 26 17:59:57 +0000 2020,Ciudad de México,"Benito Juárez, Benito Juárez",U,-99.1614805,19.380613,434153
@PequeeBonn Excepto si son de arañazos,Fri Apr 10 17:15:22 +0000 2020,Veracruz de Ignacio de la Llave,"Veracruz, Valente Díaz",U,-96.22939650000001,19.183953,36818
"Con tal de distraer del problema principal que es la pandemias, el gobierno se agarra a arañazos con su cuate Salin… https://t.co/sJxtapozxh",Sun Apr 19 01:34:47 +0000 2020,Veracruz de Ignacio de la Llave,"Poza Rica de Hidalgo, Poza Rica de Hidalgo",U,-97.44749449999999,20.536509000000002,180057
"A la mañana siguiente, quise pensar que todo era una pesadilla, pero revisé la pared y ahí estaban los arañazos.

Y… https://t.co/mAuel80G5O",Mon Apr 20 00:05:05 +0000 2020,Ciudad de México,"Benito Juárez, Benito Juárez",U,-99.1614805,19.380613,434153
"Que es un arañazo?

Pues una araña macho muy grande.

🤣😒",Sat May 02 11:28:12 +0000 2020,México,"Ecatepec de Morelos, Ecatepec de Morelos",U,-99.0444445,19.56828,1643623
"Mi BB si supieras lo que extraño tus mordidas y arañazos ...🥺😭

#onix #blackcat #kittens #sad @ Valle Verde Sector… https://t.co/nQuJTYMjro",Wed May 06 15:12:49 +0000 2020,Nuevo León,"Monterrey, Monterrey",U,-100.29359149999999,25.6417185,1142952
"Si no tienes arañazos en los brazos, no tienes gatos.",Fri May 08 07:05:15 +0000 2020,Nuevo León,"Monterrey, Monterrey",U,-100.29359149999999,25.6417185,1142952
"@azaelc Con esas manos de mariconcito, no vas ni con arañazos.",Sat May 09 20:46:26 +0000 2020,Quintana Roo,"Benito Juárez, Premasa del Caribe",R,-87.0316645,21.048719,0
@elgatopolitico_ No olvidar que #LordMontajes esta dando arañazos para poder prenderse de un huesito.,Thu May 14 16:27:37 +0000 2020,México,"Valle de Bravo, Monte Alto",R,-100.1125095,19.1713575,324
"Otra día sin sexo y arañazos en la espalda. 

Otro día perdido.",Thu May 21 06:23:23 +0000 2020,México,"Toluca, Toluca de Lerdo",U,-99.655676,19.284321499999997,223876
"@diana_ra16 Arañazos de otras chavistas, cuenta?",Sun May 24 17:20:55 +0000 2020,Guerrero,"Chilpancingo de los Bravo, Inscuinatoyac (El Pueblito)",R,-99.72418149999999,17.3916575,663
"Voces paplitan dentro de mí,
los dedos mojados,
las tintas lumínicas,
la fiebre ciclónica,
el arañazo
desgarra y se derrama...",Thu May 28 01:36:43 +0000 2020,México,"Naucalpan de Juárez, Cipreses (Las Julianas)",R,-99.310428,19.473793999999998,222
"A veces, solo a veces una no necesita abrazos, palabras bonitas o miradas tiernas. Basta con arañazos en la espalda… https://t.co/nY29YpBCp0",Sat May 30 15:44:25 +0000 2020,San Luis Potosí,"San Luis Potosí, Jorge Ramos",R,-100.955511,22.3111195,0
"Algo me paso en el brazo, me di cuenta ayer en la tarde, tal vez fue un arañazo del Hancook esta chavo y es muy tos… https://t.co/1pfy1sg9He",Mon Jun 08 00:54:55 +0000 2020,Morelos,"Yecapixtla, Los Amates",R,-98.8606355,18.859481000000002,173
"Esto me parte el corazón.. hoy por primera ves mi Kayro me soltó un arañazo con todo el dolo 💔

Se que su instinto… https://t.co/I6HX7yt9lg",Wed Jun 10 07:30:52 +0000 2020,Nuevo León,"General Escobedo, Bios (Las Antonias)",R,-100.3652735,25.807314499999997,1
"@ili_montoya Como cuando terminas una relación sin gritos, arañazos ni insultos y siguen siendo grandes amigos
😆😆😆❤️",Thu Jun 11 00:59:26 +0000 2020,Ciudad de México,"Gustavo A. Madero, Gustavo A. Madero",U,-99.1158905,19.518656,1173351
Feliz día de los perros 🐶 arañazos que me haces!!!😂 https://t.co/jw1lXXROfl,Wed Jul 22 03:29:41 +0000 2020,Guerrero,"Acapulco de Juárez, El Zapote (Kilómetro Trece)",R,-99.73564950000001,16.9589495,5
Y yo que no quería tener gatitos por miedo a los arañazos. 😖 https://t.co/TLCa8cZTjq,Thu Aug 20 19:47:59 +0000 2020,Nayarit,"Bahía de Banderas, Juan Colorado",R,-105.2845295,20.835845,0
@pq_79 En realidad son arañazos de un cachorro de tres meses. 😩,Fri Aug 21 01:06:18 +0000 2020,Nayarit,"Bahía de Banderas, Juan Colorado",R,-105.2845295,20.835845,0
@YosoyMariela Me traje un tupper de arañazos y gruñidos 🖤,Thu Aug 27 20:58:18 +0000 2020,Yucatán,"Mérida, Mérida",U,-89.62361100000001,20.941035,921771
Arañazo en tu espalda...🖤 #sabinaquotes,Tue Sep 01 14:17:06 +0000 2020,Nuevo León,"Monterrey, Monterrey",U,-100.29359149999999,25.6417185,1142952
@MonicaCarrillo Tu eres bella por dentro que se refleja siempre en tu forma serena y alegre  y ese arañazo de la vi… https://t.co/jMd0DyuTLk,Sat Sep 05 20:23:55 +0000 2020,Nuevo León,"San Pedro Garza García, El Sendero",R,-100.366033,25.650287499999997,5
"@EstefaniaVeloz Muy bien, ya empiezan a agarrarse a arañazos, lo esperaba mas tarde, que bien que se adelanten https://t.co/LxfqZQAVPl",Sat Sep 12 05:07:30 +0000 2020,Baja California,"San Quintín, El Tablón",R,-115.5798785,30.156488499999995,4
Arañazo #fotografia #makeup #makeupartist #makeuptutorial #makeupideas #makeupfx #fx #fxcreatives #fxmakeuptutorial… https://t.co/ofyfD2Hlga,Sun Sep 13 18:41:27 +0000 2020,Ciudad de México,"Cuauhtémoc, Cuauhtémoc",U,-99.153366,19.432836,545884
@nohabianadamas Cuando pierde piso un arañazo en las naljas lo rejresa a la realidad,Sat Sep 19 01:58:03 +0000 2020,Nuevo León,"Santa Catarina, Buenos Aires",R,-100.48274899999998,25.5835005,25
@Rene_Tovar Jajjajja y que quieren??? Que les voltee la cara y les de arañazos?? Es un juego y la rivalidad dura 90… https://t.co/9rXpFCuC7k,Mon Sep 21 00:05:21 +0000 2020,Coahuila de Zaragoza,"Viesca, El Alto del Palomillo",R,-103.23313,25.244222999999998,0
"@MademoisellJess Aun que no lo creas es mi supervisor ,si hago mal una costura en chinga me da un arañazo y me dice que soy una mediocre .",Thu Oct 08 17:56:15 +0000 2020,Ciudad de México,"Tlalpan, Cañada del Acueducto",R,-99.208364,19.199485,161
@imbofido Dulce o harañazo!!,Fri Oct 30 15:38:24 +0000 2020,Puebla,"Puebla, Fundadores del Ejido Colonia Chapultepec",R,-98.1542665,19.0322295,550
@Don_Shamed Alguien va a amanecer muerto o con chingos de arañazos,Sun Nov 01 05:01:48 +0000 2020,Yucatán,"Mérida, Mérida",U,-89.62361100000001,20.941035,921771
"Vendo Samsung michi plus 5, a muy buen precio 👌✨ incluye arañazos de máxima potencia y ronroneos de alta calidad 👌✨… https://t.co/83A0N4JyBN",Tue Nov 10 04:25:53 +0000 2020,Puebla,"Puebla, Fundadores del Ejido Colonia Chapultepec",R,-98.1542665,19.0322295,550
@densetsuii Ni modo... arañazos de la la vida,Wed Nov 25 23:54:26 +0000 2020,Ciudad de México,"Benito Juárez, Benito Juárez",U,-99.1614805,19.380613,434153
"Y Joselo me atacó, volteaba para revisar algo en la sals y mr mordió horrible y arañazos por toda la pierna. Chale.… https://t.co/R5GiRMneXR",Sat Nov 28 19:10:47 +0000 2020,Ciudad de México,"Tláhuac, Las Calabacitas",R,-99.050461,19.342788499999997,19
"Amanecí con unos arañazos en mi costado y con un dolor de espalda durísimo, como si me hubiera golpeado fuerte con algo.",Sun Nov 29 16:12:38 +0000 2020,Chiapas,"San Cristóbal de las Casas, El Monte de Sión",R,-92.534411,16.663044499999998,246
@VickyKhaaan Esos dos se chingan a arañazos,Sun Nov 29 18:25:01 +0000 2020,Nuevo León,"Apodaca, El Tasajillo",R,-100.1687175,25.778679,0
@PrinceOf_Gotham @gadotgifs Claro es que cheetah de seguro le da sus arañazos,Wed Dec 09 19:12:19 +0000 2020,Tabasco,"Centro, Medellín y Pigua 1ra. Sección",R,-92.9164995,18.0219595,352
"@JhoselynPereraa Mis gatas luego por el calor del play se acuestan arriba de él y tiene sus arañazos, me han tirado… https://t.co/3MkT3T6Jvj",Sat Dec 12 07:07:36 +0000 2020,Tabasco,"Centro, Medellín y Pigua 1ra. Sección",R,-92.9164995,18.0219595,352
@guillermo_ga @ferch0_6 Te quitabas la garra y la mano toda llena de auténticos arañazos de felino plástico,Tue Dec 29 23:04:34 +0000 2020,Querétaro,"Querétaro, El Huizachal de las Tetillas",R,-100.4405945,20.7152745,97
"Tengo las piernas súper maltratadas entre el frío, los arañazos del gato y que me ha dado por pegarme contra mueble… https://t.co/w4h8UDwTLa",Fri Jan 22 04:20:17 +0000 2021,Ciudad de México,"La Magdalena Contreras, La Magdalena Contreras",U,-99.24800950000001,19.318042,246428
"“[...] cada segmento surcado a su vez por arañazos, muescas, incisiones, comas.""

Italo Calvino,
""Zaira"".
Ciudades Invisibles.",Fri Feb 19 21:06:22 +0000 2021,Ciudad de México,"Benito Juárez, Benito Juárez",U,-99.1614805,19.380613,434153
Mi colección de medallas y de arañazos.,Sat Feb 27 20:02:26 +0000 2021,Colima,"Villa de Álvarez, Mi Sueño",R,-103.83782000000001,19.326965,2
"@mvillegas2001 Es muy común en el acorralado y asustado, empiece aventar arañazos para todos lados .",Tue Mar 02 17:49:27 +0000 2021,Sonora,"Empalme, Punta Calaveras",R,-110.72232699999999,27.8836995,1
"¿Qué?
Temblaste puta, temblaste. 
Fu.

*seña de arañazo*",Wed Mar 03 21:15:43 +0000 2021,Baja California,"Playas de Rosarito, Mesa Redonda",R,-116.929102,32.3328765,9
"Después de tanto forcejeo carnal, arañazos y mordidas de segundo grado comprendí que no necesitaba más cercanía que… https://t.co/NgCyhwp8U8",Thu Mar 04 18:57:24 +0000 2021,Hidalgo,"Pachuca de Soto, Aquiles Serdán",R,-98.77580800000001,20.1056375,0
Y que amanezco con un arañazo... Algún exorcista? 😁 https://t.co/q3VPYC7mpT,Sat Mar 20 17:56:24 +0000 2021,Yucatán,"Mérida, Mérida",U,-89.62361100000001,20.941035,921771
"Hoy le tocó a Chewei su primer baño, ahora parece que me agarre a arañazos con alguien. 🙄",Fri Apr 02 05:37:52 +0000 2021,México,"Apaxco, Pérez de Galeana",R,-99.149507,19.98085,2345
"Una vecina me contó que los gatos causan esquizofrenia. 
Que porque encontraron la misma sustancia en el arañazo de… https://t.co/xn3XsHyXaI",Sat Apr 03 18:52:47 +0000 2021,Ciudad de México,"Cuauhtémoc, Cuauhtémoc",U,-99.153366,19.432836,545884
"@juanmalosan Me he llevado varios arañazos y mordidas por querer sólo agarrarlos, porque simplemente no soy pacient… https://t.co/yUmwmLcZAG",Fri Apr 16 13:47:29 +0000 2021,Ciudad de México,"Benito Juárez, Benito Juárez",U,-99.1614805,19.380613,434153
@AlainSin Siempre me atacan!! Tengo dos cicatrices de sus arañazos 😰,Mon Apr 26 00:47:29 +0000 2021,Oaxaca,"Oaxaca de Juárez, Guadalupe Victoria",R,-96.7250025,17.090319,685
@La_Malignizada Del que estoy trabajando y comienzo a sudar y siento ese ardor en la espalda por los arañazos y nue… https://t.co/MRXDxwlOmb,Thu May 06 17:49:54 +0000 2021,Tamaulipas,"Reynosa, Agua Negra",R,-98.36253100000002,25.836567499999997,0
@GArnauda Hasta arañazos hubo en esa sesión! Qué profesional. 😁,Tue May 11 16:13:50 +0000 2021,Chihuahua,"Juárez, Luis Carlos Ruiz",R,-106.568008,31.452274000000003,0
"Ese es un contragolpe? 🤣🤣🤣🤣 a lo mejor un arañazo, hay niveles mi Germán 🤣🤣🤣",Tue May 18 02:01:58 +0000 2021,Sonora,"Hermosillo, Vicente Guerrero",R,-111.498181,28.9698625,5
"Qué cómo es posible que aguante putazos, mordidas, reseteadas(👉🏼👌🏽) arañazos, jalón de cabello cuando bajo al mar,… https://t.co/KhowIn8UDI",Wed May 26 23:13:55 +0000 2021,Guanajuato,"León, Rancho de Don Alberto García",R,-101.601401,21.09806,1
"Está bien, gracias, fué como un arañazo, no se cayó ni nada, pero le salió mucha sangre y le tuve que dar 4 puntos… https://t.co/H3MQ2D3rMw",Fri May 28 00:50:25 +0000 2021,Tlaxcala,"Huamantla, Jorge Pioquinto",R,-97.922756,19.3343475,5
"No me vean sin cubrebocas amigos, tengo moretones y arañazos por toda la cara",Thu Jun 17 19:42:23 +0000 2021,Yucatán,"Mérida, Mérida",U,-89.62361100000001,20.941035,921771
Se están agarrando a arañazos dentro de la 4T. D:,Sat Jun 19 00:25:22 +0000 2021,México,"Naucalpan de Juárez, Cipreses (Las Julianas)",R,-99.310428,19.473793999999998,222
@norelenita @Carlito63582704 Jijo de la chingada.  Que vaya y le de unos arañazos a la vecina,Wed Jun 30 20:20:22 +0000 2021,Nuevo León,"Guadalupe, Las Escobas",R,-100.196134,25.6766035,3
Que feo es estar en mi casa y no poder quitarme la camisa.porque se me verían los arañazos en mi espalda jaja,Sat Jul 03 05:36:20 +0000 2021,Veracruz de Ignacio de la Llave,"Minatitlán, Ampliación el Depósito",R,-94.3909125,17.706791000000003,91
Me quiero tatuar arañazos de alien,Sat Jul 10 17:20:04 +0000 2021,Sonora,"Hermosillo, Vicente Guerrero",R,-111.498181,28.9698625,5
"Y cuando eres ciclista de montaña también se nota en los arañazos,  moretones, raspones lo enlodado y esa gran sonr… https://t.co/AewL5SNEFe",Wed Jul 28 19:55:36 +0000 2021,Aguascalientes,"Aguascalientes, El Centavito 2",R,-102.327207,21.849459000000003,6
"Esta señorita hermosa, hoy cumple un año de haber llegado a esta casa, a colmarnos de risas, y arañazos :v en Guada… https://t.co/PtBNIi5WFw",Thu Aug 12 00:53:11 +0000 2021,Jalisco,"Guadalajara, Guadalajara",U,-103.335882,20.676651999999997,1385621
"Esta señorita hermosa, hoy cumple un año de haber llegado a esta casa, a colmarnos de risas... y arañazos :v en Gua… https://t.co/CNhvWsjJi5",Thu Aug 12 01:51:18 +0000 2021,Jalisco,"Guadalajara, Guadalajara",U,-103.335882,20.676651999999997,1385621
- Tener arañazos de mi cat en la mano es parte de mi outfit. 🙂🐈,Sat Aug 21 12:13:19 +0000 2021,Puebla,"San Jerónimo Xayacatlán, El Carrizal",R,-97.95139999999999,18.278284,52
@RicardoAnayaC Ay cabron hasta aca escuche los arañazos!! Ahora hasta martir el pendejo!!! Cambia de abogados anima… https://t.co/rygau7n5G8,Tue Aug 31 18:07:45 +0000 2021,Jalisco,"Zapopan, Tesistán (San Francisco Tesistán)",U,-103.48477450000001,20.790657000000003,91631
@Dairetto Muelela o revuelvela con su comida. Yo aprendí a base de arañazos a no sujetarles el hocico,Mon Sep 06 03:22:58 +0000 2021,Jalisco,"Guadalajara, Guadalajara",U,-103.335882,20.676651999999997,1385621
"atrapado en el ayer, arañazos en mi piel",Sat Sep 11 06:40:53 +0000 2021,Nuevo León,"Santa Catarina, Buenos Aires",R,-100.48274899999998,25.5835005,25
Más arañazos y menos balazos! Bonito domingo a todos! 😘 https://t.co/cceuX0RiUu,Sun Sep 12 16:25:28 +0000 2021,Baja California,"Mexicali, Ejido José Saldaña Número 2",R,-115.22918000000001,31.789669500000002,19
"@HazOutes @ClubAmerica Eso aqui en México es un arañazo de mujer, quisas en tu tierra eso sea un golpe de KO pero aqui eso da risa.",Thu Sep 16 05:48:42 +0000 2021,Campeche,"Palizada, Buenos Aires",R,-92.057709,18.134539,1
"Sus arañazos en mi espalda...

Son la caligrafía perfecta para los mejores versos que me han escrito nunca. 💋",Sun Sep 19 03:03:00 +0000 2021,Ciudad de México,"Azcapotzalco, Azcapotzalco",U,-99.18212600000001,19.4857835,432205
"Me encantaría sentir unos arañazos de Mūmin senpai con esas uñas.
(*/▽＼*)💜💜

#びわカン放送1000回",Sat Oct 02 07:28:16 +0000 2021,Zacatecas,"Villa de Cos, La Soledad (Juan Antonio Cortés)",R,-102.5580375,23.6254185,2
@CornejoBerny Arañazo de las gatas ayer 🙄👍🏼🤗,Sat Oct 09 15:49:23 +0000 2021,Baja California,"Mexicali, Ejido José Saldaña Número 2",R,-115.22918000000001,31.789669500000002,19
"@Beisbolpuro @Yankees @RedSox Así es una bronca verdadera, no  la que hacen en el fútbol que es a puro arañazos y pellizcos",Tue Oct 12 03:33:57 +0000 2021,Guanajuato,"León, Rancho de Don Alberto García",R,-101.601401,21.09806,1
colección de medallas y arañazos,Tue Oct 12 18:11:44 +0000 2021,Ciudad de México,"Venustiano Carranza, Venustiano Carranza",U,-99.087817,19.4320755,443704
El @Tigre_Aguilar_C  le pone coco y yemas a su posicionamiento sobre los arañazos del dip de Morena Alejandro Torre… https://t.co/TKI2NYsmgW,Wed Oct 20 16:16:04 +0000 2021,Puebla,"Puebla, Fundadores del Ejido Colonia Chapultepec",R,-98.1542665,19.0322295,550
@IskraArvizu Y el arañazo como me lo quito https://t.co/JuAgNvgG3Y,Thu Oct 28 00:23:09 +0000 2021,Ciudad de México,"Benito Juárez, Benito Juárez",U,-99.1614805,19.380613,434153
"“Tú sabes que me apasiona tu persona
Y esa zona que te quiero morder
Tú sabes que me vuelves loco con tus gritos
Y tus arañazos de mujer”",Mon Nov 15 03:05:11 +0000 2021,Ciudad de México,"Benito Juárez, Benito Juárez",U,-99.1614805,19.380613,434153
Era sparring no arañazos hdtpm,Fri Nov 19 05:05:20 +0000 2021,Jalisco,"Zapopan, Tesistán (San Francisco Tesistán)",U,-103.48477450000001,20.790657000000003,91631
@p6l5y Perfecto gracias besos arañazos?,Wed Nov 24 17:50:24 +0000 2021,Yucatán,"Mérida, Mérida",U,-89.62361100000001,20.941035,921771
"@jazzcelaya @catnyansi Mi mamá lo llevó con una veterinaria especialista en felinos, pues traía un arañazo de otra… https://t.co/QmLB2u09Ta",Mon Dec 06 18:51:22 +0000 2021,Jalisco,"Guadalajara, Guadalajara",U,-103.335882,20.676651999999997,1385621
"🔔 Esta impresionante inteligencia artificial restaura fotografías dañadas: adiós arañazos, hola color https://t.co/fiLnA821p4",Wed Dec 08 14:38:28 +0000 2021,Sonora,"Empalme, Punta Calaveras",R,-110.72232699999999,27.8836995,1
"“El que tenga miedo a morir, que no nazca”
- Yo, antes de bañar a mis 3 gatos y morir desangrado en arañazos.",Sun Dec 12 18:00:13 +0000 2021,Jalisco,"Zapopan, Tesistán (San Francisco Tesistán)",U,-103.48477450000001,20.790657000000003,91631
"Iniciando el año a arañazos, no puedo pedir más después de que se desapareciera por una semana y que en mi mente ro… https://t.co/x7B0ElwfqG",Sat Jan 01 17:08:31 +0000 2022,Oaxaca,"Oaxaca de Juárez, Guadalupe Victoria",R,-96.7250025,17.090319,685
Un arañazo https://t.co/LTA3XLX7qf,Sun Jan 16 21:31:09 +0000 2022,Jalisco,"Guadalajara, Guadalajara",U,-103.335882,20.676651999999997,1385621
Los arañazos son los más afectuosos que te pueden brindar😉🐈‍⬛,Sat Jan 29 05:45:37 +0000 2022,Jalisco,"San Miguel el Alto, El Jagüey",R,-102.387097,20.9925115,7
Estuvo tan buena la cogida que hasta el día siguiente sufrí por mis uñas lastimadas de tanto arañazo🤭 https://t.co/bTmalNqrRA,Sun Feb 20 00:42:18 +0000 2022,Coahuila de Zaragoza,"Saltillo, San Felipe",R,-101.166961,25.0326315,97
"El buen sexo termina en arañazos, mordidas y con los cuerpos mojados por una lluvia de orgasmos. 🖤😈

Riccardo Serrano",Wed Feb 23 06:40:48 +0000 2022,Ciudad de México,"Cuauhtémoc, Cuauhtémoc",U,-99.153366,19.432836,545884
@ursovoid Son arañazos y jalones de greña entran en la categoría 😂😂😂,Fri Mar 11 17:38:30 +0000 2022,Ciudad de México,"Cuauhtémoc, Cuauhtémoc",U,-99.153366,19.432836,545884
Aun así lo quiero mucho. Aunque me deje arañazos y se intete comer mi mano.,Sun Mar 20 07:02:59 +0000 2022,Nuevo León,"Monterrey, Monterrey",U,-100.29359149999999,25.6417185,1142952
"Y pues bueno, hoy también mis gatos decidieron usarme como poste para arañazos.
Que día... https://t.co/BPUdqLmwF2",Tue Mar 22 05:44:12 +0000 2022,Ciudad de México,"Cuauhtémoc, Cuauhtémoc",U,-99.153366,19.432836,545884
@LaPincheMonse Ponte lista no querra irsete a los arañazos,Sat Mar 26 23:49:58 +0000 2022,Nuevo León,"San Nicolás de los Garza, San Nicolás de los Garza",U,-100.27047400000001,25.736714999999997,412199
"AMLO y SamyGoberñetas ahora se tiran arañazos... Que loco.. Pelea épica..
Agua hay pero no la saben distribuir..",Sun Mar 27 15:02:59 +0000 2022,Nuevo León,"Santa Catarina, Buenos Aires",R,-100.48274899999998,25.5835005,25
"@santomontes A las pruebas me remito! Las únicas marcas en mi cuerpo son un tatuaje culero, arañazos de gato y estrías",Tue Apr 05 01:07:06 +0000 2022,Ciudad de México,"Benito Juárez, Benito Juárez",U,-99.1614805,19.380613,434153
@_ryo_hermoso @arivas_diaz Amlo debería protegerlo porque un arañazo tendría un culpable.,Sat Apr 09 22:16:50 +0000 2022,Quintana Roo,"Benito Juárez, Premasa del Caribe",R,-87.0316645,21.048719,0
"@marianagc Disfrútalo, por qué serán los últimos arañazos que le des al erario, Inche traidora vendepatrias. https://t.co/DO40oRkd8b",Tue Apr 19 06:50:50 +0000 2022,Baja California,"Playas de Rosarito, Mesa Redonda",R,-116.929102,32.3328765,9
"@liz_guerrera No hay bronca, a arañazos entramos.",Thu Apr 21 02:05:27 +0000 2022,Ciudad de México,"Coyoacán, Coyoacán",U,-99.15234000000001,19.328383000000002,614447
"@martikarinaz Ando igual, pero yo no recibo abrazos... Yo recibo lenguetazos, arañazos y ladridos de alegría 🐶🥰🐶😍😍 https://t.co/vA03Wqt2Gv",Wed Apr 27 13:27:38 +0000 2022,México,"Naucalpan de Juárez, Cipreses (Las Julianas)",R,-99.310428,19.473793999999998,222
"@Ped_Stone Pero con las uñas recortadas. Ya vez que tiran arañazos.
Acusalo con tu papa @_VicenteSerrano tu el kiko… https://t.co/Gy1FGQWBAp",Thu May 05 16:26:59 +0000 2022,México,"Ecatepec de Morelos, Ecatepec de Morelos",U,-99.0444445,19.56828,1643623
@lacrishf Tremendos arañazos que deben de dejar,Tue May 10 16:46:35 +0000 2022,Jalisco,"Guadalajara, Guadalajara",U,-103.335882,20.676651999999997,1385621
"@El_Sursuncorda @manolo_exilio @LitvinAnibal @lopezobrador_ Jajajajaja. Se lo deshilacha a puro arañazo, apenas int… https://t.co/saw8Ql3ugD",Fri May 13 14:48:01 +0000 2022,Ciudad de México,"La Magdalena Contreras, La Magdalena Contreras",U,-99.24800950000001,19.318042,246428
¿ Cómo hacen éso? Yo trato de bañar a mis gatos una vez al mes y salgo con arañazos en brazos y piernas.,Fri May 13 15:21:46 +0000 2022,Ciudad de México,"Benito Juárez, Benito Juárez",U,-99.1614805,19.380613,434153
"@JTrianaT @monroy75 Uy, arañazo https://t.co/6B9Lz3ytnx",Thu Jun 09 00:06:51 +0000 2022,Tabasco,"Centro, Medellín y Pigua 1ra. Sección",R,-92.9164995,18.0219595,352
@RSGBIam No te ilusiones los culos no van a la guerra a lo mucho se darán arañazos y se agarrarán del chongo,Thu Jun 09 03:17:07 +0000 2022,Jalisco,"Zapopan, Tesistán (San Francisco Tesistán)",U,-103.48477450000001,20.790657000000003,91631
"A este gato lo capacitaron las Fuerzas Armadas en su técnica ""Abrazo no arañazos""",Tue Jul 05 00:52:30 +0000 2022,México,"Tultitlán, Fuentes del Valle",U,-99.130628,19.6302155,82274
Amigos al parecer un incubo trato de violarme el otro día y me dejó arañazos en mi cuello,Thu Jul 28 16:13:35 +0000 2022,Yucatán,"Mérida, Mérida",U,-89.62361100000001,20.941035,921771
@dark_crawling Jajajaja 🤣🤣 y dejas el arañazo,Tue Aug 02 18:01:32 +0000 2022,Puebla,"Puebla, Fundadores del Ejido Colonia Chapultepec",R,-98.1542665,19.0322295,550
Estacionar al sol durante 30 minutos podría hacer que los arañazos de tu auto desaparezcan - Gizmodo en Español… https://t.co/Tx0YqTVdlu,Tue Aug 09 11:27:08 +0000 2022,Ciudad de México,"Xochimilco, Tlacualleli (El Calvario)",R,-99.08179,19.236244499999998,91
"No se preocupe jefe, puliremos esos arañazos. https://t.co/bEhHdf4fvF",Wed Aug 10 14:11:28 +0000 2022,Tabasco,"Huimanguillo, Manuel Sánchez Mármol",R,-93.71282000000001,17.7624055,699
Ruido de arañazos.,Tue Aug 16 02:40:45 +0000 2022,Jalisco,"Tequila, Piedra Gorda",R,-103.78808649999999,21.1168495,0
"@pedroferriz3 @lopezobrador_ Tú eres el golpista??😂😂😂😂😂
Con que piensas tumbar a éste Gobierno?
A arañazos y mordid… https://t.co/BOUJNBxVSm",Mon Aug 22 12:01:21 +0000 2022,Jalisco,"Zapopan, Tesistán (San Francisco Tesistán)",U,-103.48477450000001,20.790657000000003,91631
"Los exhiben cómo cariñosos,pero no tienen los arañazos de la gatita que alimento y le tengo refugio,hasta miedo me… https://t.co/UVuXXEBpOy",Thu Aug 25 02:14:37 +0000 2022,Ciudad de México,"Azcapotzalco, Azcapotzalco",U,-99.18212600000001,19.4857835,432205
"@JosSantosValen2 Se agarraron a bolzasos y se rompieron las medias? O solo hubo arañazos?
Pues no que tan comadres?",Thu Sep 01 04:51:44 +0000 2022,Jalisco,"Zapopan, Tesistán (San Francisco Tesistán)",U,-103.48477450000001,20.790657000000003,91631
"Quirres verlo completo 😌
#ContenidoExplicitoErotico #Cdmx #scortTrans #sur #arañazos #online #Disponible https://t.co/fvwXfsY1d9",Sun Sep 04 20:08:29 +0000 2022,Ciudad de México,"Tláhuac, Las Calabacitas",R,-99.050461,19.342788499999997,19
"Este güey solo tira Arañazos a lo Pendejo , esta manipulado por la idiotez ,",Sun Sep 11 04:08:49 +0000 2022,México,"Acambay de Ruíz Castañeda, Hermosa Provincia",R,-99.89822649999999,19.9614515,122
"Lola y yo, descripción gráfica después de terminar con una mordida y dos arañazos",Sun Sep 18 05:17:56 +0000 2022,Sonora,"Hermosillo, Vicente Guerrero",R,-111.498181,28.9698625,5
Dime que esos arañazos son de los gatos y no se poderes más allá de mi comprensión... Pero... ¿qué harían los gatos… https://t.co/iiqfkjYbtt,Wed Sep 28 02:02:33 +0000 2022,Jalisco,"Guadalajara, Guadalajara",U,-103.335882,20.676651999999997,1385621
Arañazos sobre pierna desnuda: evidencia felina de usarme como silla.,Mon Oct 03 04:20:14 +0000 2022,Ciudad de México,"Cuauhtémoc, Cuauhtémoc",U,-99.153366,19.432836,545884
