Tweet,Fecha,Locacion,Coordenadas
"#DefendamosLasAfores NO permitamos que @lopezobrador_ y su camarilla de ineptos tiren al WC de @Pemex , #DosBocas y… https://t.co/heyjJ5Z4WY",Wed Apr 22 03:10:06 +0000 2020,"Cuauhtémoc, Distrito Federal","[[[-99.18435, 19.399835], [-99.18435, 19.465837], [-99.122382, 19.465837], [-99.122382, 19.399835]]]"
Colocación de wc de una sola pieza con haciento de madera cambiando juntaproel pijas y aplicación de cemento blanco… https://t.co/HvdF8N33mB,Thu Apr 23 04:30:56 +0000 2020,"Cuauhtémoc, Distrito Federal","[[[-99.18435, 19.399835], [-99.18435, 19.465837], [-99.122382, 19.465837], [-99.122382, 19.399835]]]"
"Colocación de wc de una sola pieza con asiento de madera cambiando junta proel, pijas y aplicación de cemento blanc… https://t.co/Ojdr7XTZtq",Thu Apr 23 04:39:12 +0000 2020,"Cuauhtémoc, Distrito Federal","[[[-99.18435, 19.399835], [-99.18435, 19.465837], [-99.122382, 19.465837], [-99.122382, 19.399835]]]"
"Es la primera vez (de la mañana) que entro al WC &amp; santa ostia del universo maximo, no sabía que un cuerpo humano p… https://t.co/HVoGSZqu8u",Wed Apr 01 15:07:55 +0000 2020,"Hermosillo, Sonora","[[[-112.615459, 28.228442], [-112.615459, 29.711283], [-110.380903, 29.711283], [-110.380903, 28.228442]]]"
@NathanTippins @ForzaIn98116150 @QwesiFresh @brfootball Flawless in the wc penalties and champion,Fri Apr 03 08:04:20 +0000 2020,"Hermosillo, Sonora","[[[-112.615459, 28.228442], [-112.615459, 29.711283], [-110.380903, 29.711283], [-110.380903, 28.228442]]]"
"¿Qué pedo? Hasta ahorita me voy entrando que WC es Water-Closet ""Armario de Agua"". https://t.co/20Uzws1Cj7",Fri Apr 03 20:08:30 +0000 2020,"Mazatlán, Sinaloa","[[[-106.619116, 23.068553], [-106.619116, 23.867727], [-105.924379, 23.867727], [-105.924379, 23.068553]]]"
solo necesito un Nigeria WC 2018 home kit para ser feliz,Tue Apr 07 07:33:43 +0000 2020,"Juárez, Nuevo León","[[[-100.242361, 25.510904], [-100.242361, 25.705759], [-99.995403, 25.705759], [-99.995403, 25.510904]]]"
O que no le jalaras a la taza del wc porque te salia la mano peluda😁,Sun Apr 12 19:47:46 +0000 2020,"Tlalpan, Distrito Federal","[[[-99.315748, 19.087511], [-99.315748, 19.311459], [-99.10098, 19.311459], [-99.10098, 19.087511]]]"
@viriwonder Yo me quise escapar por una ventana en una peda y rompí el wc de un hotel 🤨🤣,Sun Apr 12 23:17:09 +0000 2020,"Tijuana, Baja California","[[[-117.298421, 32.098292], [-117.298421, 32.567461], [-116.559783, 32.567461], [-116.559783, 32.098292]]]"
@vanehupp 10. Marco Tardelli. WC final 82 https://t.co/DCCk43VuQv,Wed Apr 15 18:12:37 +0000 2020,"Monterrey, Nuevo León","[[[-100.421037, 25.480538], [-100.421037, 25.802899], [-100.166146, 25.802899], [-100.166146, 25.480538]]]"
"Aprendí que antes de hacer limpieza profunda en el WC debo de 💩💩💩💩.

Nada, esestodoeltui",Thu Apr 16 04:07:29 +0000 2020,"Benito Juárez, Distrito Federal","[[[-99.191996, 19.357102], [-99.191996, 19.404124], [-99.130965, 19.404124], [-99.130965, 19.357102]]]"
Y qué voy tapando el WC de la oficina 🤭,Thu Apr 16 17:26:53 +0000 2020,"Campeche, México","[[[-90.693549, 19.2393], [-90.693549, 19.963528], [-89.860731, 19.963528], [-89.860731, 19.2393]]]"
"La raya en el WC me parece realmente asquerosa. Las otras interesantes 😂
Lo que hace el ocio #bansky 
https://t.co/6x62u8Xa3b",Thu Apr 16 23:32:19 +0000 2020,"Álvaro Obregón, Distrito Federal","[[[-99.324375, 19.232228], [-99.324375, 19.403856], [-99.171644, 19.403856], [-99.171644, 19.232228]]]"
"La rata en el WC me parece realmente asquerosa. Las otras se ven interesantes. Lo que hace el encierro #Bansky 
😜
https://t.co/6x62u8Xa3b",Thu Apr 16 23:47:12 +0000 2020,"Álvaro Obregón, Distrito Federal","[[[-99.324375, 19.232228], [-99.324375, 19.403856], [-99.171644, 19.403856], [-99.171644, 19.232228]]]"
Cuando me enfermo me da un montón de sed pero así increíble cual cruda de dos días jaja y por ende eso ir al WC como 84828191 veces 🥺,Fri Apr 17 04:28:06 +0000 2020,"Mineral de la Reforma, Hidalgo","[[[-98.771665, 19.980272], [-98.771665, 20.127165], [-98.659454, 20.127165], [-98.659454, 19.980272]]]"
"Pensaba cambiar y ser igual, pero naaaaaa, mejor alv esas 💩💩. Ya van varias que estan en el wc 🤭",Sat Apr 18 12:53:53 +0000 2020,"Jiutepec, Morelos","[[[-99.217498, 18.836722], [-99.217498, 18.936651], [-99.119803, 18.936651], [-99.119803, 18.836722]]]"
@Tu_Bombonzito Wc sucio 🤮🤮,Sun Apr 19 21:24:40 +0000 2020,"Carmen, Campeche","[[[-92.468889, 17.873531], [-92.468889, 19.032122], [-90.797686, 19.032122], [-90.797686, 17.873531]]]"
"@callodehacha @HLGatell Como a tí no se te acercan ni las moscas de WC para tí que facil resulta mantener la sana distancia, @callodehacha",Mon Apr 20 22:10:18 +0000 2020,"Villa de Álvarez, Colima","[[[-104.031343, 19.219302], [-104.031343, 19.434628], [-103.644297, 19.434628], [-103.644297, 19.219302]]]"
@DaddyCoolJS @JaneMe_2211 Desde lo de Bartlett se supo. Además ella es peor de asquerosa que un trapeador de WC Público.,Tue Apr 28 01:56:11 +0000 2020,"Querétaro, Querétaro Arteaga","[[[-100.596343, 20.50317], [-100.596343, 20.927379], [-100.284846, 20.927379], [-100.284846, 20.50317]]]"
@bta_Demian Va a enterrar si k ki ta porque no conoce el wc solo letrina,Wed Apr 29 22:11:13 +0000 2020,"Ciudad Madero, Tamaulipas","[[[-97.86013, 22.237664], [-97.86013, 22.328388], [-97.784943, 22.328388], [-97.784943, 22.237664]]]"
"@R_SalazarTD Kikín fue también a Europa después de la WC de GER.

No es x defender a Hugo pero a él lo echaron x pe… https://t.co/ww1Fysw6er",Thu Apr 30 01:31:45 +0000 2020,"Guanajuato, México","[[[-101.437013, 20.826352], [-101.437013, 21.224641], [-101.063255, 21.224641], [-101.063255, 20.826352]]]"
@RahulkMx El wc justo donde esta,Sat May 02 22:56:31 +0000 2020,"Puebla, México","[[[-98.289206, 18.83765], [-98.289206, 19.226809], [-98.019327, 19.226809], [-98.019327, 18.83765]]]"
"@Xavitarnus @The7Serpare @ARCE_EBH Vivirá por siempre en nuestros corazones...
Sus intentos de WC Timurida.",Sun May 03 17:22:25 +0000 2020,"General Escobedo, Nuevo León","[[[-100.465272, 25.716689], [-100.465272, 25.89794], [-100.265275, 25.89794], [-100.265275, 25.716689]]]"
Hoy 🍺 partyseo-tour de mi sala al comedor y recamara y el After en mi WC https://t.co/tRijQMMsSR,Sat May 09 22:31:13 +0000 2020,"Mexicali, Baja California","[[[-115.818421, 30.86042], [-115.818421, 32.718919], [-114.639939, 32.718919], [-114.639939, 30.86042]]]"
@Mitocondriaco1 @ThomasHueyapan @LunaGilVent WC hobby,Mon May 11 00:01:21 +0000 2020,"Puerto Vallarta, Jalisco","[[[-105.324392, 20.471599], [-105.324392, 20.922506], [-104.972769, 20.922506], [-104.972769, 20.471599]]]"
"@StinkerGod La verdad que si Bro, o te sientas en el wc o esperas a que se te baje",Mon May 11 14:08:31 +0000 2020,"Campeche, México","[[[-90.693549, 19.2393], [-90.693549, 19.963528], [-89.860731, 19.963528], [-89.860731, 19.2393]]]"
"@qtf Fer, WC es water case no?",Tue May 12 16:05:24 +0000 2020,"Zapopan, Jalisco","[[[-103.664175, 20.583418], [-103.664175, 20.997896], [-103.305374, 20.997896], [-103.305374, 20.583418]]]"
@AlejaandraPf te quiero 😘 besos desde el wc 🚽,Wed May 13 00:16:23 +0000 2020,"Zapopan, Jalisco","[[[-103.664175, 20.583418], [-103.664175, 20.997896], [-103.305374, 20.997896], [-103.305374, 20.583418]]]"
"Entre al wc y mi mamá me gritó que había tirado todo el tequila en el lavabo porque estaba enojada, por si el baño… https://t.co/ZmCPxdnp8r",Sat May 16 08:46:11 +0000 2020,"Ciudad Madero, Tamaulipas","[[[-97.86013, 22.237664], [-97.86013, 22.328388], [-97.784943, 22.328388], [-97.784943, 22.237664]]]"
Otra vez le oriné la cabeza al gato por asomarse al WC mientras hacía lo mío. 🤦🏻‍♂️ https://t.co/8zyMJeKcLn,Sun May 17 05:25:58 +0000 2020,"Polanco II Sección, Miguel Hidalgo","[[[-99.207385, 19.434061], [-99.207385, 19.438614], [-99.20096, 19.438614], [-99.20096, 19.434061]]]"
"Tres veces al wc en menos de 5 horas... Ya califica como ""enfermo del estómago""?",Mon May 18 02:33:49 +0000 2020,"Celaya, Guanajuato","[[[-100.913535, 20.356869], [-100.913535, 20.688514], [-100.630887, 20.688514], [-100.630887, 20.356869]]]"
"@franps73 @formulers Desde luego que el líder natural era Vettel, era el WC en el equipo, pero Leclerc ha demostrad… https://t.co/2kJeIQYbiG",Mon May 18 20:02:57 +0000 2020,"Benito Juárez, Distrito Federal","[[[-99.191996, 19.357102], [-99.191996, 19.404124], [-99.130965, 19.404124], [-99.130965, 19.357102]]]"
@s83exy Y el Wc lo sabe 🚽,Tue May 19 17:14:51 +0000 2020,"Gustavo A. Madero, Distrito Federal","[[[-99.180678, 19.444937], [-99.180678, 19.592375], [-99.051103, 19.592375], [-99.051103, 19.444937]]]"
"@SergioSarmiento Salen del WC tanto chairo bot. No me sorprende, pululan en la kk del kks.",Fri May 22 04:19:26 +0000 2020,"Corregidora, Querétaro Arteaga","[[[-100.508629, 20.361791], [-100.508629, 20.595719], [-100.370833, 20.595719], [-100.370833, 20.361791]]]"
@rthur013 Así si dan ganas d tener tu wc rechinando d limpio,Sun May 24 04:31:06 +0000 2020,"Guadalajara, Jalisco","[[[-103.408633, 20.600585], [-103.408633, 20.752719], [-103.263131, 20.752719], [-103.263131, 20.600585]]]"
@CiroGomezL @epigmenioibarra Prefiero el olor de WC a estar cerca de un Ciro apagado por la corrupción.Epigmenio pr… https://t.co/m4BLd4xHML,Fri May 29 20:56:23 +0000 2020,"Tlalpan, Distrito Federal","[[[-99.315748, 19.087511], [-99.315748, 19.311459], [-99.10098, 19.311459], [-99.10098, 19.087511]]]"
@NiniaChef Puedes comprar un cepillo como los que usas para lavar el wc y usarlo exclusivamente para trastes,Mon Jun 08 13:57:11 +0000 2020,"San Pedro Garza García, Nuevo León","[[[-100.425188, 25.583557], [-100.425188, 25.717018], [-100.306878, 25.717018], [-100.306878, 25.583557]]]"
Si Lopez Doriga o Loret De Mola no confirman la muerte de El Mencho para mí esto sigue siendo como un WC público.,Sat Jun 13 02:10:48 +0000 2020,"Minatitlán, Veracruz de Ignacio de la Llave","[[[-94.657741, 17.31782], [-94.657741, 18.095762], [-94.124084, 18.095762], [-94.124084, 17.31782]]]"
neta que ya tengo miedo de levantarme e ir al baño desde que se metió una culebra y la encontré detrás de mi wc 🚽 😰😭😭,Mon Jun 15 06:41:17 +0000 2020,"Solidaridad, Quintana Roo","[[[-87.777003, 20.356869], [-87.777003, 20.812192], [-86.916961, 20.812192], [-86.916961, 20.356869]]]"
@RicardoFregozo3 Es como ver la tasa del wc después de una diarrea por comer mariscos en mal estado!!🤮🤮🤮🤮🤮,Tue Jun 16 20:47:18 +0000 2020,"Zapopan, Jalisco","[[[-103.664175, 20.583418], [-103.664175, 20.997896], [-103.305374, 20.997896], [-103.305374, 20.583418]]]"
@Villota94 Depende si vas al wc se baja si te vas a bañar se quita  😂😂😂😂,Wed Jun 17 19:01:15 +0000 2020,"San Fernando, Chiapas","[[[-93.320672, 16.793558], [-93.320672, 17.031296], [-93.092183, 17.031296], [-93.092183, 16.793558]]]"
@LaloGonzalezM No eres el único Lalo lo peor es que yo la oigo cuando estoy en el wc o bañándome,Wed Jun 24 22:33:46 +0000 2020,"Miguel Hidalgo, Distrito Federal","[[[-99.259495, 19.386371], [-99.259495, 19.473498], [-99.163526, 19.473498], [-99.163526, 19.386371]]]"
El wc recién lavado // Yo dejando un crayolazo que ni bajándole dos veces se borra: https://t.co/FSYYJtdIv8,Tue Jun 30 13:56:54 +0000 2020,"Guadalajara, Jalisco","[[[-103.408633, 20.600585], [-103.408633, 20.752719], [-103.263131, 20.752719], [-103.263131, 20.600585]]]"
@UnnaTuitera @BeAcevedoTachna Ir al WC y no haberte fijado que no había papel,Wed Jul 01 19:28:19 +0000 2020,"Tepic, Nayarit","[[[-105.147236, 21.393999], [-105.147236, 21.859333], [-104.597879, 21.859333], [-104.597879, 21.393999]]]"
Acabo de descubrir que ya NO puedo comer danonino 😔 me manda directito al WC 🚽 💩 😖 #Notyounganymore,Thu Jul 02 04:02:30 +0000 2020,"Coatzacoalcos, Veracruz de Ignacio de la Llave","[[[-94.637726, 18.061419], [-94.637726, 18.209491], [-94.227238, 18.209491], [-94.227238, 18.061419]]]"
"@magazo69 Están horribles, el día de ayer cene ahí y sigo sin poder salir del WC #SeTeniaQueDecirYseDijo",Thu Jul 02 07:27:53 +0000 2020,"Cuautitlán Izcalli, México","[[[-99.294897, 19.580497], [-99.294897, 19.732082], [-99.172417, 19.732082], [-99.172417, 19.580497]]]"
"Active WC súper efectivo!
#Stanhome  #Xalapa en Xalapa, Mexico https://t.co/gqEMfiQ1YG",Mon Jul 06 10:26:06 +0000 2020,"Xalapa, Veracruz de Ignacio de la Llave","[[[-96.971524, 19.48425], [-96.971524, 19.599858], [-96.800642, 19.599858], [-96.800642, 19.48425]]]"
"@DonPorfifirio @Mex_Libertario Que compartan  mingitorio, wc y papel",Tue Jul 07 20:39:36 +0000 2020,"Tlalpan, Distrito Federal","[[[-99.315748, 19.087511], [-99.315748, 19.311459], [-99.10098, 19.311459], [-99.10098, 19.087511]]]"
Tengo una duda. ¿Cuántas personas tenemos que orinar la mismo tiempo en un WC para que se baje solo?,Wed Jul 08 04:29:10 +0000 2020,"El Marqués, Querétaro Arteaga","[[[-100.405474, 20.520117], [-100.405474, 20.971164], [-100.151207, 20.971164], [-100.151207, 20.520117]]]"
"Ya les conte cuando un día se me cayo el celular al WC platicando con @SaarahEthel, empecé a buscar arroz en casa d… https://t.co/o00ig7oiKr",Fri Jul 10 16:05:28 +0000 2020,"Puebla, México","[[[-98.289206, 18.83765], [-98.289206, 19.226809], [-98.019327, 19.226809], [-98.019327, 18.83765]]]"
@telediariomty solicité al personal de afuera entrar para usar WC de la clínica 3. Pero como piden sana distancia e… https://t.co/gOuu5gMTNA,Tue Jul 14 20:14:39 +0000 2020,IMSS UMF 3,"[[[-100.296873, 25.683604], [-100.296873, 25.683604], [-100.296873, 25.683604], [-100.296873, 25.683604]]]"
Xq pusimos una paloma (cohete muy kabron) en un WC del baño de las niñas y pues estalló como olla exprés con frijol… https://t.co/ECeoMraXbT,Thu Jul 16 02:15:38 +0000 2020,"Benito Juárez, Quintana Roo","[[[-87.322724, 20.734206], [-87.322724, 21.363232], [-86.740605, 21.363232], [-86.740605, 20.734206]]]"
"Miren, para remodelar un wc muy angosto. Se ve lindo hasta para sentarse y no cagar. https://t.co/qhV5KFKlNf",Sun Jul 19 02:07:29 +0000 2020,"Juárez, Chihuahua","[[[-106.950638, 31.120681], [-106.950638, 31.783867], [-106.185378, 31.783867], [-106.185378, 31.120681]]]"
"@LandaElos @Lizgottik @JD_GuerraMunoz Que cochinada , si el teléfono tiene más bichos que un wc y ni uso cubrebocas… https://t.co/yDX8SrYlSf",Tue Jul 21 18:16:41 +0000 2020,"Atizapán de Zaragoza, México","[[[-99.330259, 19.51799], [-99.330259, 19.611185], [-99.208125, 19.611185], [-99.208125, 19.51799]]]"
@CaroCarisima @lopezobrador_  A esto se le llama “tirar” al WC el escasísimo dinero de los Mexicanos. Misma histori… https://t.co/K8aLgHKkZN,Wed Jul 22 21:28:04 +0000 2020,"Bahía de Banderas, Nayarit","[[[-105.610328, 20.667221], [-105.610328, 21.004469], [-104.958731, 21.004469], [-104.958731, 20.667221]]]"
@condessaK La solitaria que escapó del wc después de ser expulsada,Wed Jul 22 21:40:17 +0000 2020,"Benito Juárez, Distrito Federal","[[[-99.191996, 19.357102], [-99.191996, 19.404124], [-99.130965, 19.404124], [-99.130965, 19.357102]]]"
Una foto en el WC no puede faltar hahaha https://t.co/SlQl7t9rdb,Sat Jul 25 03:21:38 +0000 2020,"Guadalajara, Jalisco","[[[-103.408633, 20.600585], [-103.408633, 20.752719], [-103.263131, 20.752719], [-103.263131, 20.600585]]]"
@TaniaSachdev Part of us wanted Ivanchuk to win. He has a terrific spirit and combative. The WC knows that... #chesslegends @chess24com,Sat Jul 25 18:16:52 +0000 2020,"Juárez, Chihuahua","[[[-106.950638, 31.120681], [-106.950638, 31.783867], [-106.185378, 31.783867], [-106.185378, 31.120681]]]"
"@bta_Demian Ya son antihigienicos para el wc y contaminantes para el calentador, ambos en desuso, y me imagino los… https://t.co/ahqXEMCoA5",Sun Jul 26 00:28:18 +0000 2020,"Córdoba, Veracruz de Ignacio de la Llave","[[[-97.001897, 18.837368], [-97.001897, 19.013211], [-96.872107, 19.013211], [-96.872107, 18.837368]]]"
"No les pasa que en un día no van al WC 💩 y al otro sacan todo lo de una semana, a mi si 😂",Sat Aug 01 15:58:11 +0000 2020,"Xalapa, Veracruz de Ignacio de la Llave","[[[-96.971524, 19.48425], [-96.971524, 19.599858], [-96.800642, 19.599858], [-96.800642, 19.48425]]]"
@AM04611 @avieu @PerMexicum @lopezobrador_ Que rico sería hechar al mojonazo eze al wc y jalarle y ay que drenaje p… https://t.co/z2Bfleq5sF,Sat Aug 01 20:01:36 +0000 2020,Ferreteria Esquina Naranja,"[[[-101.20159, 20.574603], [-101.20159, 20.574603], [-101.20159, 20.574603], [-101.20159, 20.574603]]]"
"Dejar el wc todo orinado ☝💀
Perro asco!!!",Sun Aug 02 19:18:29 +0000 2020,"Tlalpan, Distrito Federal","[[[-99.315748, 19.087511], [-99.315748, 19.311459], [-99.10098, 19.311459], [-99.10098, 19.087511]]]"
Ustedes cuando van al WC (baño)  y se sientan en la taza se bajan los bóxer hasta abajo o arriba como yo 😅🤭😈 https://t.co/VbKch4uNnA,Fri Aug 07 21:31:57 +0000 2020,"Tecate, Baja California","[[[-116.784064, 32.174068], [-116.784064, 32.640459], [-115.765888, 32.640459], [-115.765888, 32.174068]]]"
Ustedes cuando van al WC (baño)  y se sientan en la taza se bajan los bóxer hasta abajo o arriba como yo 😅🤭😈… https://t.co/DZzTYUkEJM,Fri Aug 07 21:36:05 +0000 2020,"Tecate, Baja California","[[[-116.784064, 32.174068], [-116.784064, 32.640459], [-115.765888, 32.640459], [-115.765888, 32.174068]]]"
"En esta casa el día del gato se celebra limpiando areneros. El del orgasmo, echando las culpas al WC junto con las cacas de los gatos.",Sat Aug 08 23:19:28 +0000 2020,"Cuauhtémoc, Distrito Federal","[[[-99.18435, 19.399835], [-99.18435, 19.465837], [-99.122382, 19.465837], [-99.122382, 19.399835]]]"
Tuiteando desde el wc jajajaja #ExaRiveristas #ExaBFF,Thu Aug 13 23:55:15 +0000 2020,"Ramos Arizpe, Coahuila de Zaragoza","[[[-101.892504, 25.449264], [-101.892504, 26.393426], [-100.579431, 26.393426], [-100.579431, 25.449264]]]"
@CRISTIAN__27__ Más bien las ganas de ir al wc jajajajajja y también la edad,Fri Aug 14 13:07:47 +0000 2020,"Ecatepec de Morelos, México","[[[-99.118665, 19.484399], [-99.118665, 19.652161], [-98.970224, 19.652161], [-98.970224, 19.484399]]]"
Mi apá un día me va venir a quemar el qlo con tanta mamada que le echa al wc y no avisa,Fri Aug 14 22:44:05 +0000 2020,"Culiacán, Sinaloa","[[[-107.806281, 24.028162], [-107.806281, 25.296815], [-106.877832, 25.296815], [-106.877832, 24.028162]]]"
Porque cuando hay gente cerca y estás en el wc haces un escándalo y cuando no ni en cuenta 😖,Mon Aug 17 14:21:40 +0000 2020,"Xalapa, Veracruz de Ignacio de la Llave","[[[-96.971524, 19.48425], [-96.971524, 19.599858], [-96.800642, 19.599858], [-96.800642, 19.48425]]]"
"Careta, cubrebocas, traje, botas, y entra al wc y sale sin lavarse las manos... en fin, la hipcresía. https://t.co/EN1x7bPm21",Tue Aug 18 23:19:28 +0000 2020,Aeropuerto Internacional de Monterrey (MTY),"[[[-100.113271, 25.776701], [-100.113271, 25.776701], [-100.113271, 25.776701], [-100.113271, 25.776701]]]"
@BoxerVergaBig A los 9 años con mi primo en el wc d mi casa y parados me dolió hasta el último hueso jeje pero q riko fue,Wed Aug 19 05:05:19 +0000 2020,"Reynosa, Tamaulipas","[[[-98.587332, 25.445849], [-98.587332, 26.227286], [-98.13773, 26.227286], [-98.13773, 25.445849]]]"
@MRKONS Ya siéntese señora... En el WC 🤣,Thu Aug 20 04:36:31 +0000 2020,"Cuajimalpa de Morelos, Distrito Federal","[[[-99.364536, 19.232313], [-99.364536, 19.405081], [-99.246625, 19.405081], [-99.246625, 19.232313]]]"
"@leozuckermann @nexosmexico Relájate payaso.
Chingada revista, ni para el wc de taller mecánico 🤷‍♂️",Fri Aug 21 01:26:12 +0000 2020,"Alvarado, Veracruz de Ignacio de la Llave","[[[-96.11682, 18.554787], [-96.11682, 19.115664], [-95.509639, 19.115664], [-95.509639, 18.554787]]]"
Ya contamos con wc los esperamos a partir de las 10 am hasta 9 pm pueblo nuevo coatepec. Info al 5561390677 en Coat… https://t.co/ONXf0QZcr0,Sun Aug 23 18:28:20 +0000 2020,"Ixtapaluca, México","[[[-98.954037, 19.285882], [-98.954037, 19.43283], [-98.640458, 19.43283], [-98.640458, 19.285882]]]"
"@MarioMal  después de escuchar al diputado no se si reír , llorar o ir al WC dice va a seguir con la lluvia de idea… https://t.co/owY89kAEae",Mon Aug 24 12:02:42 +0000 2020,"Valle de Chalco Solidaridad, México","[[[-98.975864, 19.22413], [-98.975864, 19.340046], [-98.905782, 19.340046], [-98.905782, 19.22413]]]"
"Ja, pregunté usted a otros ! Esos “periodistas” están escondidos en su WC !",Wed Aug 26 02:39:05 +0000 2020,"Tuxtla Gutiérrez, Chiapas","[[[-93.243094, 16.645909], [-93.243094, 16.838962], [-93.036225, 16.838962], [-93.036225, 16.645909]]]"
@manumanito Jajajjajajaja no fui al wc porque llegaron por mi ☹️🥺,Thu Aug 27 17:48:44 +0000 2020,"Colima, México","[[[-103.824474, 18.872415], [-103.824474, 19.328269], [-103.489003, 19.328269], [-103.489003, 18.872415]]]"
#legostarwarstheskywalkersaga déjenlo en que termina #returnofthejedi y echan al WC las tres que siguen... #gamescom2020,Thu Aug 27 19:12:07 +0000 2020,"Benito Juárez, Distrito Federal","[[[-99.191996, 19.357102], [-99.191996, 19.404124], [-99.130965, 19.404124], [-99.130965, 19.357102]]]"
"@LaraGue6 @yo_leon1 @_Alexis_Navan_ @_Veronikamaf @SergioSarmiento Solito está cayendo en el WC de la historia, cóm… https://t.co/AyUdlpZsUw",Fri Aug 28 17:11:47 +0000 2020,"Cuauhtémoc, Distrito Federal","[[[-99.18435, 19.399835], [-99.18435, 19.465837], [-99.122382, 19.465837], [-99.122382, 19.399835]]]"
Si entra a la mañanera donde estuvo Brozo es bien fácil. Afuera del palacio hay un letrero que dice WC paga 5 pesos… https://t.co/38VLW5IiaS,Thu Sep 03 16:59:15 +0000 2020,"Naucalpan de Juárez, México","[[[-99.413769, 19.412031], [-99.413769, 19.535557], [-99.207087, 19.535557], [-99.207087, 19.412031]]]"
CONCACAF WC qualifiers in October and November postponed until March. Shame after all the work done to come up with… https://t.co/aRyxitHkLz,Tue Sep 08 16:34:02 +0000 2020,"Benito Juárez, Distrito Federal","[[[-99.191996, 19.357102], [-99.191996, 19.404124], [-99.130965, 19.404124], [-99.130965, 19.357102]]]"
@Pajaropolitico Jajajajaja....por el wc https://t.co/JJQvnNSWJj,Fri Sep 11 23:19:04 +0000 2020,"Iztapalapa, Distrito Federal","[[[-99.140238, 19.284692], [-99.140238, 19.400885], [-98.960684, 19.400885], [-98.960684, 19.284692]]]"
"@Zwarte_Magica Ik logeerde ooit in een pension met religieuze joden naast me, zij trokken na zonsondergang op vrijdag de WC niet meer door.",Sat Sep 12 14:54:33 +0000 2020,"Solidaridad, Quintana Roo","[[[-87.777003, 20.356869], [-87.777003, 20.812192], [-86.916961, 20.812192], [-86.916961, 20.356869]]]"
@RaKeLuZ Tú ve al WC y con eso.... https://t.co/juqnzrhJGf,Fri Sep 18 16:45:28 +0000 2020,"Tlajomulco de Zúñiga, Jalisco","[[[-103.616261, 20.358642], [-103.616261, 20.620776], [-103.198901, 20.620776], [-103.198901, 20.358642]]]"
Reparé la fuga que había en el tanque del WC y el rechinido de la puerta de entrada. https://t.co/vfPebwUBbB,Fri Sep 18 17:24:31 +0000 2020,"Culiacán, Sinaloa","[[[-107.806281, 24.028162], [-107.806281, 25.296815], [-106.877832, 25.296815], [-106.877832, 24.028162]]]"
"Creo que llego la época del año donde le piensas para sentarse en la taza del wc , esta bien pinche frío.",Sun Sep 20 02:45:28 +0000 2020,"Tlalpan, Distrito Federal","[[[-99.315748, 19.087511], [-99.315748, 19.311459], [-99.10098, 19.311459], [-99.10098, 19.087511]]]"
@SamCarballo2 Que es wc 🤔,Mon Sep 21 18:03:27 +0000 2020,"Nuevo Laredo, Tamaulipas","[[[-99.974343, 27.268162], [-99.974343, 27.679262], [-99.478795, 27.679262], [-99.478795, 27.268162]]]"
@dw_espanol Hemos hecho de nuestro mundo un gran wc dónde cagamos y comemos del mismo lugar,Tue Sep 22 16:06:15 +0000 2020,"Ecatepec de Morelos, México","[[[-99.118665, 19.484399], [-99.118665, 19.652161], [-98.970224, 19.652161], [-98.970224, 19.484399]]]"
"De  lavar el wc de la ofiii, Chely regresaaaaaaa te extrañamos 🥺",Wed Sep 23 16:59:36 +0000 2020,"Naranjos Amatlán, Veracruz de Ignacio de la Llave","[[[-97.794044, 21.255276], [-97.794044, 21.362232], [-97.580961, 21.362232], [-97.580961, 21.255276]]]"
@GemaFimbres Ir al wc aplica tambien.,Wed Sep 23 22:20:46 +0000 2020,"Cuauhtémoc, Chihuahua","[[[-107.272356, 28.337703], [-107.272356, 29.19785], [-106.544661, 29.19785], [-106.544661, 28.337703]]]"
Me tomó tiempo ver que no es un WC sino un bidé.... Qué alivio me dio xDD,Fri Sep 25 08:10:29 +0000 2020,"Tlalnepantla de Baz, México","[[[-99.248181, 19.498594], [-99.248181, 19.589272], [-99.080384, 19.589272], [-99.080384, 19.498594]]]"
Como cuando lo traes bien maduro💩 y estas a 15 metros de llegar al WC 🧻🚽 https://t.co/2JW1P48lkB,Fri Sep 25 18:48:25 +0000 2020,"Culiacán, Sinaloa","[[[-107.806281, 24.028162], [-107.806281, 25.296815], [-106.877832, 25.296815], [-106.877832, 24.028162]]]"
@CartonCalderon @lopezobrador_ Cuando esta en el WC por eso siempre la defeca en la gobernanza,Sat Sep 26 02:54:13 +0000 2020,"Kanasín, Yucatán","[[[-89.59537, 20.848144], [-89.59537, 20.982078], [-89.467618, 20.982078], [-89.467618, 20.848144]]]"
"@itzaBOOHthang @Padres Good chance he’ll be able to pitch for the wc series, he was tossing the ball a bit during today’s pregame",Sun Sep 27 07:35:23 +0000 2020,"Monterrey, Nuevo León","[[[-100.421037, 25.480538], [-100.421037, 25.802899], [-100.166146, 25.802899], [-100.166146, 25.480538]]]"
"Pues va a estar durisima la lucha por el WC en la NFC, Bucs, Cards, Rams, Bears, etc... La única division que no ti… https://t.co/CpvYaJwRlG",Mon Sep 28 00:25:37 +0000 2020,"Culiacán, Sinaloa","[[[-107.806281, 24.028162], [-107.806281, 25.296815], [-106.877832, 25.296815], [-106.877832, 24.028162]]]"
